ffff880134d1b0c0 2388466584 C Ii:1:001:1 0:2048 2 = 8000
ffff880134d1b0c0 2388466594 S Ii:1:001:1 -115:2048 4 <
ffff88010ce88240 2388466600 S Ci:1:001:0 s a3 00 0000 0007 0004 4 <
ffff88010ce88240 2388466607 C Ci:1:001:0 0 4 = 01050100
ffff88010ce88240 2388466610 S Co:1:001:0 s 23 01 0010 0007 0000 0
ffff88010ce88240 2388466612 C Co:1:001:0 0 0
ffff88010ce88240 2388466614 S Ci:1:001:0 s a3 00 0000 0007 0004 4 <
ffff88010ce88240 2388466615 C Ci:1:001:0 0 4 = 01050000
ffff88010ce88240 2388497487 S Ci:1:001:0 s a3 00 0000 0007 0004 4 <
ffff88010ce88240 2388497493 C Ci:1:001:0 0 4 = 01050000
ffff88010ce88240 2388529486 S Ci:1:001:0 s a3 00 0000 0007 0004 4 <
ffff88010ce88240 2388529491 C Ci:1:001:0 0 4 = 01050000
ffff88010ce88240 2388561717 S Ci:1:001:0 s a3 00 0000 0007 0004 4 <
ffff88010ce88240 2388561722 C Ci:1:001:0 0 4 = 01050000
ffff88010ce88240 2388593482 S Ci:1:001:0 s a3 00 0000 0007 0004 4 <
ffff88010ce88240 2388593486 C Ci:1:001:0 0 4 = 01050000
ffff88010ce88240 2388593495 S Co:1:001:0 s 23 03 0004 0007 0000 0
ffff88010ce88240 2388593498 C Co:1:001:0 0 0
ffff88010ce88240 2388649485 S Ci:1:001:0 s a3 00 0000 0007 0004 4 <
ffff88010ce88240 2388649783 C Ci:1:001:0 0 4 = 03051000
ffff88010ce88240 2388705485 S Co:1:001:0 s 23 01 0014 0007 0000 0
ffff88010ce88240 2388705490 C Co:1:001:0 0 0
ffff88010ce88240 2388705501 S Ci:1:000:0 s 80 06 0100 0000 0040 64 <
ffff88010ce88240 2388705657 C Ci:1:000:0 0 18 = 12010002 02000040 8d0e0020 00010102 0001
ffff88010ce88240 2388705664 S Co:1:001:0 s 23 03 0004 0007 0000 0
ffff88010ce88240 2388705668 C Co:1:001:0 0 0
ffff880044b310c0 2388761490 S Ci:1:001:0 s a3 00 0000 0007 0004 4 <
ffff880044b310c0 2388761781 C Ci:1:001:0 0 4 = 03051000
ffff880044b31240 2388817484 S Co:1:001:0 s 23 01 0014 0007 0000 0
ffff880044b31240 2388817490 C Co:1:001:0 0 0
ffff880044b31240 2388817493 S Co:1:000:0 s 00 05 001a 0000 0000 0
ffff880044b31240 2388817657 C Co:1:000:0 0 0
ffff88010ce88600 2388837483 S Ci:1:026:0 s 80 06 0100 0000 0012 18 <
ffff88010ce88600 2388837657 C Ci:1:026:0 0 18 = 12010002 02000040 8d0e0020 00010102 0001
ffff88010ce88600 2388837669 S Ci:1:026:0 s 80 06 0200 0000 0009 9 <
ffff88010ce88600 2388837781 C Ci:1:026:0 0 9 = 09024300 020103c0 fa
ffff880044b31240 2388837788 S Ci:1:026:0 s 80 06 0200 0000 0043 67 <
ffff880044b31240 2388837906 C Ci:1:026:0 0 67 = 09024300 020103c0 fa090400 00020a00 00040705 01020002 00070581 02000200
ffff88010ce889c0 2388837917 S Ci:1:026:0 s 80 06 0300 0000 00ff 255 <
ffff88010ce889c0 2388838031 C Ci:1:026:0 0 4 = 04030904
ffff880044b316c0 2388838038 S Ci:1:026:0 s 80 06 0302 0409 00ff 255 <
ffff880044b316c0 2388838155 C Ci:1:026:0 0 34 = 22034d00 54003600 35007800 78002000 50007200 65006c00 6f006100 64006500
ffff88010ce88e40 2388838163 S Ci:1:026:0 s 80 06 0301 0409 00ff 255 <
ffff88010ce88e40 2388838281 C Ci:1:026:0 0 18 = 12034d00 65006400 69006100 54006500 6b00
ffff88010ce88000 2388838410 S Co:1:026:0 s 00 09 0001 0000 0000 0
ffff88010ce88000 2388838530 C Co:1:026:0 0 0
ffff88010ce88000 2388840089 S Ci:1:026:0 s 80 06 0303 0409 00ff 255 <
ffff88010ce88000 2388851282 C Ci:1:026:0 0 52 = 34035500 53004200 20004300 44004300 20004100 43004d00 20006600 6f007200
ffff88012bfdd840 2388851325 S Ci:1:026:0 s 80 06 0304 0409 00ff 255 <
ffff88012bfdd840 2388871284 C Ci:1:026:0 0 46 = 2e034300 44004300 20004100 43004d00 20004400 61007400 61002000 49006e00
ffff88012bfdd3c0 2388871408 S Ci:1:026:0 s 80 06 0305 0409 00ff 255 <
ffff88012bfdd3c0 2388911286 C Ci:1:026:0 0 64 = 40034300 44004300 20004100 43004d00 20004300 6f006d00 6d007500 6e006900
ffff8800a70c9000 2388911479 S Co:1:026:0 s 21 22 0000 0001 0000 0
ffff8800a70c9000 2388931282 C Co:1:026:0 0 0
ffff8800a70c9000 2388931291 S Co:1:026:0 s 21 20 0000 0001 0007 7 = 80250000 000008
ffff8800a70c9000 2388971284 C Co:1:026:0 0 7 >
ffff88012bfddcc0 2388971463 S Ci:1:001:0 s a3 00 0000 0008 0004 4 <
ffff88012bfddcc0 2388971468 C Ci:1:001:0 0 4 = 00010000
ffff880044b316c0 2389022206 S Ci:1:026:0 s 80 06 0100 0000 0012 18 <
ffff880044b316c0 2389022408 C Ci:1:026:0 0 18 = 12010002 02000040 8d0e0020 00010102 0001
ffff880044b316c0 2389023062 S Ci:1:026:0 s 80 06 0200 0000 0009 9 <
ffff880044b316c0 2389023156 C Ci:1:026:0 0 9 = 09024300 020103c0 fa
ffff880044b316c0 2389023182 S Ci:1:026:0 s 80 06 0200 0000 0043 67 <
ffff880044b316c0 2389023281 C Ci:1:026:0 0 67 = 09024300 020103c0 fa090400 00020a00 00040705 01020002 00070581 02000200
ffff880044b31840 2389405030 S Ci:1:026:0 s 80 06 0100 0000 0040 64 <
ffff880044b31840 2389405158 C Ci:1:026:0 0 18 = 12010002 02000040 8d0e0020 00010102 0001
ffff88011ce4f0c0 2389584541 S Ci:1:026:0 s 80 06 0100 0000 0012 18 <
ffff88011ce4f0c0 2389584658 C Ci:1:026:0 0 18 = 12010002 02000040 8d0e0020 00010102 0001
ffff88011ce4f0c0 2389587532 S Ci:1:026:0 s 80 06 0200 0000 0009 9 <
ffff88011ce4f0c0 2389587656 C Ci:1:026:0 0 9 = 09024300 020103c0 fa
ffff88011ce4f0c0 2389590659 S Ci:1:026:0 s 80 06 0200 0000 00ff 255 <
ffff88011ce4f0c0 2389590781 C Ci:1:026:0 0 67 = 09024300 020103c0 fa090400 00020a00 00040705 01020002 00070581 02000200
ffff88011ce4f0c0 2389592878 S Ci:1:026:0 s 80 06 0300 0000 00ff 255 <
ffff88011ce4f0c0 2389593031 C Ci:1:026:0 0 4 = 04030904
ffff88011ce4f0c0 2389594476 S Ci:1:026:0 s 80 06 0302 0409 00ff 255 <
ffff88011ce4f0c0 2389594531 C Ci:1:026:0 0 34 = 22034d00 54003600 35007800 78002000 50007200 65006c00 6f006100 64006500
ffff88011ce4f0c0 2389596500 S Ci:1:026:0 s 80 06 0300 0000 00ff 255 <
ffff88011ce4f0c0 2389596656 C Ci:1:026:0 0 4 = 04030904
ffff88011ce4f0c0 2389598527 S Ci:1:026:0 s 80 06 0302 0409 00ff 255 <
ffff88011ce4f0c0 2389598657 C Ci:1:026:0 0 34 = 22034d00 54003600 35007800 78002000 50007200 65006c00 6f006100 64006500
ffff88011ce4f0c0 2389604447 S Ci:1:026:0 s 80 06 0100 0000 0012 18 <
ffff88011ce4f0c0 2389604532 C Ci:1:026:0 0 18 = 12010002 02000040 8d0e0020 00010102 0001
ffff88011ce4f0c0 2389609582 S Ci:1:026:0 s 80 06 0200 0000 0109 265 <
ffff88011ce4f0c0 2389609782 C Ci:1:026:0 0 67 = 09024300 020103c0 fa090400 00020a00 00040705 01020002 00070581 02000200
ffff880044b31840 2389672972 S Ci:1:026:0 s a1 21 0000 0001 0007 7 <
ffff880044b31840 2389673033 C Ci:1:026:0 0 7 = 00100e00 000008
ffff880044b31840 2389675965 S Co:1:026:0 s 21 22 0000 0001 0000 0
ffff880044b31840 2389676031 C Co:1:026:0 0 0
ffff880044b31840 2389681897 S Bi:1:026:1 -115 4096 <
ffff880044b31840 2389682032 C Bi:1:026:1 0 5 = 52454144 59
ffff880044b31840 2389688814 S Ii:1:026:3 -115:8192 10 <
ffff880044b31a80 2389688837 S Bi:1:026:1 -115 4096 <
ffff880044b31a80 2389701407 C Bi:1:026:1 0 5 = 52454144 59
ffff880044b31a80 2389705042 S Bi:1:026:1 -115 4096 <
ffff880044b31a80 2389721408 C Bi:1:026:1 0 5 = 52454144 59
ffff88011ce4f0c0 2389734071 S Bi:1:026:1 -115 4096 <
ffff88011ce4f0c0 2389741408 C Bi:1:026:1 0 5 = 52454144 59
ffff88011ce4f0c0 2389743036 S Bi:1:026:1 -115 4096 <
ffff88011ce4f0c0 2389761409 C Bi:1:026:1 0 5 = 52454144 59
ffff88011ce4f0c0 2389772097 S Bi:1:026:1 -115 4096 <
ffff88011ce4f0c0 2389781407 C Bi:1:026:1 0 5 = 52454144 59
ffff88011ce4f840 2389784092 S Bi:1:026:1 -115 4096 <
ffff88011ce4f840 2389801411 C Bi:1:026:1 0 5 = 52454144 59
ffff88011ce4f840 2389814398 S Bi:1:026:1 -115 4096 <
ffff88011ce4f840 2389821408 C Bi:1:026:1 0 5 = 52454144 59
ffff88011ce4f840 2389822142 S Bi:1:026:1 -115 4096 <
ffff88011ce4f840 2389841409 C Bi:1:026:1 0 5 = 52454144 59
ffff88011ce4f840 2389854477 S Bi:1:026:1 -115 4096 <
ffff88011ce4f840 2389861409 C Bi:1:026:1 0 5 = 52454144 59
ffff88011ce4f840 2389862928 S Bi:1:026:1 -115 4096 <
ffff88011ce4f840 2389881410 C Bi:1:026:1 0 5 = 52454144 59
ffff88011ce4f840 2389893653 S Bi:1:026:1 -115 4096 <
ffff88011ce4f840 2389901408 C Bi:1:026:1 0 5 = 52454144 59
ffff88011ce4f840 2389902744 S Bi:1:026:1 -115 4096 <
ffff88011ce4f840 2389921408 C Bi:1:026:1 0 5 = 52454144 59
ffff88011ce4f840 2389931674 S Bi:1:026:1 -115 4096 <
ffff88011ce4f840 2389941409 C Bi:1:026:1 0 5 = 52454144 59
ffff880044b31240 2389943671 S Bi:1:026:1 -115 4096 <
ffff880044b31240 2389961407 C Bi:1:026:1 0 5 = 52454144 59
ffff880044b31240 2389972733 S Bi:1:026:1 -115 4096 <
ffff880044b31240 2389981406 C Bi:1:026:1 0 5 = 52454144 59
ffff880044b31240 2389984731 S Bi:1:026:1 -115 4096 <
ffff880044b31240 2390001409 C Bi:1:026:1 0 5 = 52454144 59
ffff88011ce4fa80 2390009758 S Bi:1:026:1 -115 4096 <
ffff88011ce4fcc0 2390013540 S Ci:1:026:0 s a1 21 0000 0001 0007 7 <
ffff88011ce4fcc0 2390021409 C Ci:1:026:0 0 7 = 00100e00 000008
ffff88011ce4fa80 2390021416 C Bi:1:026:1 0 5 = 52454144 59
ffff880044b31180 2390024576 S Bi:1:026:1 -115 4096 <
ffff880044b31000 2390025342 S Ci:1:026:0 s a1 21 0000 0001 0007 7 <
ffff880044b31000 2390041407 C Ci:1:026:0 0 7 = 00100e00 000008
ffff880044b31180 2390041411 C Bi:1:026:1 0 5 = 52454144 59
ffff880044b31180 2390053709 S Bi:1:026:1 -115 4096 <
ffff880044b31000 2390055735 S Ci:1:026:0 s a1 21 0000 0001 0007 7 <
ffff880044b31000 2390061408 C Ci:1:026:0 0 7 = 00100e00 000008
ffff880044b31180 2390061411 C Bi:1:026:1 0 5 = 52454144 59
ffff880044b31180 2390064696 S Bi:1:026:1 -115 4096 <
ffff88011ce4f240 2390066720 S Ci:1:026:0 s a1 21 0000 0001 0007 7 <
ffff88011ce4f240 2390081413 C Ci:1:026:0 0 7 = 00100e00 000008
ffff880044b31180 2390081419 C Bi:1:026:1 0 5 = 52454144 59
ffff88011ce4f240 2390095779 S Bi:1:026:1 -115 4096 <
ffff88011ce4f900 2390098674 S Co:1:026:0 s 21 20 0000 0001 0007 7 = 00c20100 000008
ffff88011ce4f900 2390101407 C Co:1:026:0 0 7 >
ffff88011ce4f240 2390101412 C Bi:1:026:1 0 5 = 52454144 59
ffff880044b31000 2390102793 S Bi:1:026:1 -115 4096 <
ffff880044b316c0 2390102804 S Ci:1:026:0 s a1 21 0000 0001 0007 7 <
ffff880044b316c0 2390121412 C Ci:1:026:0 0 7 = 00100e00 000008
ffff880044b31000 2390121419 C Bi:1:026:1 0 5 = 52454144 59
ffff880044b31000 2390131860 S Bi:1:026:1 -115 4096 <
ffff880044b316c0 2390133744 S Co:1:026:0 s 21 22 0003 0001 0000 0
ffff880044b316c0 2390141407 C Co:1:026:0 0 0
ffff880044b31000 2390141410 C Bi:1:026:1 0 5 = 52454144 59
ffff88011ce4f540 2390142937 S Bi:1:026:1 -115 4096 <
ffff88011ce4f000 2390144785 S Co:1:026:0 s 21 20 0000 0001 0007 7 = 00100e00 000008
ffff88011ce4f000 2390161408 C Co:1:026:0 0 7 >
ffff88011ce4f540 2390161413 C Bi:1:026:1 0 5 = 52454144 59
ffff88011ce4f540 2390173744 S Bi:1:026:1 -115 4096 <
ffff88011ce4f000 2390174722 S Ci:1:026:0 s a1 21 0000 0001 0007 7 <
ffff88011ce4f000 2390181407 C Ci:1:026:0 0 7 = 00100e00 000008
ffff88011ce4f540 2390181412 C Bi:1:026:1 0 5 = 52454144 59
ffff88011ce4f540 2390183682 S Bi:1:026:1 -115 4096 <
ffff88011ce4f000 2390185711 S Co:1:026:0 s 21 23 0000 0001 0000 0
ffff88011ce4f000 2390201406 C Co:1:026:0 0 0
ffff88011ce4f540 2390201411 C Bi:1:026:1 0 5 = 52454144 59
ffff880044b31000 2390214766 S Bi:1:026:1 -115 4096 <
ffff880044b316c0 2390215780 S Co:1:026:0 s 21 22 0003 0001 0000 0
ffff880044b316c0 2390221406 C Co:1:026:0 0 0
ffff880044b31000 2390221409 C Bi:1:026:1 0 5 = 52454144 59
ffff880044b31000 2390224740 S Bi:1:026:1 -115 4096 <
ffff880044b316c0 2390234828 S Ci:1:026:0 s a1 21 0000 0001 0007 7 <
ffff880044b316c0 2390241407 C Ci:1:026:0 0 7 = 00100e00 000008
ffff880044b31000 2390241410 C Bi:1:026:1 0 5 = 52454144 59
ffff88011ce4f300 2390243685 S Bi:1:026:1 -115 4096 <
ffff88011ce4fd80 2390245709 S Ci:1:026:0 s a1 21 0000 0001 0007 7 <
ffff88011ce4fd80 2390261407 C Ci:1:026:0 0 7 = 00100e00 000008
ffff88011ce4f300 2390261412 C Bi:1:026:1 0 5 = 52454144 59
ffff880044b31180 2390274770 S Bi:1:026:1 -115 4096 <
ffff880044b31240 2390276794 S Ci:1:026:0 s a1 21 0000 0001 0007 7 <
ffff880044b31240 2390281407 C Ci:1:026:0 0 7 = 00100e00 000008
ffff880044b31180 2390281410 C Bi:1:026:1 0 5 = 52454144 59
ffff880044b31180 2390283729 S Bi:1:026:1 -115 4096 <
ffff880044b31240 2390284744 S Ci:1:026:0 s a1 21 0000 0001 0007 7 <
ffff880044b31240 2390301408 C Ci:1:026:0 0 7 = 00100e00 000008
ffff880044b31180 2390301412 C Bi:1:026:1 0 5 = 52454144 59
ffff88011ce4f300 2390313662 S Bi:1:026:1 -115 4096 <
ffff88011ce4fd80 2390316697 S Co:1:026:0 s 21 20 0000 0001 0007 7 = 004b0000 000008
ffff88011ce4fd80 2390321406 C Co:1:026:0 0 7 >
ffff88011ce4f300 2390321411 C Bi:1:026:1 0 5 = 52454144 59
ffff88011ce4f300 2390323775 S Bi:1:026:1 -115 4096 <
ffff88011ce4fd80 2390323785 S Ci:1:026:0 s a1 21 0000 0001 0007 7 <
ffff88011ce4fd80 2390341409 C Ci:1:026:0 0 7 = 00100e00 000008
ffff88011ce4f300 2390341415 C Bi:1:026:1 0 5 = 52454144 59
ffff88011ce4f300 2390352700 S Bi:1:026:1 -115 4096 <
ffff88011ce4fd80 2390354719 S Co:1:026:0 s 21 22 0003 0001 0000 0
ffff88011ce4fd80 2390361406 C Co:1:026:0 0 0
ffff88011ce4f300 2390361412 C Bi:1:026:1 0 5 = 52454144 59
ffff880044b31a80 2390363682 S Bi:1:026:1 -115 4096 <
ffff880044b31540 2390365708 S Co:1:026:0 s 21 20 0000 0001 0007 7 = 00100e00 000008
ffff880044b31540 2390381407 C Co:1:026:0 0 7 >
ffff880044b31a80 2390381411 C Bi:1:026:1 0 5 = 52454144 59
ffff88011ce4fc00 2390394764 S Bi:1:026:1 -115 4096 <
ffff88011ce4f300 2390395779 S Ci:1:026:0 s a1 21 0000 0001 0007 7 <
ffff88011ce4f300 2390401408 C Ci:1:026:0 0 7 = 00100e00 000008
ffff88011ce4fc00 2390401413 C Bi:1:026:1 0 5 = 52454144 59
ffff88011ce4fc00 2390404741 S Bi:1:026:1 -115 4096 <
ffff88011ce4f300 2390406768 S Co:1:026:0 s 21 22 0003 0001 0000 0
ffff88011ce4f300 2390421407 C Co:1:026:0 0 0
ffff88011ce4fc00 2390421412 C Bi:1:026:1 0 5 = 52454144 59
ffff88011ce4fc00 2390435685 S Bi:1:026:1 -115 4096 <
ffff88011ce4f300 2390436697 S Bo:1:026:1 -115 1 = a0
ffff88011ce4f300 2390436781 C Bo:1:026:1 0 1 >
ffff88011ce4fc00 2390441407 C Bi:1:026:1 0 5 = 52454144 59
ffff88011ce4fc00 2390443771 S Bi:1:026:1 -115 4096 <
ffff88011ce4f300 2390443781 S Ci:1:026:0 s a1 21 0000 0001 0007 7 <
ffff88011ce4f300 2390444032 C Ci:1:026:0 0 7 = 00100e00 000008
ffff88011ce4f300 2390446675 S Ci:1:026:0 s a1 21 0000 0001 0007 7 <
ffff88011ce4f300 2390446906 C Ci:1:026:0 0 7 = 00100e00 000008
ffff880044b319c0 2390449710 S Ci:1:026:0 s a1 21 0000 0001 0007 7 <
ffff880044b319c0 2390449781 C Ci:1:026:0 0 7 = 00100e00 000008
ffff880044b319c0 2390452742 S Ci:1:026:0 s a1 21 0000 0001 0007 7 <
ffff880044b319c0 2390452908 C Ci:1:026:0 0 7 = 00100e00 000008
ffff880044b319c0 2390456789 S Co:1:026:0 s 21 20 0000 0001 0007 7 = 00c20100 000008
ffff880044b319c0 2390456907 C Co:1:026:0 0 7 >
ffff880044b319c0 2390458676 S Ci:1:026:0 s a1 21 0000 0001 0007 7 <
ffff880044b319c0 2390458781 C Ci:1:026:0 0 7 = 00100e00 000008
ffff88011ce4fd80 2390461714 S Co:1:026:0 s 21 22 0003 0001 0000 0
ffff88011ce4fd80 2390461781 C Co:1:026:0 0 0
ffff88011ce4fd80 2390464745 S Co:1:026:0 s 21 20 0000 0001 0007 7 = 00100e00 000008
ffff88011ce4fd80 2390464906 C Co:1:026:0 0 7 >
ffff88011ce4fd80 2390466765 S Ci:1:026:0 s a1 21 0000 0001 0007 7 <
ffff88011ce4fd80 2390466906 C Ci:1:026:0 0 7 = 00100e00 000008
ffff88011ce4fd80 2390469661 S Co:1:026:0 s 21 22 0003 0001 0000 0
ffff88011ce4fd80 2390469780 C Co:1:026:0 0 0
ffff88011ce4fd80 2390471685 S Bo:1:026:1 -115 1 = a0
ffff88011ce4fd80 2390471780 C Bo:1:026:1 0 1 >
ffff88011ce4fc00 2390471785 C Bi:1:026:1 0 1 = 5f
ffff88011ce4fc00 2390474715 S Bi:1:026:1 -115 4096 <
ffff88011ce4fd80 2390474724 S Bo:1:026:1 -115 1 = 0a
ffff88011ce4fd80 2390474780 C Bo:1:026:1 0 1 >
ffff88011ce4fc00 2390474784 C Bi:1:026:1 0 1 = f5
ffff88011ce4fc00 2390477749 S Bi:1:026:1 -115 4096 <
ffff88011ce4fd80 2390477758 S Bo:1:026:1 -115 1 = 50
ffff88011ce4fd80 2390477905 C Bo:1:026:1 0 1 >
ffff88011ce4fc00 2390477910 C Bi:1:026:1 0 1 = af
ffff88011ce4fc00 2390480785 S Bi:1:026:1 -115 4096 <
ffff88011ce4fd80 2390480823 S Bo:1:026:1 -115 1 = 05
ffff88011ce4fd80 2390480905 C Bo:1:026:1 0 1 >
ffff88011ce4fc00 2390480910 C Bi:1:026:1 0 1 = fa
ffff880044b319c0 2390483683 S Bi:1:026:1 -115 4096 <
ffff880044b31a80 2390483693 S Bo:1:026:1 -115 1 = fd
ffff880044b31a80 2390483780 C Bo:1:026:1 0 1 >
ffff880044b319c0 2390483786 C Bi:1:026:1 0 1 = fd
ffff880044b319c0 2390486718 S Bi:1:026:1 -115 4096 <
ffff880044b319c0 2390486780 C Bi:1:026:1 0 2 = 6575
ffff88011ce4f540 2390489755 S Bi:1:026:1 -115 4096 <
ffff88011ce4f540 2390489782 C Bi:1:026:1 0 2 = 0000
ffff88011ce4f540 2390492790 S Bi:1:026:1 -115 4096 <
ffff88011ce4f000 2390492800 S Bo:1:026:1 -115 1 = fc
ffff88011ce4f000 2390492906 C Bo:1:026:1 0 1 >
ffff88011ce4f540 2390492910 C Bi:1:026:1 0 1 = fc
ffff88011ce4f540 2390495677 S Bi:1:026:1 -115 4096 <
ffff88011ce4f540 2390495781 C Bi:1:026:1 0 2 = 8b00
ffff88011ce4f540 2390498715 S Bi:1:026:1 -115 4096 <
ffff88011ce4f540 2390498782 C Bi:1:026:1 0 2 = cb00
ffff88011ce4f540 2390501748 S Bi:1:026:1 -115 4096 <
ffff88011ce4f540 2390501783 C Bi:1:026:1 0 2 = e201
ffff88011ce4f540 2390505544 S Bi:1:026:1 -115 4096 <
ffff88011ce4f540 2390505657 C Bi:1:026:1 0 2 = 0000
ffff88011ce4f540 2390508948 S Bi:1:026:1 -115 4096 <
ffff88011ce4f000 2390509939 S Bo:1:026:1 -115 1 = d1
ffff88011ce4f000 2390510031 C Bo:1:026:1 0 1 >
ffff88011ce4f540 2390510036 C Bi:1:026:1 0 1 = d1
ffff880044b319c0 2390518499 S Bi:1:026:1 -115 4096 <
ffff88011ce4f540 2390521034 S Bo:1:026:1 -115 4 = c0009024
ffff88011ce4f540 2390521157 C Bo:1:026:1 0 4 >
ffff880044b319c0 2390521160 C Bi:1:026:1 0 4 = c0009024
ffff88011ce4f540 2390524061 S Bi:1:026:1 -115 4096 <
ffff88011ce4f000 2390534053 S Bo:1:026:1 -115 4 = 00000001
ffff88011ce4f000 2390534156 C Bo:1:026:1 0 4 >
ffff88011ce4f540 2390534160 C Bi:1:026:1 0 4 = 00000001
ffff88011ce4f540 2390537076 S Bi:1:026:1 -115 4096 <
ffff88011ce4f540 2390537156 C Bi:1:026:1 0 2 = 0000
ffff880044b31a80 2390540117 S Bi:1:026:1 -115 4096 <
ffff880044b31a80 2390540155 C Bi:1:026:1 0 4 = 0300771f
ffff88011ce4f540 2390545515 S Bi:1:026:1 -115 4096 <
ffff88011ce4f540 2390545658 C Bi:1:026:1 0 2 = 0000
ffff88011ce4f540 2390548044 S Bi:1:026:1 -115 4096 <
ffff88011ce4f000 2390548069 S Bo:1:026:1 -115 1 = b0
ffff88011ce4f000 2390548155 C Bo:1:026:1 0 1 >
ffff88011ce4f540 2390548159 C Bi:1:026:1 0 1 = b0
ffff88011ce4f540 2390551081 S Bi:1:026:1 -115 4096 <
ffff88011ce4f540 2390551158 C Bi:1:026:1 0 2 = 0000
ffff88011ce4f540 2390554109 S Bi:1:026:1 -115 4096 <
ffff88011ce4f000 2390564127 S Bo:1:026:1 -115 1 = b4
ffff88011ce4f000 2390564156 C Bo:1:026:1 0 1 >
ffff88011ce4f540 2390564282 C Bi:1:026:1 0 1 = b4
ffff88011ce4f540 2390566990 S Bi:1:026:1 -115 4096 <
ffff88011ce4f000 2390570352 S Bo:1:026:1 -115 4 = 00000000
ffff88011ce4f000 2390570405 C Bo:1:026:1 0 4 >
ffff88011ce4f540 2390570409 C Bi:1:026:1 0 4 = 00000000
ffff88011ce4f540 2390573061 S Bi:1:026:1 -115 4096 <
ffff88011ce4f000 2390583046 S Bo:1:026:1 -115 4 = 00000064
ffff88011ce4f000 2390583155 C Bo:1:026:1 0 4 >
ffff88011ce4f540 2390583159 C Bi:1:026:1 0 4 = 00000064
ffff88011ce4f540 2390586070 S Bi:1:026:1 -115 4096 <
ffff88011ce4f540 2390586156 C Bi:1:026:1 0 2 = 0000
ffff88011ce4f540 2390589103 S Bi:1:026:1 -115 4096 <
ffff88011ce4f540 2390589156 C Bi:1:026:1 0 2 = 0000
ffff88011ce4f540 2390592002 S Bi:1:026:1 -115 4096 <
ffff88011ce4f000 2390592010 S Bo:1:026:1 -115 1 = b2
ffff88011ce4f000 2390592155 C Bo:1:026:1 0 1 >
ffff88011ce4f540 2390592159 C Bi:1:026:1 0 1 = b2
ffff88011ce4f540 2390595035 S Bi:1:026:1 -115 4096 <
ffff880044b31a80 2390605122 S Bo:1:026:1 -115 4 = 000000c0
ffff880044b31a80 2390605155 C Bo:1:026:1 0 4 >
ffff88011ce4f540 2390605283 C Bi:1:026:1 0 4 = 000000c0
ffff880044b31a80 2390608046 S Bi:1:026:1 -115 4096 <
ffff880044b31540 2390611084 S Bo:1:026:1 -115 4 = 00000001
ffff880044b31540 2390611155 C Bo:1:026:1 0 4 >
ffff880044b31a80 2390611158 C Bi:1:026:1 0 4 = 00000001
ffff88011ce4f000 2390614106 S Bi:1:026:1 -115 4096 <
ffff88011ce4f000 2390614158 C Bi:1:026:1 0 2 = 0000
ffff88011ce4f000 2390617010 S Bi:1:026:1 -115 4096 <
ffff88011ce4f240 2390620382 S Bo:1:026:1 -115 1 = 28
ffff88011ce4f240 2390620531 C Bo:1:026:1 0 1 >
ffff88011ce4f000 2390620656 C Bi:1:026:1 0 2 = 0000
ffff88011ce4f000 2390623083 S Bi:1:026:1 -115 4096 <
ffff88011ce4f240 2390623092 S Bo:1:026:1 -115 1 = b3
ffff88011ce4f240 2390623156 C Bo:1:026:1 0 1 >
ffff88011ce4f000 2390623160 C Bi:1:026:1 0 1 = b3
ffff88011ce4f000 2390626109 S Bi:1:026:1 -115 4096 <
ffff880044b31180 2390631048 S Bo:1:026:1 -115 4 = 000000c0
ffff880044b31180 2390631155 C Bo:1:026:1 0 4 >
ffff88011ce4f000 2390631159 C Bi:1:026:1 0 4 = 000000c0
ffff88011ce4f240 2390635170 S Bi:1:026:1 -115 4096 <
ffff88011ce4f900 2390640341 S Bo:1:026:1 -115 4 = 00000001
ffff88011ce4f900 2390640405 C Bo:1:026:1 0 4 >
ffff88011ce4f240 2390640410 C Bi:1:026:1 0 4 = 00000001
ffff88011ce4f240 2390644039 S Bi:1:026:1 -115 4096 <
ffff88011ce4f240 2390644157 C Bi:1:026:1 0 2 = 0000
ffff88011ce4f240 2390647073 S Bi:1:026:1 -115 4096 <
ffff88011ce4f240 2390647157 C Bi:1:026:1 0 2 = 0000
ffff88011ce4f240 2390650102 S Bi:1:026:1 -115 4096 <
ffff88011ce4f240 2390650159 C Bi:1:026:1 0 1 = 02
ffff88011ce4f240 2390653014 S Bi:1:026:1 -115 4096 <
ffff88011ce4f900 2390653023 S Bo:1:026:1 -115 1 = b1
ffff88011ce4f900 2390653155 C Bo:1:026:1 0 1 >
ffff88011ce4f240 2390653159 C Bi:1:026:1 0 1 = b1
ffff88011ce4f240 2390656049 S Bi:1:026:1 -115 4096 <
ffff88011ce4f240 2390656157 C Bi:1:026:1 0 2 = 0000
ffff880044b31180 2390659085 S Bi:1:026:1 -115 4096 <
ffff880044b31240 2390663040 S Bo:1:026:1 -115 1 = fe
ffff880044b31240 2390663158 C Bo:1:026:1 0 1 >
ffff880044b31180 2390663161 C Bi:1:026:1 0 1 = 01
ffff880044b31180 2390665564 S Bi:1:026:1 -115 4096 <
ffff880044b31240 2390665603 S Bo:1:026:1 -115 1 = d0
ffff880044b31240 2390665655 C Bo:1:026:1 0 1 >
ffff880044b31180 2390665658 C Bi:1:026:1 0 1 = d0
ffff880044b31180 2390674385 S Bi:1:026:1 -115 4096 <
ffff880044b31240 2390674924 S Bo:1:026:1 -115 4 = c0000000
ffff880044b31240 2390675031 C Bo:1:026:1 0 4 >
ffff880044b31180 2390675034 C Bi:1:026:1 0 4 = c0000000
ffff88011ce4f240 2390677928 S Bi:1:026:1 -115 4096 <
ffff88011ce4f900 2390680964 S Bo:1:026:1 -115 4 = 00000001
ffff88011ce4f900 2390681030 C Bo:1:026:1 0 4 >
ffff88011ce4f240 2390681035 C Bi:1:026:1 0 4 = 00000001
ffff88011ce4f240 2390683999 S Bi:1:026:1 -115 4096 <
ffff88011ce4f240 2390684032 C Bi:1:026:1 0 2 = 0000
ffff88011ce4f240 2390686896 S Bi:1:026:1 -115 4096 <
ffff88011ce4f240 2390687031 C Bi:1:026:1 0 2 = 0061
ffff88011ce4f240 2390690009 S Bi:1:026:1 -115 4096 <
ffff88011ce4f240 2390690159 C Bi:1:026:1 0 2 = 0000
ffff88011ce4f240 2390692967 S Bi:1:026:1 -115 4096 <
ffff88011ce4f900 2390692976 S Bo:1:026:1 -115 1 = d0
ffff88011ce4f900 2390693030 C Bo:1:026:1 0 1 >
ffff88011ce4f240 2390693034 C Bi:1:026:1 0 1 = d0
ffff880044b31000 2390696005 S Bi:1:026:1 -115 4096 <
ffff88011ce4fa80 2390700923 S Bo:1:026:1 -115 4 = c0000004
ffff88011ce4fa80 2390701030 C Bo:1:026:1 0 4 >
ffff880044b31000 2390701033 C Bi:1:026:1 0 4 = c0000004
ffff88011ce4fa80 2390704962 S Bi:1:026:1 -115 4096 <
ffff88011ce4fcc0 2390714952 S Bo:1:026:1 -115 4 = 00000001
ffff88011ce4fcc0 2390715031 C Bo:1:026:1 0 4 >
ffff88011ce4fa80 2390715036 C Bi:1:026:1 0 4 = 00000001
ffff88011ce4fa80 2390717977 S Bi:1:026:1 -115 4096 <
ffff88011ce4fa80 2390718032 C Bi:1:026:1 0 2 = 0000
ffff88011ce4fa80 2390721012 S Bi:1:026:1 -115 4096 <
ffff88011ce4fa80 2390721156 C Bi:1:026:1 0 2 = 5000
ffff880044b316c0 2390723906 S Bi:1:026:1 -115 4096 <
ffff880044b316c0 2390724030 C Bi:1:026:1 0 2 = 0000
ffff88011ce4fa80 2390729513 S Bi:1:026:1 -115 4096 <
ffff88011ce4fcc0 2390729523 S Bo:1:026:1 -115 1 = d0
ffff88011ce4fcc0 2390729655 C Bo:1:026:1 0 1 >
ffff88011ce4fa80 2390729661 C Bi:1:026:1 0 1 = d0
ffff88011ce4fa80 2390732046 S Bi:1:026:1 -115 4096 <
ffff880044b316c0 2390742033 S Bo:1:026:1 -115 4 = c0000008
ffff880044b316c0 2390742156 C Bo:1:026:1 0 4 >
ffff88011ce4fa80 2390742160 C Bi:1:026:1 0 4 = c0000008
ffff880044b316c0 2390745061 S Bi:1:026:1 -115 4096 <
ffff88011ce4fcc0 2390750582 S Bo:1:026:1 -115 4 = 00000001
ffff88011ce4fcc0 2390750655 C Bo:1:026:1 0 4 >
ffff880044b316c0 2390750658 C Bi:1:026:1 0 4 = 00000001
ffff880044b316c0 2390754019 S Bi:1:026:1 -115 4096 <
ffff880044b316c0 2390754155 C Bi:1:026:1 0 2 = 0000
ffff88011ce4fcc0 2390757563 S Bi:1:026:1 -115 4096 <
ffff88011ce4fcc0 2390757665 C Bi:1:026:1 0 2 = 0000
ffff88011ce4fcc0 2390760083 S Bi:1:026:1 -115 4096 <
ffff88011ce4fcc0 2390760156 C Bi:1:026:1 0 2 = 0000
ffff88011ce4fcc0 2390762992 S Bi:1:026:1 -115 4096 <
ffff88011ce4f840 2390763002 S Bo:1:026:1 -115 1 = d0
ffff88011ce4f840 2390763031 C Bo:1:026:1 0 1 >
ffff88011ce4fcc0 2390763156 C Bi:1:026:1 0 1 = d0
ffff88011ce4fcc0 2390766026 S Bi:1:026:1 -115 4096 <
ffff88011ce4f840 2390770948 S Bo:1:026:1 -115 4 = c000000c
ffff88011ce4f840 2390771030 C Bo:1:026:1 0 4 >
ffff88011ce4fcc0 2390771034 C Bi:1:026:1 0 4 = c000000c
ffff88011ce4fcc0 2390774987 S Bi:1:026:1 -115 4096 <
ffff88011ce4f840 2390784976 S Bo:1:026:1 -115 4 = 00000001
ffff88011ce4f840 2390785031 C Bo:1:026:1 0 4 >
ffff88011ce4fcc0 2390785035 C Bi:1:026:1 0 4 = 00000001
ffff880044b316c0 2390788214 S Bi:1:026:1 -115 4096 <
ffff880044b316c0 2390788280 C Bi:1:026:1 0 2 = 0000
ffff880044b316c0 2390791031 S Bi:1:026:1 -115 4096 <
ffff880044b316c0 2390791154 C Bi:1:026:1 0 2 = 0000
ffff880044b316c0 2390794060 S Bi:1:026:1 -115 4096 <
ffff880044b316c0 2390794156 C Bi:1:026:1 0 2 = 0000
ffff88011ce4fcc0 2390796976 S Bi:1:026:1 -115 4096 <
ffff88011ce4f840 2390796986 S Bo:1:026:1 -115 1 = d0
ffff88011ce4f840 2390797030 C Bo:1:026:1 0 1 >
ffff88011ce4fcc0 2390797034 C Bi:1:026:1 0 1 = d0
ffff88011ce4fcc0 2390800000 S Bi:1:026:1 -115 4096 <
ffff88011ce4f840 2390801019 S Bo:1:026:1 -115 4 = c0000010
ffff88011ce4f840 2390801156 C Bo:1:026:1 0 4 >
ffff88011ce4fcc0 2390801160 C Bi:1:026:1 0 4 = c0000010
ffff88011ce4fcc0 2390804047 S Bi:1:026:1 -115 4096 <
ffff88011ce4f840 2390814031 S Bo:1:026:1 -115 4 = 00000001
ffff88011ce4f840 2390814156 C Bo:1:026:1 0 4 >
ffff88011ce4fcc0 2390814160 C Bi:1:026:1 0 4 = 00000001
ffff880044b31000 2390817056 S Bi:1:026:1 -115 4096 <
ffff880044b31000 2390817157 C Bi:1:026:1 0 2 = 0000
ffff88011ce4f180 2390819950 S Bi:1:026:1 -115 4096 <
ffff88011ce4f180 2390820032 C Bi:1:026:1 0 2 = 07fc
ffff88011ce4f180 2390822990 S Bi:1:026:1 -115 4096 <
ffff88011ce4f180 2390823031 C Bi:1:026:1 0 2 = 0000
ffff88011ce4f180 2390826024 S Bi:1:026:1 -115 4096 <
ffff88011ce4f0c0 2390826034 S Bo:1:026:1 -115 1 = d0
ffff88011ce4f0c0 2390826156 C Bo:1:026:1 0 1 >
ffff88011ce4f180 2390826160 C Bi:1:026:1 0 1 = d0
ffff88011ce4f180 2390829056 S Bi:1:026:1 -115 4096 <
ffff88011ce4f0c0 2390831957 S Bo:1:026:1 -115 4 = c0000014
ffff88011ce4f0c0 2390832033 C Bo:1:026:1 0 4 >
ffff88011ce4f180 2390832037 C Bi:1:026:1 0 4 = c0000014
ffff88011ce4f180 2390834988 S Bi:1:026:1 -115 4096 <
ffff880044b31180 2390844981 S Bo:1:026:1 -115 4 = 00000001
ffff880044b31180 2390845032 C Bo:1:026:1 0 4 >
ffff88011ce4f180 2390845036 C Bi:1:026:1 0 4 = 00000001
ffff880044b31180 2390848253 S Bi:1:026:1 -115 4096 <
ffff880044b31180 2390848283 C Bi:1:026:1 0 2 = 0000
ffff880044b31180 2390851271 S Bi:1:026:1 -115 4096 <
ffff880044b31180 2390851406 C Bi:1:026:1 0 2 = 0000
ffff880044b31180 2390854017 S Bi:1:026:1 -115 4096 <
ffff880044b31180 2390854160 C Bi:1:026:1 0 2 = 0000
ffff880044b31180 2390856963 S Bi:1:026:1 -115 4096 <
ffff880044b31240 2390857044 S Bo:1:026:1 -115 1 = d0
ffff880044b31240 2390857155 C Bo:1:026:1 0 1 >
ffff880044b31180 2390857160 C Bi:1:026:1 0 1 = d0
ffff880044b31180 2390859998 S Bi:1:026:1 -115 4096 <
ffff880044b31240 2390861110 S Bo:1:026:1 -115 4 = c0000018
ffff880044b31240 2390861155 C Bo:1:026:1 0 4 >
ffff880044b31180 2390861159 C Bi:1:026:1 0 4 = c0000018
ffff880044b31180 2390864047 S Bi:1:026:1 -115 4096 <
ffff88011ce4f780 2390874032 S Bo:1:026:1 -115 4 = 00000001
ffff88011ce4f780 2390874155 C Bo:1:026:1 0 4 >
ffff880044b31180 2390874159 C Bi:1:026:1 0 4 = 00000001
ffff88011ce4f780 2390877056 S Bi:1:026:1 -115 4096 <
ffff88011ce4f780 2390877157 C Bi:1:026:1 0 2 = 0000
ffff88011ce4f780 2390879951 S Bi:1:026:1 -115 4096 <
ffff88011ce4f780 2390880032 C Bi:1:026:1 0 2 = 0000
ffff88011ce4f780 2390882989 S Bi:1:026:1 -115 4096 <
ffff88011ce4f780 2390883031 C Bi:1:026:1 0 2 = 0000
ffff880044b31240 2390886022 S Bi:1:026:1 -115 4096 <
ffff880044b31a80 2390886032 S Bo:1:026:1 -115 1 = d2
ffff880044b31a80 2390886156 C Bo:1:026:1 0 1 >
ffff880044b31240 2390886160 C Bi:1:026:1 0 1 = d2
ffff88011ce4f600 2390889058 S Bi:1:026:1 -115 4096 <
ffff88011ce4f780 2390891959 S Bo:1:026:1 -115 4 = c0000000
ffff88011ce4f780 2390892030 C Bo:1:026:1 0 4 >
ffff88011ce4f600 2390892035 C Bi:1:026:1 0 4 = c0000000
ffff88011ce4f600 2390894990 S Bi:1:026:1 -115 4096 <
ffff88011ce4f780 2390904974 S Bo:1:026:1 -115 4 = 00000001
ffff88011ce4f780 2390905030 C Bo:1:026:1 0 4 >
ffff88011ce4f600 2390905034 C Bi:1:026:1 0 4 = 00000001
ffff88011ce4f600 2390907995 S Bi:1:026:1 -115 4096 <
ffff88011ce4f600 2390908031 C Bi:1:026:1 0 2 = 0000
ffff88011ce4f600 2390911029 S Bi:1:026:1 -115 4096 <
ffff88011ce4f780 2390911067 S Bo:1:026:1 -115 2 = 2200
ffff88011ce4f780 2390911155 C Bo:1:026:1 0 2 >
ffff88011ce4f600 2390911160 C Bi:1:026:1 0 2 = 2200
ffff88011ce4f600 2390914058 S Bi:1:026:1 -115 4096 <
ffff88011ce4f600 2390914157 C Bi:1:026:1 0 2 = 0000
ffff880044b31240 2390916963 S Bi:1:026:1 -115 4096 <
ffff880044b31a80 2390922032 S Bo:1:026:1 -115 1 = d0
ffff880044b31a80 2390922156 C Bo:1:026:1 0 1 >
ffff880044b31240 2390922161 C Bi:1:026:1 0 1 = d0
ffff880044b31240 2390925931 S Bi:1:026:1 -115 4096 <
ffff88011ce4f780 2390930998 S Bo:1:026:1 -115 4 = c1003000
ffff88011ce4f780 2390931031 C Bo:1:026:1 0 4 >
ffff880044b31240 2390931156 C Bi:1:026:1 0 4 = c1003000
ffff880044b31240 2390935038 S Bi:1:026:1 -115 4096 <
ffff880044b31a80 2390945025 S Bo:1:026:1 -115 4 = 00000001
ffff880044b31a80 2390945155 C Bo:1:026:1 0 4 >
ffff880044b31240 2390945159 C Bi:1:026:1 0 4 = 00000001
ffff88011ce4f180 2390948047 S Bi:1:026:1 -115 4096 <
ffff88011ce4f180 2390948158 C Bi:1:026:1 0 2 = 0000
ffff88011ce4f180 2390951197 S Bi:1:026:1 -115 4096 <
ffff88011ce4f180 2390951282 C Bi:1:026:1 0 2 = 000d
ffff88011ce4f180 2390953976 S Bi:1:026:1 -115 4096 <
ffff88011ce4f180 2390954033 C Bi:1:026:1 0 2 = 0000
ffff88011ce4f180 2390957008 S Bi:1:026:1 -115 4096 <
ffff88011ce4f0c0 2390957017 S Bo:1:026:1 -115 1 = d0
ffff88011ce4f0c0 2390957155 C Bo:1:026:1 0 1 >
ffff88011ce4f180 2390957159 C Bi:1:026:1 0 1 = d0
ffff88011ce4f180 2390960042 S Bi:1:026:1 -115 4096 <
ffff88011ce4f0c0 2390961467 S Bo:1:026:1 -115 4 = c1003050
ffff88011ce4f0c0 2390961530 C Bo:1:026:1 0 4 >
ffff88011ce4f180 2390961533 C Bi:1:026:1 0 4 = c1003050
ffff88011ce4fcc0 2390963954 S Bi:1:026:1 -115 4096 <
ffff88011ce4f840 2390974057 S Bo:1:026:1 -115 4 = 00000001
ffff88011ce4f840 2390974156 C Bo:1:026:1 0 4 >
ffff88011ce4fcc0 2390974162 C Bi:1:026:1 0 4 = 00000001
ffff88011ce4fcc0 2390977119 S Bi:1:026:1 -115 4096 <
ffff88011ce4fcc0 2390977157 C Bi:1:026:1 0 2 = 0000
ffff880044b31240 2390980001 S Bi:1:026:1 -115 4096 <
ffff880044b31240 2390980157 C Bi:1:026:1 0 2 = a357
ffff880044b31240 2390983033 S Bi:1:026:1 -115 4096 <
ffff880044b31240 2390983157 C Bi:1:026:1 0 2 = 0000
ffff880044b31240 2390986057 S Bi:1:026:1 -115 4096 <
ffff880044b31a80 2390986067 S Bo:1:026:1 -115 1 = d0
ffff880044b31a80 2390986156 C Bo:1:026:1 0 1 >
ffff880044b31240 2390986160 C Bi:1:026:1 0 1 = d0
ffff880044b31240 2390988966 S Bi:1:026:1 -115 4096 <
ffff880044b31a80 2390992001 S Bo:1:026:1 -115 4 = c1003054
ffff880044b31a80 2390992031 C Bo:1:026:1 0 4 >
ffff880044b31240 2390992156 C Bi:1:026:1 0 4 = c1003054
ffff88011ce4fcc0 2390995034 S Bi:1:026:1 -115 4096 <
ffff880044b31240 2391005022 S Bo:1:026:1 -115 4 = 00000001
ffff880044b31240 2391005156 C Bo:1:026:1 0 4 >
ffff88011ce4fcc0 2391005162 C Bi:1:026:1 0 4 = 00000001
ffff880044b31240 2391008046 S Bi:1:026:1 -115 4096 <
ffff880044b31240 2391008157 C Bi:1:026:1 0 2 = 0000
ffff88011ce4f840 2391011106 S Bi:1:026:1 -115 4096 <
ffff88011ce4f840 2391011157 C Bi:1:026:1 0 2 = 67d2
ffff88011ce4f840 2391013977 S Bi:1:026:1 -115 4096 <
ffff88011ce4f840 2391014034 C Bi:1:026:1 0 2 = 0000
ffff88011ce4f840 2391017011 S Bi:1:026:1 -115 4096 <
ffff88011ce4fa80 2391017021 S Bo:1:026:1 -115 1 = d2
ffff88011ce4fa80 2391017155 C Bo:1:026:1 0 1 >
ffff88011ce4f840 2391017159 C Bi:1:026:1 0 1 = d2
ffff88011ce4f840 2391020047 S Bi:1:026:1 -115 4096 <
ffff88011ce4fa80 2391021401 S Bo:1:026:1 -115 4 = c1003068
ffff88011ce4fa80 2391021531 C Bo:1:026:1 0 4 >
ffff88011ce4f840 2391021535 C Bi:1:026:1 0 4 = c1003068
ffff880044b31a80 2391023954 S Bi:1:026:1 -115 4096 <
ffff88011ce4f840 2391034068 S Bo:1:026:1 -115 4 = 00000001
ffff88011ce4f840 2391034156 C Bo:1:026:1 0 4 >
ffff880044b31a80 2391034161 C Bi:1:026:1 0 4 = 00000001
ffff88011ce4f840 2391036963 S Bi:1:026:1 -115 4096 <
ffff88011ce4f840 2391037032 C Bi:1:026:1 0 2 = 0000
ffff880044b31540 2391040000 S Bi:1:026:1 -115 4096 <
ffff880044b319c0 2391041329 S Bo:1:026:1 -115 2 = 586a
ffff880044b319c0 2391041406 C Bo:1:026:1 0 2 >
ffff880044b31540 2391041410 C Bi:1:026:1 0 2 = 586a
ffff880044b31540 2391044043 S Bi:1:026:1 -115 4096 <
ffff880044b31540 2391044157 C Bi:1:026:1 0 2 = 0000
ffff880044b31540 2391046941 S Bi:1:026:1 -115 4096 <
ffff880044b319c0 2391052004 S Bo:1:026:1 -115 1 = d2
ffff880044b319c0 2391052156 C Bo:1:026:1 0 1 >
ffff880044b31540 2391052160 C Bi:1:026:1 0 1 = d2
ffff880044b31540 2391056044 S Bi:1:026:1 -115 4096 <
ffff88011ce4f840 2391066031 S Bo:1:026:1 -115 4 = c1003074
ffff88011ce4f840 2391066156 C Bo:1:026:1 0 4 >
ffff880044b31540 2391066160 C Bi:1:026:1 0 4 = c1003074
ffff88011ce4f840 2391071705 S Bi:1:026:1 -115 4096 <
ffff88011ce4fa80 2391072281 S Bo:1:026:1 -115 4 = 00000001
ffff88011ce4fa80 2391072407 C Bo:1:026:1 0 4 >
ffff88011ce4f840 2391072412 C Bi:1:026:1 0 4 = 00000001
ffff88011ce4f840 2391075248 S Bi:1:026:1 -115 4096 <
ffff88011ce4f840 2391075281 C Bi:1:026:1 0 2 = 0000
ffff88011ce4f840 2391078280 S Bi:1:026:1 -115 4096 <
ffff880044b319c0 2391081318 S Bo:1:026:1 -115 2 = 0001
ffff880044b319c0 2391081406 C Bo:1:026:1 0 2 >
ffff88011ce4f840 2391081410 C Bi:1:026:1 0 2 = 0001
ffff880044b319c0 2391084206 S Bi:1:026:1 -115 4096 <
ffff880044b319c0 2391084283 C Bi:1:026:1 0 2 = 0000
ffff880044b319c0 2391087247 S Bi:1:026:1 -115 4096 <
ffff880044b31540 2391092312 S Bo:1:026:1 -115 1 = d0
ffff880044b31540 2391092405 C Bo:1:026:1 0 1 >
ffff880044b319c0 2391092409 C Bi:1:026:1 0 1 = d0
ffff88011ce4fa80 2391096213 S Bi:1:026:1 -115 4096 <
ffff880044b31a80 2391101279 S Bo:1:026:1 -115 4 = c1003000
ffff880044b31a80 2391101406 C Bo:1:026:1 0 4 >
ffff88011ce4fa80 2391101411 C Bi:1:026:1 0 4 = c1003000
ffff880044b31a80 2391105312 S Bi:1:026:1 -115 4096 <
ffff880044b31240 2391115301 S Bo:1:026:1 -115 4 = 00000001
ffff880044b31240 2391115406 C Bo:1:026:1 0 4 >
ffff880044b31a80 2391115410 C Bi:1:026:1 0 4 = 00000001
ffff880044b31a80 2391118315 S Bi:1:026:1 -115 4096 <
ffff880044b31a80 2391118407 C Bi:1:026:1 0 2 = 0000
ffff880044b31a80 2391121252 S Bi:1:026:1 -115 4096 <
ffff880044b31a80 2391121281 C Bi:1:026:1 0 2 = 000d
ffff880044b31a80 2391124255 S Bi:1:026:1 -115 4096 <
ffff880044b31a80 2391124406 C Bi:1:026:1 0 2 = 0000
ffff880044b31a80 2391127289 S Bi:1:026:1 -115 4096 <
ffff880044b31240 2391127327 S Bo:1:026:1 -115 1 = d2
ffff880044b31240 2391127405 C Bo:1:026:1 0 1 >
ffff880044b31a80 2391127409 C Bi:1:026:1 0 1 = d2
ffff880044b31180 2391130362 S Bi:1:026:1 -115 4096 <
ffff880044b31000 2391131203 S Bo:1:026:1 -115 4 = c1003068
ffff880044b31000 2391131282 C Bo:1:026:1 0 4 >
ffff880044b31180 2391131286 C Bi:1:026:1 0 4 = c1003068
ffff880044b31180 2391134233 S Bi:1:026:1 -115 4096 <
ffff880044b31000 2391144217 S Bo:1:026:1 -115 4 = 00000001
ffff880044b31000 2391144280 C Bo:1:026:1 0 4 >
ffff880044b31180 2391144284 C Bi:1:026:1 0 4 = 00000001
ffff880044b31180 2391147247 S Bi:1:026:1 -115 4096 <
ffff880044b31180 2391147282 C Bi:1:026:1 0 2 = 0000
ffff88011ce4f240 2391150277 S Bi:1:026:1 -115 4096 <
ffff88011ce4f900 2391155682 S Bo:1:026:1 -115 2 = 9136
ffff88011ce4f900 2391155781 C Bo:1:026:1 0 2 >
ffff88011ce4f240 2391155786 C Bi:1:026:1 0 2 = 9136
ffff88011ce4f240 2391158721 S Bi:1:026:1 -115 4096 <
ffff88011ce4f240 2391158781 C Bi:1:026:1 0 2 = 0000
ffff880044b31180 2391161899 S Bi:1:026:1 -115 4096 <
ffff880044b31000 2391162780 S Bo:1:026:1 -115 1 = d2
ffff880044b31000 2391162906 C Bo:1:026:1 0 1 >
ffff880044b31180 2391162911 C Bi:1:026:1 0 1 = d2
ffff880044b31180 2391165808 S Bi:1:026:1 -115 4096 <
ffff880044b31000 2391171103 S Bo:1:026:1 -115 4 = c1003074
ffff880044b31000 2391171156 C Bo:1:026:1 0 4 >
ffff880044b31180 2391171160 C Bi:1:026:1 0 4 = c1003074
ffff88011ce4f240 2391174729 S Bi:1:026:1 -115 4096 <
ffff880044b316c0 2391184743 S Bo:1:026:1 -115 4 = 00000001
ffff880044b316c0 2391184781 C Bo:1:026:1 0 4 >
ffff88011ce4f240 2391184908 C Bi:1:026:1 0 4 = 00000001
ffff880044b316c0 2391187765 S Bi:1:026:1 -115 4096 <
ffff880044b316c0 2391187907 C Bi:1:026:1 0 2 = 0000
ffff880044b316c0 2391191066 S Bi:1:026:1 -115 4096 <
ffff880044b31180 2391191078 S Bo:1:026:1 -115 2 = 0001
ffff880044b31180 2391191155 C Bo:1:026:1 0 2 >
ffff880044b316c0 2391191160 C Bi:1:026:1 0 2 = 0001
ffff880044b316c0 2391193694 S Bi:1:026:1 -115 4096 <
ffff880044b316c0 2391193783 C Bi:1:026:1 0 2 = 0000
ffff880044b316c0 2391196729 S Bi:1:026:1 -115 4096 <
ffff88011ce4f900 2391201793 S Bo:1:026:1 -115 1 = d0
ffff88011ce4f900 2391201906 C Bo:1:026:1 0 1 >
ffff880044b316c0 2391201910 C Bi:1:026:1 0 1 = d0
ffff88011ce4f900 2391205694 S Bi:1:026:1 -115 4096 <
ffff88011ce4f000 2391211116 S Bo:1:026:1 -115 4 = c1003000
ffff88011ce4f000 2391211155 C Bo:1:026:1 0 4 >
ffff88011ce4f900 2391211282 C Bi:1:026:1 0 4 = c1003000
ffff88011ce4f540 2391217109 S Bi:1:026:1 -115 4096 <
ffff88011ce4fc00 2391221674 S Bo:1:026:1 -115 4 = 00000001
ffff88011ce4fc00 2391221781 C Bo:1:026:1 0 4 >
ffff88011ce4f540 2391221786 C Bi:1:026:1 0 4 = 00000001
ffff88011ce4f540 2391225702 S Bi:1:026:1 -115 4096 <
ffff88011ce4f540 2391225783 C Bi:1:026:1 0 2 = 0000
ffff88011ce4f540 2391228608 S Bi:1:026:1 -115 4096 <
ffff88011ce4f540 2391228657 C Bi:1:026:1 0 2 = 000d
ffff88011ce4f540 2391231640 S Bi:1:026:1 -115 4096 <
ffff88011ce4f540 2391231782 C Bi:1:026:1 0 2 = 0000
ffff88011ce4f540 2391234675 S Bi:1:026:1 -115 4096 <
ffff88011ce4fc00 2391234684 S Bo:1:026:1 -115 1 = d2
ffff88011ce4fc00 2391234781 C Bo:1:026:1 0 1 >
ffff88011ce4f540 2391234784 C Bi:1:026:1 0 1 = d2
ffff88011ce4f540 2391237707 S Bi:1:026:1 -115 4096 <
ffff88011ce4fc00 2391242637 S Bo:1:026:1 -115 4 = c1003000
ffff88011ce4fc00 2391242780 C Bo:1:026:1 0 4 >
ffff88011ce4f540 2391242784 C Bi:1:026:1 0 4 = c1003000
ffff88011ce4f540 2391246676 S Bi:1:026:1 -115 4096 <
ffff880044b31180 2391251607 S Bo:1:026:1 -115 4 = 00000001
ffff880044b31180 2391251655 C Bo:1:026:1 0 4 >
ffff88011ce4f540 2391251660 C Bi:1:026:1 0 4 = 00000001
ffff880044b31180 2391255644 S Bi:1:026:1 -115 4096 <
ffff880044b31180 2391255783 C Bi:1:026:1 0 2 = 0000
ffff880044b31180 2391258676 S Bi:1:026:1 -115 4096 <
ffff880044b31a80 2391261792 S Bo:1:026:1 -115 2 = 430e
ffff880044b31a80 2391261909 C Bo:1:026:1 0 2 >
ffff880044b31180 2391261914 C Bi:1:026:1 0 2 = 430e
ffff88011ce4fc00 2391264612 S Bi:1:026:1 -115 4096 <
ffff88011ce4fc00 2391264658 C Bi:1:026:1 0 2 = 0000
ffff88011ce4fc00 2391267647 S Bi:1:026:1 -115 4096 <
ffff88011ce4fd80 2391272715 S Bo:1:026:1 -115 1 = d2
ffff88011ce4fd80 2391272781 C Bo:1:026:1 0 1 >
ffff88011ce4fc00 2391272785 C Bi:1:026:1 0 1 = d2
ffff880044b31180 2391276702 S Bi:1:026:1 -115 4096 <
ffff880044b31a80 2391281748 S Bo:1:026:1 -115 4 = c1003074
ffff880044b31a80 2391281781 C Bo:1:026:1 0 4 >
ffff880044b31180 2391281907 C Bi:1:026:1 0 4 = c1003074
ffff88011ce4fc00 2391285692 S Bi:1:026:1 -115 4096 <
ffff880044b31180 2391295699 S Bo:1:026:1 -115 4 = 00000001
ffff880044b31180 2391295784 C Bo:1:026:1 0 4 >
ffff88011ce4fc00 2391295789 C Bi:1:026:1 0 4 = 00000001
ffff880044b31180 2391298582 S Bi:1:026:1 -115 4096 <
ffff880044b31180 2391298656 C Bi:1:026:1 0 2 = 0000
ffff880044b31180 2391301620 S Bi:1:026:1 -115 4096 <
ffff880044b31a80 2391301629 S Bo:1:026:1 -115 2 = 0001
ffff880044b31a80 2391301655 C Bo:1:026:1 0 2 >
ffff880044b31180 2391301782 C Bi:1:026:1 0 2 = 0001
ffff880044b31180 2391304651 S Bi:1:026:1 -115 4096 <
ffff880044b31180 2391304782 C Bi:1:026:1 0 2 = 0000
ffff880044b31180 2391307691 S Bi:1:026:1 -115 4096 <
ffff880044b31a80 2391312617 S Bo:1:026:1 -115 1 = d0
ffff880044b31a80 2391312657 C Bo:1:026:1 0 1 >
ffff880044b31180 2391312662 C Bi:1:026:1 0 1 = d0
ffff880044b31180 2391316655 S Bi:1:026:1 -115 4096 <
ffff880044b31a80 2391321714 S Bo:1:026:1 -115 4 = c1003000
ffff880044b31a80 2391321781 C Bo:1:026:1 0 4 >
ffff880044b31180 2391321785 C Bi:1:026:1 0 4 = c1003000
ffff880044b31180 2391325619 S Bi:1:026:1 -115 4096 <
ffff880044b31a80 2391335607 S Bo:1:026:1 -115 4 = 00000001
ffff880044b31a80 2391335655 C Bo:1:026:1 0 4 >
ffff880044b31180 2391335660 C Bi:1:026:1 0 4 = 00000001
ffff880044b31180 2391338846 S Bi:1:026:1 -115 4096 <
ffff880044b31180 2391338907 C Bi:1:026:1 0 2 = 0000
ffff880044b31180 2391341771 S Bi:1:026:1 -115 4096 <
ffff880044b31180 2391341907 C Bi:1:026:1 0 2 = 000e
ffff88011ce4fd80 2391344699 S Bi:1:026:1 -115 4096 <
ffff88011ce4fd80 2391344783 C Bi:1:026:1 0 2 = 0000
ffff88011ce4fd80 2391347599 S Bi:1:026:1 -115 4096 <
ffff88011ce4f300 2391347640 S Bo:1:026:1 -115 1 = d8
ffff88011ce4f300 2391347781 C Bo:1:026:1 0 1 >
ffff88011ce4fd80 2391347786 C Bi:1:026:1 0 1 = d8
ffff88011ce4fd80 2391350630 S Bi:1:026:1 -115 4096 <
ffff88011ce4fd80 2391350783 C Bi:1:026:1 0 4 = 00000000
ffff88011ce4fd80 2391353663 S Bi:1:026:1 -115 4096 <
ffff88011ce4fd80 2391353782 C Bi:1:026:1 0 2 = 0000
ffff88011ce4fd80 2391356697 S Bi:1:026:1 -115 4096 <
ffff88011ce4f300 2391356706 S Bo:1:026:1 -115 1 = ff
ffff88011ce4f300 2391356782 C Bo:1:026:1 0 1 >
ffff88011ce4fd80 2391356786 C Bi:1:026:1 0 1 = ff
ffff88011ce4fd80 2391359595 S Bi:1:026:1 -115 4096 <
ffff88011ce4f300 2391359604 S Bo:1:026:1 -115 1 = fe
ffff88011ce4f300 2391359656 C Bo:1:026:1 0 1 >
ffff88011ce4fd80 2391359660 C Bi:1:026:1 0 1 = 01
ffff88011ce4fd80 2391362628 S Bi:1:026:1 -115 4096 <
ffff88011ce4f300 2391362656 S Ci:1:026:0 s a1 21 0000 0001 0007 7 <
ffff88011ce4f300 2391362907 C Ci:1:026:0 0 7 = 00100e00 000008
ffff880044b31180 2391365946 S Ci:1:026:0 s a1 21 0000 0001 0007 7 <
ffff880044b31180 2391366031 C Ci:1:026:0 0 7 = 00100e00 000008
ffff880044b31180 2391373645 S Bo:1:026:1 -115 1 = d7
ffff880044b31180 2391373781 C Bo:1:026:1 0 1 >
ffff88011ce4fd80 2391373786 C Bi:1:026:1 0 1 = d7
ffff880044b31180 2391377649 S Bi:1:026:1 -115 4096 <
ffff88011ce4f300 2391382573 S Bo:1:026:1 -115 4 = c2000000
ffff88011ce4f300 2391382657 C Bo:1:026:1 0 4 >
ffff880044b31180 2391382662 C Bi:1:026:1 0 4 = c2000000
ffff88011ce4f300 2391386605 S Bi:1:026:1 -115 4096 <
ffff88011ce4fd80 2391391665 S Bo:1:026:1 -115 4 = 0001d6e8
ffff88011ce4fd80 2391391780 C Bo:1:026:1 0 4 >
ffff88011ce4f300 2391391784 C Bi:1:026:1 0 4 = 0001d6e8
ffff880044b31a80 2391395574 S Bi:1:026:1 -115 4096 <
ffff88011ce4f300 2391405680 S Bo:1:026:1 -115 4 = 00000100
ffff88011ce4f300 2391405780 C Bo:1:026:1 0 4 >
ffff880044b31a80 2391405785 C Bi:1:026:1 0 4 = 00000100
ffff880044b31a80 2391408588 S Bi:1:026:1 -115 4096 <
ffff880044b31a80 2391408657 C Bi:1:026:1 0 2 = 0000
ffff880044b31a80 2391411622 S Bi:1:026:1 -115 4096 <
ffff880044b31180 2391411632 S Bo:1:026:1 -115 1024 = ffffffea 00000fe1 c010a0e3 010080e1 00f02fe1 04b0a0e1 05c0a0e1 24004fe2
ffff880044b31180 2391411781 C Bo:1:026:1 0 1024 >
ffff880044b31180 2391414658 S Bo:1:026:1 -115 0
ffff880044b31180 2391414780 C Bo:1:026:1 0 0
ffff880044b31180 2391415679 S Bo:1:026:1 -115 1024 = 08e941bb 04fb08f0 0b990df0 48fcb8b9 96b12148 006a8069 01692046 1bf0f8e8
ffff880044b31180 2391415781 C Bo:1:026:1 0 1024 >
ffff880044b31180 2391418566 S Bo:1:026:1 -115 0
ffff880044b31180 2391418655 C Bo:1:026:1 0 0
ffff880044b31180 2391419587 S Bo:1:026:1 -115 1024 = 28463146 e4fb0201 4b46fff7 98fc47f2 010002f0 2afcdff8 c080d8f8 04008047
ffff880044b31180 2391419656 C Bo:1:026:1 0 1024 >
ffff880044b31180 2391422611 S Bo:1:026:1 -115 0
ffff880044b31180 2391422655 C Bo:1:026:1 0 0
ffff880044b31180 2391423629 S Bo:1:026:1 -115 1024 = 06d0416c 002903d1 c06c0028 00d155e7 70472de9 f0470027 dff8dc80 4ff05a0a
ffff880044b31180 2391423781 C Bo:1:026:1 0 1024 >
ffff880044b31180 2391426658 S Bo:1:026:1 -115 0
ffff880044b31180 2391426780 C Bo:1:026:1 0 0
ffff880044b31180 2391427674 S Bo:1:026:1 -115 1024 = 00f05cfb 40b17c4c a16a8847 dde90801 226b9047 7ae073e0 ddf858c0 00210846
ffff880044b31180 2391427781 C Bo:1:026:1 0 1024 >
ffff880044b31180 2391430566 S Bo:1:026:1 -115 0
ffff880044b31180 2391430654 C Bo:1:026:1 0 0
ffff880044b31180 2391431784 S Bo:1:026:1 -115 1024 = 87b9bde8 f04140f6 c33006f0 52ba07f0 aff82969 5a208847 06f0aff9 fef768fe
ffff880044b31180 2391431906 C Bo:1:026:1 0 1024 >
ffff880044b31180 2391434634 S Bo:1:026:1 -115 0
ffff880044b31180 2391434781 C Bo:1:026:1 0 0
ffff880044b31180 2391435631 S Bo:1:026:1 -115 1024 = 41eb0808 241a65eb 01052092 2c4322d0 0d990698 08431ed0 dde90813 b9eb0102
ffff880044b31180 2391435780 C Bo:1:026:1 0 1024 >
ffff880044b31180 2391438661 S Bo:1:026:1 -115 0
ffff880044b31180 2391438781 C Bo:1:026:1 0 0
ffff880044b31180 2391439677 S Bo:1:026:1 -115 1024 = 05d005f0 56fe3046 07b0bde8 f08fdaf8 10105a20 8847641c ac42d8d3 0020f3e7
ffff880044b31180 2391439783 C Bo:1:026:1 0 1024 >
ffff880044b31180 2391442566 S Bo:1:026:1 -115 0
ffff880044b31180 2391442655 C Bo:1:026:1 0 0
ffff880044b31180 2391443582 S Bo:1:026:1 -115 1024 = 58fc0df5 137d00e6 07480169 5a208847 8c980528 f5d10122 07210ba0 04f0effe
ffff880044b31180 2391443657 C Bo:1:026:1 0 1024 >
ffff880044b31180 2391446610 S Bo:1:026:1 -115 0
ffff880044b31180 2391446655 C Bo:1:026:1 0 0
ffff880044b31180 2391447630 S Bo:1:026:1 -115 1024 = 5ffb3168 88698069 012805d1 4448d0f8 5801806a 007858b1 08f023fd 06f0c6fd
ffff880044b31180 2391447783 C Bo:1:026:1 0 1024 >
ffff880044b31180 2391450657 S Bo:1:026:1 -115 0
ffff880044b31180 2391450780 C Bo:1:026:1 0 0
ffff880044b31180 2391451676 S Bo:1:026:1 -115 1024 = b4eb910f eed30020 f0bdf0b5 01250024 ddf814c0 03e00555 6d1c641c edb28c42
ffff880044b31180 2391451782 C Bo:1:026:1 0 1024 >
ffff880044b31180 2391454564 S Bo:1:026:1 -115 0
ffff880044b31180 2391454655 C Bo:1:026:1 0 0
ffff880044b31180 2391455582 S Bo:1:026:1 -115 1024 = 70b16c43 0a990c60 a0f53061 e23904d1 b9f1000f 1ad040f6 17400bb0 bde8f08f
ffff880044b31180 2391455655 C Bo:1:026:1 0 1024 >
ffff880044b31180 2391458670 S Bo:1:026:1 -115 0
ffff880044b31180 2391458780 C Bo:1:026:1 0 0
ffff880044b31180 2391459629 S Bo:1:026:1 -115 1024 = dfd0d9f8 28104d46 20468847 002cd8d0 0399a1eb 08000390 a96a8847 a96a0498
ffff880044b31180 2391459780 C Bo:1:026:1 0 1024 >
ffff88011ce4f300 2391463815 S Bo:1:026:1 -115 0
ffff88011ce4f300 2391463905 C Bo:1:026:1 0 0
ffff88011ce4f300 2391464837 S Bo:1:026:1 -115 1024 = c4e90361 0599a161 06996560 61619af8 001011b9 9af80100 40b1a169 20698842
ffff88011ce4f300 2391464906 C Bo:1:026:1 0 1024 >
ffff88011ce4f300 2391467720 S Bo:1:026:1 -115 0
ffff88011ce4f300 2391467781 C Bo:1:026:1 0 0
ffff880044b31180 2391468746 S Bo:1:026:1 -115 1024 = a142aad8 0120eee7 2de9f043 00250120 adf6642d 79a107f0 04fa0021 40f66422
ffff880044b31180 2391468905 C Bo:1:026:1 0 1024 >
ffff880044b31180 2391471767 S Bo:1:026:1 -115 0
ffff880044b31180 2391471905 C Bo:1:026:1 0 0
ffff88011ce4fd80 2391472810 S Bo:1:026:1 -115 1024 = 5fff0021 40f20442 5046fef7 3efaf448 007828b3 d14f5a20 39698847 786a8047
ffff88011ce4fd80 2391472905 C Bo:1:026:1 0 1024 >
ffff88011ce4fd80 2391475817 S Bo:1:026:1 -115 0
ffff88011ce4fd80 2391475905 C Bo:1:026:1 0 0
ffff88011ce4fd80 2391476834 S Bo:1:026:1 -115 1024 = 01ebc001 fd4800eb 81003830 0090ea68 0292c068 29699042 3cd31144 814239d3
ffff88011ce4fd80 2391476905 C Bo:1:026:1 0 1024 >
ffff88011ce4fd80 2391479724 S Bo:1:026:1 -115 0
ffff88011ce4fd80 2391479780 C Bo:1:026:1 0 0
ffff88011ce4fd80 2391480745 S Bo:1:026:1 -115 1024 = 305100f0 aac301c2 c8c301c2 fcc301c2 5cc601c2 ccc401c2 18c501c2 4c5d00f0
ffff88011ce4fd80 2391480905 C Bo:1:026:1 0 1024 >
ffff88011ce4fd80 2391483769 S Bo:1:026:1 -115 0
ffff88011ce4fd80 2391483905 C Bo:1:026:1 0 0
ffff88011ce4fd80 2391484786 S Bo:1:026:1 -115 1024 = dcfcb7e6 0d4c5a20 21698847 ca9820b1 07f028ff 00287ff4 c4ae09f0 3bfb0120
ffff88011ce4fd80 2391484905 C Bo:1:026:1 0 1024 >
ffff880044b31180 2391487820 S Bo:1:026:1 -115 0
ffff880044b31180 2391487905 C Bo:1:026:1 0 0
ffff880044b31180 2391488838 S Bo:1:026:1 -115 1024 = e3e73169 5a208847 f0698047 3169a842 03d06920 88470025 d7e75a20 88475046
ffff880044b31180 2391489033 C Bo:1:026:1 0 1024 >
ffff880044b31180 2391491847 S Bo:1:026:1 -115 0
ffff880044b31180 2391491906 C Bo:1:026:1 0 0
ffff880044b31180 2391492740 S Bo:1:026:1 -115 1024 = 02eb4201 46f82100 06eb8100 c0f804c0 0199491c 81600020 c4e72de9 f0470020
ffff880044b31180 2391492906 C Bo:1:026:1 0 1024 >
ffff880044b31180 2391495772 S Bo:1:026:1 -115 0
ffff880044b31180 2391495905 C Bo:1:026:1 0 0
ffff88011ce4fc00 2391496792 S Bo:1:026:1 -115 1024 = 5ffb0420 e4e60026 1ee02068 032804d0 fff749fd 05001ad1 01e00025 10e0d4e9
ffff88011ce4fc00 2391496906 C Bo:1:026:1 0 1024 >
ffff880096616e40 2391499819 S Bo:1:026:1 -115 0
ffff880096616e40 2391499905 C Bo:1:026:1 0 0
ffff880096616e40 2391500839 S Bo:1:026:1 -115 1024 = 0a000000 dde91401 4ff00003 15f034eb 1a4301d0 012000e0 00202418 684600eb
ffff880096616e40 2391501030 C Bo:1:026:1 0 1024 >
ffff880096616600 2391503721 S Bo:1:026:1 -115 0
ffff880096616600 2391503780 C Bo:1:026:1 0 0
ffff880096616600 2391504744 S Bo:1:026:1 -115 1024 = d7fa2068 01223b46 294690f8 49000ef0 80fe0100 06d08da0 04f052ff 4ff44360
ffff880096616600 2391504907 C Bo:1:026:1 0 1024 >
ffff880096616600 2391507767 S Bo:1:026:1 -115 0
ffff880096616600 2391507905 C Bo:1:026:1 0 0
ffff880096616600 2391508786 S Bo:1:026:1 -115 1024 = 09e07868 804708f8 0400a642 02d0b96a 00208847 641ca542 f3d8e3a0 04f050fd
ffff880096616600 2391508905 C Bo:1:026:1 0 1024 >
ffff880096616600 2391511810 S Bo:1:026:1 -115 0
ffff880096616600 2391511905 C Bo:1:026:1 0 0
ffff880096616600 2391512834 S Bo:1:026:1 -115 1024 = 30782578 0a000000 6c656e5f 32203d20 30782578 0a000000 6c656e5f 33203d20
ffff880096616600 2391512905 C Bo:1:026:1 0 1024 >
ffff880096616600 2391515724 S Bo:1:026:1 -115 0
ffff880096616600 2391515780 C Bo:1:026:1 0 0
ffff880096616600 2391516739 S Bo:1:026:1 -115 1024 = faf747ff 07900022 d7e90a01 9d4f189b 08944837 07eb8307 231a8a41 7ed3994a
ffff880096616600 2391516905 C Bo:1:026:1 0 1024 >
ffff880096616600 2391519769 S Bo:1:026:1 -115 0
ffff880096616600 2391519905 C Bo:1:026:1 0 0
ffff880096616600 2391520789 S Bo:1:026:1 -115 1024 = 10448c45 f0d8a142 0cd208eb 01030021 04f00302 02e05d5c 491c2844 8a42fad8
ffff880096616600 2391520905 C Bo:1:026:1 0 1024 >
ffff88011ce4fc00 2391524401 S Bo:1:026:1 -115 0
ffff88011ce4fc00 2391524531 C Bo:1:026:1 0 0
ffff88011ce4fc00 2391525424 S Bo:1:026:1 -115 1024 = 701502c2 20c401c2 00f8ffff 444f574e 4c4f4144 20494e46 4f524d41 54494f4e
ffff88011ce4fc00 2391525531 C Bo:1:026:1 0 1024 >
ffff88011ce4fc00 2391528313 S Bo:1:026:1 -115 0
ffff88011ce4fc00 2391528406 C Bo:1:026:1 0 0
ffff88011ce4fc00 2391529330 S Bo:1:026:1 -115 1024 = 726d6174 3a20626c 6b6e723d 25642c20 746f7461 6c5f626c 6b733d25 640a0000
ffff88011ce4fc00 2391529405 C Bo:1:026:1 0 1024 >
ffff880096616e40 2391532358 S Bo:1:026:1 -115 0
ffff880096616e40 2391532405 C Bo:1:026:1 0 0
ffff880096616e40 2391533382 S Bo:1:026:1 -115 1024 = 006816e7 01463148 001f0068 22e70a46 01462e48 001f0068 23e70146 2b48001f
ffff880096616e40 2391533532 C Bo:1:026:1 0 1024 >
ffff880096616e40 2391536406 S Bo:1:026:1 -115 0
ffff880096616e40 2391536530 C Bo:1:026:1 0 0
ffff880096616e40 2391537427 S Bo:1:026:1 -115 1024 = 4ff00104 550701d5 0c7000e0 0b70d106 01d50470 30bd0370 30bd2d4b 10b50024
ffff880096616e40 2391537531 C Bo:1:026:1 0 1024 >
ffff880096616e40 2391540320 S Bo:1:026:1 -115 0
ffff880096616e40 2391540405 C Bo:1:026:1 0 0
ffff880096616e40 2391541340 S Bo:1:026:1 -115 1024 = 5d4618e0 4026f3e7 b4423546 00d22546 d8f80000 3a46a9b2 0078fff7 b5fdd8f8
ffff880096616e40 2391541531 C Bo:1:026:1 0 1024 >
ffff880096616e40 2391544370 S Bo:1:026:1 -115 0
ffff880096616e40 2391544404 C Bo:1:026:1 0 0
ffff880096616e40 2391545395 S Bo:1:026:1 -115 1024 = 12480188 44f20100 884301d0 00207047 0c484078 c0f38010 70470000 681003c2
ffff880096616e40 2391545547 C Bo:1:026:1 0 1024 >
ffff880096616e40 2391548479 S Bo:1:026:1 -115 0
ffff880096616e40 2391548530 C Bo:1:026:1 0 0
ffff880096616e40 2391549447 S Bo:1:026:1 -115 1024 = 1f4a0023 48431946 12f036eb 04460020 0d460146 fff7b3ff 231845eb 01025e1c
ffff880096616e40 2391549532 C Bo:1:026:1 0 1024 >
ffff88011ce4f540 2391553278 S Bo:1:026:1 -115 0
ffff88011ce4f540 2391553406 C Bo:1:026:1 0 0
ffff88011ce4f540 2391555337 S Bo:1:026:1 -115 1024 = 3be0d8f8 14004746 6843fff7 60fe18bb 7869b846 79686843 12f0faec 1b4a1c49
ffff88011ce4f540 2391555406 C Bo:1:026:1 0 1024 >
ffff880096616e40 2391558368 S Bo:1:026:1 -115 0
ffff880096616e40 2391558406 C Bo:1:026:1 0 0
ffff880096616e40 2391559457 S Bo:1:026:1 -115 1024 = 5efed4e9 04014942 00eb4100 206194f8 40002870 70bdfeb5 0e46234c 07466169
ffff880096616e40 2391559530 C Bo:1:026:1 0 1024 >
ffff880096616e40 2391562290 S Bo:1:026:1 -115 0
ffff880096616e40 2391562405 C Bo:1:026:1 0 0
ffff880096616e40 2391563306 S Bo:1:026:1 -115 1024 = 0120bde8 fc9fd1f8 04510021 0aeb0007 654402e0 7e5c6e54 491c9942 fadb521c
ffff880096616e40 2391563405 C Bo:1:026:1 0 1024 >
ffff880096616e40 2391566336 S Bo:1:026:1 -115 0
ffff880096616e40 2391566405 C Bo:1:026:1 0 0
ffff880096616e40 2391567351 S Bo:1:026:1 -115 1024 = 504a5249 0298803a fff745ff 009008f1 0401dde9 030204f0 d2fc0098 93e640f2
ffff880096616e40 2391567531 C Bo:1:026:1 0 1024 >
ffff880096616e40 2391570381 S Bo:1:026:1 -115 0
ffff880096616e40 2391570530 C Bo:1:026:1 0 0
ffff880096616e40 2391571400 S Bo:1:026:1 -115 1024 = c9080be0 280703d1 aff27020 00f058ff 7a5d76a0 715d00f0 53ff6d1c b5ebc80f
ffff880096616e40 2391571531 C Bo:1:026:1 0 1024 >
ffff880096616e40 2391574390 S Bo:1:026:1 -115 0
ffff880096616e40 2391574530 C Bo:1:026:1 0 0
ffff880096616e40 2391575995 S Bo:1:026:1 -115 1024 = 04022018 21f47041 3844cbf8 00109349 01f10401 04f0d3f8 241f04eb 0700a4e7
ffff880096616e40 2391576158 C Bo:1:026:1 0 1024 >
ffff880096616e40 2391578338 S Bo:1:026:1 -115 0
ffff880096616e40 2391578405 C Bo:1:026:1 0 0
ffff880096616e40 2391579358 S Bo:1:026:1 -115 1024 = 00e043e0 b6492346 faf7c3fe f0bb0299 b348a8eb 01010844 50f8041c b1488142
ffff880096616e40 2391579533 C Bo:1:026:1 0 1024 >
ffff88011ce4f540 2391583303 S Bo:1:026:1 -115 0
ffff88011ce4f540 2391583405 C Bo:1:026:1 0 0
ffff88011ce4f540 2391583455 S Bo:1:026:1 -115 1024 = c0b2b2eb 810ff8d3 10bd0e49 034610b5 002091f8 012205e0 01eb8004 64889c42
ffff88011ce4f540 2391583530 C Bo:1:026:1 0 1024 >
ffff88011ce4f540 2391586430 S Bo:1:026:1 -115 0
ffff88011ce4f540 2391586531 C Bo:1:026:1 0 0
ffff88011ce4f540 2391587307 S Bo:1:026:1 -115 1024 = 2e4cefe7 10b50428 044604db 37222ca1 33a007f0 13fa1c48 047010bd 1a480078
ffff88011ce4f540 2391587405 C Bo:1:026:1 0 1024 >
ffff88011ce4f540 2391590473 S Bo:1:026:1 -115 0
ffff88011ce4f540 2391590532 C Bo:1:026:1 0 0
ffff88011ce4f540 2391591354 S Bo:1:026:1 -115 1024 = 814688b0 00264f46 4ff0040b 21688a69 c968d2e9 04020691 01210191 c11e401e
ffff88011ce4f540 2391591531 C Bo:1:026:1 0 1024 >
ffff880096616e40 2391594382 S Bo:1:026:1 -115 0
ffff880096616e40 2391594531 C Bo:1:026:1 0 0
ffff880096616e40 2391595401 S Bo:1:026:1 -115 1024 = 05fb01f0 80467190 38685af8 24106e9b 689a8069 4144806a 066a5846 b0476898
ffff880096616e40 2391595531 C Bo:1:026:1 0 1024 >
ffff880096616e40 2391598420 S Bo:1:026:1 -115 0
ffff880096616e40 2391598530 C Bo:1:026:1 0 0
ffff880096616e40 2391599307 S Bo:1:026:1 -115 1024 = f2d30026 09eb4a29 08e06946 102209eb 061001eb 061102f0 d2fc761c 5645f4d3
ffff880096616e40 2391599405 C Bo:1:026:1 0 1024 >
ffff88011ce4f900 2391602335 S Bo:1:026:1 -115 0
ffff88011ce4f900 2391602405 C Bo:1:026:1 0 0
ffff88011ce4f900 2391603352 S Bo:1:026:1 -115 1024 = fff75bfd 00204ff0 aa3145f8 201044f8 2010401c 0828f8d3 149a0020 431e02e0
ffff88011ce4f900 2391603531 C Bo:1:026:1 0 1024 >
ffff88011ce4f900 2391606420 S Bo:1:026:1 -115 0
ffff88011ce4f900 2391606530 C Bo:1:026:1 0 0
ffff88011ce4f900 2391607402 S Bo:1:026:1 -115 1024 = 8847b042 01d16d1e f5d1641c 042ce4d3 0fb0bde8 f08f9848 00688069 c06a08b1
ffff88011ce4f900 2391607530 C Bo:1:026:1 0 1024 >
ffff880096616480 2391610292 S Bo:1:026:1 -115 0
ffff880096616480 2391610405 C Bo:1:026:1 0 0
ffff880096616480 2391611309 S Bo:1:026:1 -115 1024 = 2dfe40f6 3740c5e9 6904f460 34617461 b461f461 b470bde8 f081bd49 4a78002a
ffff880096616480 2391611405 C Bo:1:026:1 0 1024 >
ffff880096616480 2391614989 S Bo:1:026:1 -115 0
ffff880096616480 2391615030 C Bo:1:026:1 0 0
ffff880096616480 2391615356 S Bo:1:026:1 -115 1024 = 88474246 51462046 fff74dfb 18b1bde8 f05ffbf7 4eb83969 5a20bde8 f05f0847
ffff880096616480 2391615532 C Bo:1:026:1 0 1024 >
ffff880096616480 2391618385 S Bo:1:026:1 -115 0
ffff880096616480 2391618529 C Bo:1:026:1 0 0
ffff880096616480 2391619404 S Bo:1:026:1 -115 1024 = f5d340f6 f83030bd 02b11360 002030bd 2de9ff4f 002187b0 f24c9946 05aa0491
ffff880096616480 2391619530 C Bo:1:026:1 0 1024 >
ffff880096616480 2391622291 S Bo:1:026:1 -115 0
ffff880096616480 2391622405 C Bo:1:026:1 0 0
ffff88011ce4f900 2391623311 S Bo:1:026:1 -115 1024 = 6b206661 696c2027 30782578 270a0000 5b4c4942 5d204261 6420426c 6f636b20
ffff88011ce4f900 2391623409 C Bo:1:026:1 0 1024 >
ffff88011ce4f900 2391626338 S Bo:1:026:1 -115 0
ffff88011ce4f900 2391626405 C Bo:1:026:1 0 0
ffff88011ce4f900 2391627357 S Bo:1:026:1 -115 1024 = f0430020 dff84081 91b0dff8 50930f90 4446d8f8 240099f8 21728047 0646606a
ffff88011ce4f900 2391627530 C Bo:1:026:1 0 1024 >
ffff88011ce4f900 2391630381 S Bo:1:026:1 -115 0
ffff88011ce4f900 2391630530 C Bo:1:026:1 0 0
ffff88011ce4f900 2391631403 S Bo:1:026:1 -115 1024 = d4f8ac01 c007f4d0 d4f8b001 0021c4f8 9c05d4f8 b401c4f8 a005dde9 0232d4f8
ffff88011ce4f900 2391631531 C Bo:1:026:1 0 1024 >
ffff88011ce4f900 2391634381 S Bo:1:026:1 -115 0
ffff88011ce4f900 2391634530 C Bo:1:026:1 0 0
ffff88011ce4f900 2391635310 S Bo:1:026:1 -115 1024 = 4d432070 61727420 6661696c 0a000000 5b4c4942 5d20454d 4d432064 65746563
ffff88011ce4f900 2391635406 C Bo:1:026:1 0 1024 >
ffff88011ce4f900 2391638338 S Bo:1:026:1 -115 0
ffff88011ce4f900 2391638405 C Bo:1:026:1 0 0
ffff88011ce4f900 2391639357 S Bo:1:026:1 -115 1024 = 0f461446 01461060 1d464ff4 b0721846 f4f73bf8 01aa3946 3046fef7 e3fd48b9
ffff88011ce4f900 2391639532 C Bo:1:026:1 0 1024 >
ffff88011ce4f000 2391642384 S Bo:1:026:1 -115 0
ffff88011ce4f000 2391642530 C Bo:1:026:1 0 0
ffff88011ce4f000 2391643400 S Bo:1:026:1 -115 1024 = 4bf82120 4146cde9 00244a46 fff7a6fe 06444fea b80825e0 e01e00f0 0f015bf8
ffff88011ce4f000 2391643530 C Bo:1:026:1 0 1024 >
ffff880096616900 2391647045 S Bo:1:026:1 -115 0
ffff880096616900 2391647155 C Bo:1:026:1 0 0
ffff880096616900 2391648067 S Bo:1:026:1 -115 1024 = 02885245 11d00288 02990a60 03990860 0188a1f5 2540a538 04d140f6 0f4004b0
ffff880096616900 2391648155 C Bo:1:026:1 0 1024 >
ffff880096616900 2391651094 S Bo:1:026:1 -115 0
ffff880096616900 2391651155 C Bo:1:026:1 0 0
ffff880096616900 2391652110 S Bo:1:026:1 -115 1024 = 03e08354 6a68521c 6a60a242 f9d30022 01231146 8de80e00 0246a968 6ff07f40
ffff880096616900 2391652280 C Bo:1:026:1 0 1024 >
ffff88011ce4f240 2391655142 S Bo:1:026:1 -115 0
ffff88011ce4f240 2391655280 C Bo:1:026:1 0 0
ffff8800966160c0 2391656166 S Bo:1:026:1 -115 1024 = 2946b6a8 0cf000f9 28b140f6 2140a4e7 4ff44260 a1e70025 b3460ee0 05eb4501
ffff8800966160c0 2391656280 C Bo:1:026:1 0 1024 >
ffff8800966160c0 2391659048 S Bo:1:026:1 -115 0
ffff8800966160c0 2391659155 C Bo:1:026:1 0 0
ffff8800966160c0 2391660066 S Bo:1:026:1 -115 1024 = 002807d0 2868401c 28603168 49688142 efd25846 53b0bde8 f08f2de9 f0470546
ffff8800966160c0 2391660156 C Bo:1:026:1 0 1024 >
ffff8800966160c0 2391665064 S Bo:1:026:1 -115 0
ffff8800966160c0 2391665156 C Bo:1:026:1 0 0
ffff8800966160c0 2391666084 S Bo:1:026:1 -115 1024 = 0093631e fcf734fa 0028d3d1 00224146 484600e0 12e0fbf7 d0fca0b1 01a94846
ffff8800966160c0 2391666154 C Bo:1:026:1 0 1024 >
ffff8800966160c0 2391669113 S Bo:1:026:1 -115 0
ffff8800966160c0 2391669155 C Bo:1:026:1 0 0
ffff8800966160c0 2391670122 S Bo:1:026:1 -115 1024 = 0aa80bf0 fcebb649 1c2211a8 38310bf0 f6ebb349 1c2218a8 54310bf0 f0ebae48
ffff8800966160c0 2391670280 C Bo:1:026:1 0 1024 >
ffff8800966160c0 2391673021 S Bo:1:026:1 -115 0
ffff8800966160c0 2391673155 C Bo:1:026:1 0 0
ffff88011ce4fa80 2391675386 S Bo:1:026:1 -115 1024 = 601c1fd0 a41c681c 519418d0 a81c6946 fff770fe 5098001f 102810d2 684601e0
ffff88011ce4fa80 2391675531 C Bo:1:026:1 0 1024 >
ffff88011ce4fa80 2391677921 S Bo:1:026:1 -115 0
ffff88011ce4fa80 2391678029 C Bo:1:026:1 0 0
ffff88011ce4fa80 2391678939 S Bo:1:026:1 -115 1024 = 4a43adf8 1e208169 0969adf8 20104168 adf82210 0169adf8 241006f1 6c014069
ffff88011ce4fa80 2391679033 C Bo:1:026:1 0 1024 >
ffff88011ce4fa80 2391681879 S Bo:1:026:1 -115 0
ffff88011ce4fa80 2391682030 C Bo:1:026:1 0 0
ffff880096616300 2391682844 S Bo:1:026:1 -115 1024 = 28684045 0ad040f6 4440bde8 fc812146 6846fff7 b2ff0028 f7d11be0 e088e988
ffff880096616300 2391683033 C Bo:1:026:1 0 1024 >
ffff880096616300 2391685873 S Bo:1:026:1 -115 0
ffff880096616300 2391685905 C Bo:1:026:1 0 0
ffff88011ce4f840 2391686893 S Bo:1:026:1 -115 1024 = 809104d0 052811d0 06280fd0 1ee080a8 fff7beff 50bb8098 00232246 6946f4f7
ffff88011ce4f840 2391687031 C Bo:1:026:1 0 1024 >
ffff88011ce4f840 2391689916 S Bo:1:026:1 -115 0
ffff88011ce4f840 2391690030 C Bo:1:026:1 0 0
ffff88011ce4f840 2391690937 S Bo:1:026:1 -115 1024 = f7d305f5 80652960 29736973 a973e973 a974e974 a96285f8 2c1085f8 351085f8
ffff88011ce4f840 2391691033 C Bo:1:026:1 0 1024 >
ffff880096616180 2391693960 S Bo:1:026:1 -115 0
ffff880096616180 2391694030 C Bo:1:026:1 0 0
ffff880096616180 2391694842 S Bo:1:026:1 -115 1024 = f6f70afb 022084f8 0d0484f8 1454d5e7 70b50020 764d85f8 1104f6f7 84faf6f7
ffff880096616180 2391695031 C Bo:1:026:1 0 1024 >
ffff880096616180 2391697874 S Bo:1:026:1 -115 0
ffff880096616180 2391697905 C Bo:1:026:1 0 0
ffff880096616180 2391698888 S Bo:1:026:1 -115 1024 = 00279846 10e0fee7 09eb0710 4168e9b3 00688847 c7ebc700 00eb8001 08ebc100
ffff880096616180 2391699030 C Bo:1:026:1 0 1024 >
ffff880096616180 2391701921 S Bo:1:026:1 -115 0
ffff880096616180 2391702030 C Bo:1:026:1 0 0
ffff880096616180 2391702939 S Bo:1:026:1 -115 1024 = cec701c2 7573625f 69666372 65617465 5f6e756d 62657220 213d3000 380f03c2
ffff880096616180 2391703030 C Bo:1:026:1 0 1024 >
ffff88011ce4f840 2391706560 S Bo:1:026:1 -115 0
ffff88011ce4f840 2391706655 C Bo:1:026:1 0 0
ffff88011ce4f840 2391707578 S Bo:1:026:1 -115 1024 = 30000000 211c01c2 4d1c01c2 bc3d02c2 75736261 636d5f72 785f6275 662e6c65
ffff88011ce4f840 2391707655 C Bo:1:026:1 0 1024 >
ffff88011ce4f840 2391710608 S Bo:1:026:1 -115 0
ffff88011ce4f840 2391710655 C Bo:1:026:1 0 0
ffff88011ce4f840 2391711628 S Bo:1:026:1 -115 1024 = 08004fea 4000a066 4ff00400 c4f86801 c4f86861 e86ce060 c4f86871 c4f86861
ffff88011ce4f840 2391711781 C Bo:1:026:1 0 1024 >
ffff880096616180 2391714657 S Bo:1:026:1 -115 0
ffff880096616180 2391714780 C Bo:1:026:1 0 0
ffff880096616180 2391715677 S Bo:1:026:1 -115 1024 = c010481c 05d00829 0ad095a0 f8f758f9 8fe04ff0 ff30c4f8 c080c4f8 c80001e0
ffff880096616180 2391715783 C Bo:1:026:1 0 1024 >
ffff880096616180 2391718562 S Bo:1:026:1 -115 0
ffff880096616180 2391718656 C Bo:1:026:1 0 0
ffff880096616180 2391719582 S Bo:1:026:1 -115 1024 = 49014c46 454601fb 08f15846 08f000ed b84204d9 4af20100 05b0bde8 f08f6d1e
ffff880096616180 2391719656 C Bo:1:026:1 0 1024 >
ffff880096616180 2391722613 S Bo:1:026:1 -115 0
ffff880096616180 2391722655 C Bo:1:026:1 0 0
ffff880096616180 2391723627 S Bo:1:026:1 -115 1024 = 483bb3f8 2001b3f8 2011c0f3 0620c1f3 011181b3 012934d0 0421b3f8 2021c2f3
ffff880096616180 2391723780 C Bo:1:026:1 0 1024 >
ffff880096616180 2391726662 S Bo:1:026:1 -115 0
ffff880096616180 2391726780 C Bo:1:026:1 0 0
ffff880096616180 2391727679 S Bo:1:026:1 -115 1024 = 5f434b44 49563020 2020203d 2025780a 00000000 2a544f50 5f434b44 49563120
ffff880096616180 2391727780 C Bo:1:026:1 0 1024 >
ffff880096616180 2391730556 S Bo:1:026:1 -115 0
ffff880096616180 2391730655 C Bo:1:026:1 0 0
ffff880096616180 2391731578 S Bo:1:026:1 -115 1024 = a075608a 00f5fa60 4ae094f8 69020528 47d2dfe8 00f00303 47474700 18226821
ffff880096616180 2391731656 C Bo:1:026:1 0 1024 >
ffff880096616180 2391736734 S Bo:1:026:1 -115 0
ffff880096616180 2391736782 C Bo:1:026:1 0 0
ffff880096616180 2391737249 S Bo:1:026:1 -115 1024 = 05460c22 3e215046 01f0c3fa 401ca91c 04228840 5021e061 504601f0 bafa6061
ffff880096616180 2391737409 C Bo:1:026:1 0 1024 >
ffff880096616180 2391740270 S Bo:1:026:1 -115 0
ffff880096616180 2391740405 C Bo:1:026:1 0 0
ffff88011ce4f840 2391741290 S Bo:1:026:1 -115 1024 = 73746174 75732025 640a0000 5b534425 645d2073 77697463 68206572 726f722e
ffff88011ce4f840 2391741409 C Bo:1:026:1 0 1024 >
ffff880096616cc0 2391744318 S Bo:1:026:1 -115 0
ffff880096616cc0 2391744405 C Bo:1:026:1 0 0
ffff880096616cc0 2391746840 S Bo:1:026:1 -115 1024 = eed12068 0aaa2146 fff71cf9 0028e7d1 0a994a0b e4d1c1f3 43210729 f1d0dfe7
ffff880096616cc0 2391747031 C Bo:1:026:1 0 1024 >
ffff880096616cc0 2391749376 S Bo:1:026:1 -115 0
ffff880096616cc0 2391749405 C Bo:1:026:1 0 0
ffff880096616cc0 2391750396 S Bo:1:026:1 -115 1024 = 50049207 0bd490f8 6922042a 07d394f8 a22022b9 0a46a221 fff733fe 03461846
ffff880096616cc0 2391750531 C Bo:1:026:1 0 1024 >
ffff880096616cc0 2391753420 S Bo:1:026:1 -115 0
ffff880096616cc0 2391753530 C Bo:1:026:1 0 0
ffff88011ce4f840 2391754391 S Bo:1:026:1 -115 1024 = 00930468 0146b223 01222046 fff71ef9 01460846 38bd38b5 0b46c269 04219207
ffff88011ce4f840 2391754533 C Bo:1:026:1 0 1024 >
ffff880096616540 2391757327 S Bo:1:026:1 -115 0
ffff880096616540 2391757405 C Bo:1:026:1 0 0
ffff880096616540 2391758390 S Bo:1:026:1 -115 1024 = 57fb0028 13d1e069 40f00100 2146e061 2846009a fff787fe 002808d1 2269a08c
ffff880096616540 2391758533 C Bo:1:026:1 0 1024 >
ffff880096616540 2391761372 S Bo:1:026:1 -115 0
ffff880096616540 2391761405 C Bo:1:026:1 0 0
ffff880096616540 2391762394 S Bo:1:026:1 -115 1024 = 01ebb323 03ea0205 3543974e 3544039e 304423ea 01062844 03ebf060 00ea0105
ffff880096616540 2391762531 C Bo:1:026:1 0 1024 >
ffff880096616540 2391765419 S Bo:1:026:1 -115 0
ffff880096616540 2391765530 C Bo:1:026:1 0 0
ffff88011ce4f840 2391768167 S Bo:1:026:1 -115 1024 = 864e2b44 0a9d01eb f3232844 63ea0205 4d403544 824e2844 119d03eb b0602a44
ffff88011ce4f840 2391768281 C Bo:1:026:1 0 1024 >
ffff88011ce4f840 2391770701 S Bo:1:026:1 -115 0
ffff88011ce4f840 2391770782 C Bo:1:026:1 0 0
ffff88011ce4f840 2391771719 S Bo:1:026:1 -115 1024 = 0008606c 00eb6671 206c1044 01eb5071 20f06040 c4e91001 206e54f8 205014e0
ffff88011ce4f840 2391771906 C Bo:1:026:1 0 1024 >
ffff8800966166c0 2391774747 S Bo:1:026:1 -115 0
ffff8800966166c0 2391774781 C Bo:1:026:1 0 0
ffff8800966166c0 2391775768 S Bo:1:026:1 -115 1024 = 2df86169 2aa02960 f4f75afd d4f8cc0e 4ff04531 884201d1 012006e0 04f58054
ffff8800966166c0 2391775905 C Bo:1:026:1 0 1024 >
ffff8800966166c0 2391778652 S Bo:1:026:1 -115 0
ffff8800966166c0 2391778780 C Bo:1:026:1 0 0
ffff8800966166c0 2391779673 S Bo:1:026:1 -115 1024 = bde8f09f dde91467 806e28b1 b6a0f4f7 57fb41f2 c974f1e7 9346ba48 00215a46
ffff8800966166c0 2391779781 C Bo:1:026:1 0 1024 >
ffff8800966166c0 2391782698 S Bo:1:026:1 -115 0
ffff8800966166c0 2391782780 C Bo:1:026:1 0 0
ffff8800966166c0 2391783718 S Bo:1:026:1 -115 1024 = 5d202730 78257827 20746f20 27307825 78270a00 5b4c4942 5d205772 69746520
ffff8800966166c0 2391783905 C Bo:1:026:1 0 1024 >
ffff8800966166c0 2391786748 S Bo:1:026:1 -115 0
ffff8800966166c0 2391786780 C Bo:1:026:1 0 0
ffff8800966166c0 2391787766 S Bo:1:026:1 -115 1024 = 032805d0 4ff48472 08a10fa0 fbf716ba 05490870 70470448 00780328 01d00020
ffff8800966166c0 2391787908 C Bo:1:026:1 0 1024 >
ffff8800966166c0 2391790656 S Bo:1:026:1 -115 0
ffff8800966166c0 2391790780 C Bo:1:026:1 0 0
ffff8800966166c0 2391791677 S Bo:1:026:1 -115 1024 = 60480c33 c4391438 fff7f2fe 002822db 42465c4b 5b495b48 1033c039 1038fff7
ffff8800966166c0 2391791780 C Bo:1:026:1 0 1024 >
ffff8800966166c0 2391794709 S Bo:1:026:1 -115 0
ffff8800966166c0 2391794780 C Bo:1:026:1 0 0
ffff8800966166c0 2391795728 S Bo:1:026:1 -115 1024 = f1f7e6f9 3e46002d f3d16069 10f47f0f 00d16069 e068e060 4ce78269 1069d068
ffff8800966166c0 2391795905 C Bo:1:026:1 0 1024 >
ffff88011ce4f840 2391798758 S Bo:1:026:1 -115 0
ffff88011ce4f840 2391798905 C Bo:1:026:1 0 0
ffff88011ce4f840 2391799781 S Bo:1:026:1 -115 1024 = d9f82c00 fd498842 07d90120 01460b90 002206f1 b00001f0 7df80221 301d0eaa
ffff88011ce4f840 2391799906 C Bo:1:026:1 0 1024 >
ffff88011ce4f840 2391802650 S Bo:1:026:1 -115 0
ffff88011ce4f840 2391802780 C Bo:1:026:1 0 0
ffff88011ce4f840 2391803670 S Bo:1:026:1 -115 1024 = 2de9ff4f 0646406d 97b00025 98461490 0120d6f8 30b0012b b7691592 00d80020
ffff88011ce4f840 2391803784 C Bo:1:026:1 0 1024 >
ffff88011ce4f840 2391806691 S Bo:1:026:1 -115 0
ffff88011ce4f840 2391806780 C Bo:1:026:1 0 0
ffff88011ce4f840 2391807707 S Bo:1:026:1 -115 1024 = 59d0761c 0225022e c7d3d4f8 f020d4f8 f460c2f3 0463c6f3 0468c6f3 044bc6f3
ffff88011ce4f840 2391807780 C Bo:1:026:1 0 1024 >
ffff88011ce4f840 2391810735 S Bo:1:026:1 -115 0
ffff88011ce4f840 2391810780 C Bo:1:026:1 0 0
ffff88011ce4f840 2391811747 S Bo:1:026:1 -115 1024 = 01210391 07aa4ff4 40312046 00f08ffa 07980128 05d10022 012104f1 b00000f0
ffff88011ce4f840 2391811906 C Bo:1:026:1 0 1024 >
ffff88011ce4f840 2391814655 S Bo:1:026:1 -115 0
ffff88011ce4f840 2391814780 C Bo:1:026:1 0 0
ffff88011ce4f840 2391815669 S Bo:1:026:1 -115 1024 = 2846fff7 92faa869 01692d4a 11430161 00222749 2846fef7 4ffd0121 2846fff7
ffff88011ce4f840 2391815780 C Bo:1:026:1 0 1024 >
ffff88011ce4f840 2391818699 S Bo:1:026:1 -115 0
ffff88011ce4f840 2391818780 C Bo:1:026:1 0 0
ffff88011ce4f840 2391819717 S Bo:1:026:1 -115 1024 = 41f2ba76 41e02099 5b465246 3846cdf8 0880cde9 00191499 00f028f9 064634e0
ffff88011ce4f840 2391819905 C Bo:1:026:1 0 1024 >
ffff88011ce4f840 2391822742 S Bo:1:026:1 -115 0
ffff88011ce4f840 2391822780 C Bo:1:026:1 0 0
ffff88011ce4f840 2391823762 S Bo:1:026:1 -115 1024 = 30782578 2c203078 25782c20 30782578 0a000000 2de9ff5f 0026e548 17469846
ffff88011ce4f840 2391823906 C Bo:1:026:1 0 1024 >
ffff88011ce4f840 2391826655 S Bo:1:026:1 -115 0
ffff88011ce4f840 2391826780 C Bo:1:026:1 0 0
ffff880096616000 2391828841 S Bo:1:026:1 -115 1024 = 78257827 0a000000 5b4c4942 5d20446f 6e652027 25732720 27307825 78272056
ffff880096616000 2391829030 C Bo:1:026:1 0 1024 >
ffff880096616000 2391831376 S Bo:1:026:1 -115 0
ffff880096616000 2391831405 C Bo:1:026:1 0 0
ffff880096616000 2391832396 S Bo:1:026:1 -115 1024 = 204670bd 33a0f1f7 5bf92021 002001f0 43fa0400 f4d10120 26f07f03 2a462946
ffff880096616000 2391832530 C Bo:1:026:1 0 1024 >
ffff880096616000 2391835419 S Bo:1:026:1 -115 0
ffff880096616000 2391835530 C Bo:1:026:1 0 0
ffff88011ce4fcc0 2391836439 S Bo:1:026:1 -115 1024 = 68604ff0 0100eef7 88fd2868 20f08050 28606868 20f00070 6860a5f1 f00534b9
ffff88011ce4fcc0 2391836532 C Bo:1:026:1 0 1024 >
ffff88011ce4fcc0 2391839327 S Bo:1:026:1 -115 0
ffff88011ce4fcc0 2391839405 C Bo:1:026:1 0 0
ffff88011ce4fcc0 2391840344 S Bo:1:026:1 -115 1024 = fcc801c2 0a000000 e44100c0 636f6172 7365203d 2025730a 00000000 66696e65
ffff88011ce4fcc0 2391840530 C Bo:1:026:1 0 1024 >
ffff88011ce4fcc0 2391843376 S Bo:1:026:1 -115 0
ffff88011ce4fcc0 2391843405 C Bo:1:026:1 0 0
ffff88011ce4fcc0 2391844392 S Bo:1:026:1 -115 1024 = 1e44491e 2d793571 8142f7d2 0ae0401a 05e00a18 5d181a44 491c1279 2a711a68
ffff88011ce4fcc0 2391844531 C Bo:1:026:1 0 1024 >
ffff88011ce4fcc0 2391847423 S Bo:1:026:1 -115 0
ffff88011ce4fcc0 2391847530 C Bo:1:026:1 0 0
ffff88011ce4fcc0 2391848438 S Bo:1:026:1 -115 1024 = 052a0bd0 022a42d0 114697a0 f0f758f9 41f2ce77 0cb03846 bde8f09f 806e5646
ffff88011ce4fcc0 2391848530 C Bo:1:026:1 0 1024 >
ffff880096616d80 2391851329 S Bo:1:026:1 -115 0
ffff880096616d80 2391851405 C Bo:1:026:1 0 0
ffff880096616d80 2391852349 S Bo:1:026:1 -115 1024 = 5b4c4942 5d205772 69746520 27307825 78270a00 5b4c4942 5d205772 69746520
ffff880096616d80 2391852530 C Bo:1:026:1 0 1024 >
ffff880096616d80 2391855375 S Bo:1:026:1 -115 0
ffff880096616d80 2391855404 C Bo:1:026:1 0 0
ffff880096616d80 2391856438 S Bo:1:026:1 -115 1024 = 05c052e0 0c20a021 0000b0e2 0010a1e2 05c052e0 0c20a021 0000b0e2 0010a1e2
ffff880096616d80 2391856530 C Bo:1:026:1 0 1024 >
ffff880096616d80 2391859420 S Bo:1:026:1 -115 0
ffff880096616d80 2391859530 C Bo:1:026:1 0 0
ffff880096616d80 2391860436 S Bo:1:026:1 -115 1024 = 202052e2 0b00003a 800052e3 0500003a 80f0d1f5 f851b1e8 202042e2 800052e3
ffff880096616d80 2391860530 C Bo:1:026:1 0 1024 >
ffff880096616d80 2391863327 S Bo:1:026:1 -115 0
ffff880096616d80 2391863405 C Bo:1:026:1 0 0
ffff880096616d80 2391864346 S Bo:1:026:1 -115 1024 = 807858b1 87480a46 3146d0f8 04340093 d0f80808 844bc468 3046a047 39463046
ffff880096616d80 2391864530 C Bo:1:026:1 0 1024 >
ffff880096616d80 2391867477 S Bo:1:026:1 -115 0
ffff880096616d80 2391867529 C Bo:1:026:1 0 0
ffff880096616d80 2391868515 S Bo:1:026:1 -115 1024 = 00000000 00000000 05000100 00000000 00000000 00000000 338600c2 84000000
ffff880096616d80 2391868655 C Bo:1:026:1 0 1024 >
ffff880096616d80 2391871423 S Bo:1:026:1 -115 0
ffff880096616d80 2391871530 C Bo:1:026:1 0 0
ffff880096616d80 2391874413 S Bo:1:026:1 -115 1024 = 00fcc0ff ffff0000 ffff0000 4d544b5f 494c425f 54454d50 ffff0000 ffff0000
ffff880096616d80 2391874530 C Bo:1:026:1 0 1024 >
ffff880096616d80 2391881520 S Bo:1:026:1 -115 0
ffff880096616d80 2391881655 C Bo:1:026:1 0 0
ffff880096616d80 2391883502 S Bo:1:026:1 -115 1024 = 00000000 00000000 00000000 00000000 01000000 00000000 00000000 00000000
ffff880096616d80 2391883655 C Bo:1:026:1 0 1024 >
ffff880096616d80 2391886034 S Bo:1:026:1 -115 0
ffff880096616d80 2391886155 C Bo:1:026:1 0 0
ffff880096616d80 2391886912 S Bo:1:026:1 -115 1024 = 00000000 00000000 00000000 00000000 00000000 00000000 00000000 00000000
ffff880096616d80 2391887030 C Bo:1:026:1 0 1024 >
ffff880096616d80 2391890938 S Bo:1:026:1 -115 0
ffff880096616d80 2391891030 C Bo:1:026:1 0 0
ffff880096616d80 2391892973 S Bo:1:026:1 -115 1024 = 8dffc64a 4ff4a040 1080c648 00688069 406a4089 10841946 40f6cc30 146ee407
ffff880096616d80 2391893155 C Bo:1:026:1 0 1024 >
ffff880096616d80 2391896007 S Bo:1:026:1 -115 0
ffff880096616d80 2391896155 C Bo:1:026:1 0 0
ffff88011ce4fcc0 2391897030 S Bo:1:026:1 -115 1024 = 2244bc4c 6ff07f46 950850b1 98694069 400ab4f8 7010b0eb 113f20d9 761ef8d1
ffff88011ce4fcc0 2391897155 C Bo:1:026:1 0 1024 >
ffff88011ce4fcc0 2391899916 S Bo:1:026:1 -115 0
ffff88011ce4fcc0 2391900032 C Bo:1:026:1 0 0
ffff88011ce4fcc0 2391900934 S Bo:1:026:1 -115 744 = 01009000 01007000 0100ff00 01000000 00000000 01003000 00000000 01008000
ffff88011ce4fcc0 2391901034 C Bo:1:026:1 0 744 >
ffff880044b31a80 2391907283 C Bi:1:026:1 0 2 = 3a67
ffff88011ce4fcc0 2391909937 S Bi:1:026:1 -115 4096 <
ffff88011ce4fcc0 2391910034 C Bi:1:026:1 0 2 = 0000
ffff88011ce4fcc0 2391912844 S Bi:1:026:1 -115 4096 <
ffff88011ce4f180 2392128949 S Bo:1:026:1 -115 1 = d5
ffff88011ce4f180 2392129032 C Bo:1:026:1 0 1 >
ffff88011ce4fcc0 2392129037 C Bi:1:026:1 0 1 = d5
ffff88011ce4fcc0 2392131875 S Bi:1:026:1 -115 4096 <
ffff88011ce4fb40 2393187990 S Bo:1:026:1 -115 4 = c2000000
ffff88011ce4fb40 2393188032 C Bo:1:026:1 0 4 >
ffff88011ce4fcc0 2393188158 C Bi:1:026:1 0 4 = c2000000
ffff88011ce4fcc0 2393190918 S Bi:1:026:1 -115 4096 <
ffff88011ce4fcc0 2393191031 C Bi:1:026:1 0 2 = 0000
ffff88011ce4fcc0 2393194101 S Bi:1:026:1 -115 4096 <
ffff88011ce4fcc0 2393199283 C Bi:1:026:1 0 1 = c0
ffff88011ce4fcc0 2393202920 S Bi:1:026:1 -115 4096 <
ffff88011ce4fcc0 2393203031 C Bi:1:026:1 0 1 = 03
ffff88011ce4fcc0 2393205942 S Bi:1:026:1 -115 4096 <
ffff88011ce4fcc0 2393206030 C Bi:1:026:1 0 1 = 02
ffff88011ce4fcc0 2393208847 S Bi:1:026:1 -115 4096 <
ffff88011ce4fcc0 2393208905 C Bi:1:026:1 0 1 = 84
ffff88011ce4fcc0 2393211883 S Bi:1:026:1 -115 4096 <
ffff88011ce4fb40 2393211892 S Bo:1:026:1 -115 1 = ff
ffff88011ce4fb40 2393212031 C Bo:1:026:1 0 1 >
ffff88011ce4fb40 2393214922 S Bo:1:026:1 -115 1 = 01
ffff88011ce4fb40 2393215031 C Bo:1:026:1 0 1 >
ffff880096616f00 2393218315 S Bo:1:026:1 -115 2 = 0008
ffff880096616f00 2393218406 C Bo:1:026:1 0 2 >
ffff880096616f00 2393220851 S Bo:1:026:1 -115 1 = 00
ffff880096616f00 2393220906 C Bo:1:026:1 0 1 >
ffff880096616f00 2393224156 S Bo:1:026:1 -115 4 = 7007ffff
ffff880096616f00 2393224280 C Bo:1:026:1 0 4 >
ffff880096616f00 2393226922 S Bo:1:026:1 -115 1 = 02
ffff880096616f00 2393227031 C Bo:1:026:1 0 1 >
ffff88011ce4fcc0 2393239656 C Bi:1:026:1 0 1 = 5a
ffff88011ce4fcc0 2393241939 S Bi:1:026:1 -115 4096 <
ffff88011ce4fcc0 2393242030 C Bi:1:026:1 0 4 = 00000034
ffff88011ce4fcc0 2393244849 S Bi:1:026:1 -115 4096 <
ffff88011ce4f240 2394261045 S Bo:1:026:1 -115 4 = 00000067
ffff88011ce4f240 2394261157 C Bo:1:026:1 0 4 >
ffff88011ce4fcc0 2394261160 C Bi:1:026:1 0 1 = 5a
ffff88011ce4fcc0 2394263836 S Bi:1:026:1 -115 4096 <
ffff88011ce4f240 2394263847 S Bo:1:026:1 -115 52 = 37000000 ec007300 ffffffff 10000000 20000000 00020000 00000000 03000000
ffff88011ce4f240 2394263907 C Bo:1:026:1 0 52 >
ffff88011ce4fcc0 2394264156 C Bi:1:026:1 0 1 = 69
ffff88011ce4fcc0 2394266869 S Bi:1:026:1 -115 4096 <
ffff88011ce4f240 2394266893 S Bo:1:026:1 -115 52 = 00000000 ec003500 ffffffff 20000000 20000000 00020000 00000000 03000000
ffff88011ce4f240 2394267031 C Bo:1:026:1 0 52 >
ffff88011ce4fcc0 2394267156 C Bi:1:026:1 0 1 = 69
ffff88011ce4fcc0 2394269902 S Bi:1:026:1 -115 4096 <
ffff88011ce4f240 2394269911 S Bo:1:026:1 -115 52 = 01000000 ec007500 ffffffff 20000000 20000000 00020000 00000000 03000000
ffff88011ce4f240 2394270031 C Bo:1:026:1 0 52 >
ffff88011ce4fcc0 2394270156 C Bi:1:026:1 0 1 = 69
ffff88011ce4fcc0 2394272940 S Bi:1:026:1 -115 4096 <
ffff88011ce4f240 2394272964 S Bo:1:026:1 -115 52 = 02000000 ec004500 ffffffff 20000000 20000000 00020000 01000000 03000000
ffff88011ce4f240 2394273031 C Bo:1:026:1 0 52 >
ffff88011ce4fcc0 2394273281 C Bi:1:026:1 0 1 = 69
ffff88011ce4fcc0 2394275909 S Bi:1:026:1 -115 4096 <
ffff88011ce4f240 2394275935 S Bo:1:026:1 -115 52 = 03000000 ec005500 ffffffff 20000000 20000000 00020000 01000000 03000000
ffff88011ce4f240 2394276032 C Bo:1:026:1 0 52 >
ffff88011ce4fcc0 2394276156 C Bi:1:026:1 0 1 = 69
ffff88011ce4fcc0 2394278868 S Bi:1:026:1 -115 4096 <
ffff88011ce4f240 2394278877 S Bo:1:026:1 -115 52 = 04000000 ec007600 ffffffff 40000000 20000000 00020000 00000000 04000000
ffff88011ce4f240 2394278912 C Bo:1:026:1 0 52 >
ffff88011ce4fcc0 2394279156 C Bi:1:026:1 0 1 = 69
ffff88011ce4fcc0 2394281905 S Bi:1:026:1 -115 4096 <
ffff88011ce4f240 2394281914 S Bo:1:026:1 -115 52 = 50000000 ec003600 ffffffff 40000000 20000000 00020000 00000000 04000000
ffff88011ce4f240 2394282030 C Bo:1:026:1 0 52 >
ffff88011ce4fcc0 2394282156 C Bi:1:026:1 0 1 = 69
ffff88011ce4fcc0 2394284937 S Bi:1:026:1 -115 4096 <
ffff88011ce4f240 2394284946 S Bo:1:026:1 -115 52 = 51000000 ec007800 ffffffff 80000000 20000000 00020000 00000000 04000000
ffff88011ce4f240 2394285030 C Bo:1:026:1 0 52 >
ffff88011ce4fcc0 2394285155 C Bi:1:026:1 0 1 = 69
ffff88011ce4fcc0 2394287831 S Bi:1:026:1 -115 4096 <
ffff88011ce4f240 2394287840 S Bo:1:026:1 -115 52 = 05000000 ec007900 ffffffff 80000000 20000000 00020000 00000000 04000000
ffff88011ce4f240 2394287906 C Bo:1:026:1 0 52 >
ffff88011ce4fcc0 2394288155 C Bi:1:026:1 0 1 = 69
ffff880096616f00 2394291475 S Bi:1:026:1 -115 4096 <
ffff880096616840 2394291486 S Bo:1:026:1 -115 52 = 06000000 ec00a100 ffffffff 80000000 40000000 00080000 00000000 04000000
ffff880096616840 2394291531 C Bo:1:026:1 0 52 >
ffff880096616f00 2394291780 C Bi:1:026:1 0 1 = 69
ffff880096616f00 2394293901 S Bi:1:026:1 -115 4096 <
ffff880096616840 2394293910 S Bo:1:026:1 -115 52 = 07000000 ec00f100 ffffffff 80000000 40000000 00080000 00000000 04000000
ffff880096616840 2394294031 C Bo:1:026:1 0 52 >
ffff880096616f00 2394294155 C Bi:1:026:1 0 1 = 69
ffff880096616f00 2394296939 S Bi:1:026:1 -115 4096 <
ffff880096616840 2394297015 S Bo:1:026:1 -115 52 = 08000000 ec00b100 ffffffff 80000000 40000000 00080000 01000000 04000000
ffff880096616840 2394297156 C Bo:1:026:1 0 52 >
ffff880096616f00 2394297280 C Bi:1:026:1 0 1 = 69
ffff88011ce4fcc0 2394300919 S Bi:1:026:1 -115 4096 <
ffff88011ce4f240 2394300928 S Bo:1:026:1 -115 52 = 09000000 ec00c100 ffffffff 80000000 40000000 00080000 01000000 04000000
ffff88011ce4f240 2394301032 C Bo:1:026:1 0 52 >
ffff88011ce4fcc0 2394301156 C Bi:1:026:1 0 1 = 69
ffff88011ce4fcc0 2394303458 S Bi:1:026:1 -115 4096 <
ffff88011ce4f240 2394303466 S Bo:1:026:1 -115 52 = 0a000000 ec00da00 ffffffff 00010000 40000000 00080000 00000000 05000000
ffff88011ce4f240 2394303530 C Bo:1:026:1 0 52 >
ffff88011ce4fcc0 2394303780 C Bi:1:026:1 0 1 = 69
ffff88011ce4fcc0 2394306494 S Bi:1:026:1 -115 4096 <
ffff88011ce4f240 2394306502 S Bo:1:026:1 -115 52 = 0b000000 ec00ca00 ffffffff 00010000 40000000 00080000 01000000 05000000
ffff88011ce4f240 2394306530 C Bo:1:026:1 0 52 >
ffff88011ce4fcc0 2394306781 C Bi:1:026:1 0 1 = 69
ffff88011ce4fcc0 2394309529 S Bi:1:026:1 -115 4096 <
ffff88011ce4f240 2394309538 S Bo:1:026:1 -115 52 = 0c000000 ec00aa00 ffffffff 00010000 40000000 00080000 00000000 05000000
ffff88011ce4f240 2394309655 C Bo:1:026:1 0 52 >
ffff88011ce4fcc0 2394309781 C Bi:1:026:1 0 1 = 69
ffff88011ce4fcc0 2394312403 S Bi:1:026:1 -115 4096 <
ffff88011ce4f240 2394312412 S Bo:1:026:1 -115 52 = 0d000000 ec00ac00 ffffffff 00020000 40000000 00080000 00000000 05000000
ffff88011ce4f240 2394312531 C Bo:1:026:1 0 52 >
ffff88011ce4fcc0 2394312656 C Bi:1:026:1 0 1 = 69
ffff88011ce4fcc0 2394315434 S Bi:1:026:1 -115 4096 <
ffff88011ce4f240 2394315443 S Bo:1:026:1 -115 52 = 0e000000 ec00dc00 ffffffff 00020000 40000000 00080000 00000000 05000000
ffff88011ce4f240 2394315530 C Bo:1:026:1 0 52 >
ffff88011ce4fcc0 2394315656 C Bi:1:026:1 0 1 = 69
ffff880096616a80 2394318463 S Bi:1:026:1 -115 4096 <
ffff8800966169c0 2394318472 S Bo:1:026:1 -115 52 = 68000000 ec00bc00 006656ff 00020000 40000000 00100000 01000000 05000000
ffff8800966169c0 2394318531 C Bo:1:026:1 0 52 >
ffff880096616a80 2394318781 C Bi:1:026:1 0 1 = 69
ffff880096616a80 2394321493 S Bi:1:026:1 -115 4096 <
ffff8800966169c0 2394321502 S Bo:1:026:1 -115 52 = 69000000 ec00bc00 006654ff 00020000 40000000 00100000 01000000 05000000
ffff8800966169c0 2394321530 C Bo:1:026:1 0 52 >
ffff880096616a80 2394321780 C Bi:1:026:1 0 1 = 69
ffff880096616a80 2394324412 S Bi:1:026:1 -115 4096 <
ffff8800966169c0 2394324449 S Bo:1:026:1 -115 52 = 6a000000 ec00bc00 006662ff 00020000 40000000 00100000 01000000 05000000
ffff8800966169c0 2394324531 C Bo:1:026:1 0 52 >
ffff880096616a80 2394324656 C Bi:1:026:1 0 1 = 69
ffff88011ce4f000 2394328444 S Bi:1:026:1 -115 4096 <
ffff88011ce4f900 2394328454 S Bo:1:026:1 -115 52 = 0f000000 ec00bc00 0055ffff 00020000 40000000 00080000 01000000 05000000
ffff88011ce4f900 2394328530 C Bo:1:026:1 0 52 >
ffff88011ce4f000 2394328656 C Bi:1:026:1 0 1 = 69
ffff88011ce4f000 2394331473 S Bi:1:026:1 -115 4096 <
ffff88011ce4f900 2394331548 S Bo:1:026:1 -115 52 = 6c000000 ec00b300 0066ffff 00040000 40000000 00100000 01000000 05000000
ffff88011ce4f900 2394331656 C Bo:1:026:1 0 52 >
ffff88011ce4f000 2394331780 C Bi:1:026:1 0 1 = 69
ffff880096616d80 2394334382 S Bi:1:026:1 -115 4096 <
ffff880096616000 2394334392 S Bo:1:026:1 -115 52 = 10000000 ec00cc00 ffffffff 00020000 40000000 00080000 01000000 05000000
ffff880096616000 2394334531 C Bo:1:026:1 0 52 >
ffff880096616d80 2394334656 C Bi:1:026:1 0 1 = 69
ffff88011ce4f000 2394337407 S Bi:1:026:1 -115 4096 <
ffff88011ce4f900 2394337417 S Bo:1:026:1 -115 52 = 38000000 ec00d300 ffffffff 00040000 40000000 00080000 00000000 05000000
ffff88011ce4f900 2394337531 C Bo:1:026:1 0 52 >
ffff88011ce4f000 2394337656 C Bi:1:026:1 0 1 = 69
ffff88011ce4f000 2394340442 S Bi:1:026:1 -115 4096 <
ffff88011ce4f900 2394340451 S Bo:1:026:1 -115 52 = 6e000000 ec00bc00 006a56ff 00020000 40000000 00100000 01000000 05000000
ffff88011ce4f900 2394340530 C Bo:1:026:1 0 52 >
ffff88011ce4f000 2394340656 C Bi:1:026:1 0 1 = 69
ffff880096616d80 2394343477 S Bi:1:026:1 -115 4096 <
ffff880096616000 2394343486 S Bo:1:026:1 -115 52 = 5d000000 2c00a100 ffffffff 80000000 40000000 00080000 00000000 04000000
ffff880096616000 2394343531 C Bo:1:026:1 0 52 >
ffff880096616d80 2394343780 C Bi:1:026:1 0 1 = 69
ffff880096616d80 2394346371 S Bi:1:026:1 -115 4096 <
ffff880096616000 2394346381 S Bo:1:026:1 -115 52 = 5e000000 2c00b100 ffffffff 80000000 40000000 00080000 01000000 04000000
ffff880096616000 2394346531 C Bo:1:026:1 0 52 >
ffff880096616d80 2394346656 C Bi:1:026:1 0 1 = 69
ffff880096616d80 2394349411 S Bi:1:026:1 -115 4096 <
ffff880096616000 2394349420 S Bo:1:026:1 -115 52 = 3c000000 2c00da00 ffffffff 00010000 40000000 00080000 00000000 05000000
ffff880096616000 2394349531 C Bo:1:026:1 0 52 >
ffff880096616d80 2394349656 C Bi:1:026:1 0 1 = 69
ffff88011ce4f540 2394352447 S Bi:1:026:1 -115 4096 <
ffff88011ce4fc00 2394352457 S Bo:1:026:1 -115 52 = 3d000000 2c00aa00 ffffffff 00010000 40000000 00080000 00000000 05000000
ffff88011ce4fc00 2394352531 C Bo:1:026:1 0 52 >
ffff88011ce4f540 2394352655 C Bi:1:026:1 0 1 = 69
ffff88011ce4f540 2394355485 S Bi:1:026:1 -115 4096 <
ffff88011ce4fc00 2394355525 S Bo:1:026:1 -115 52 = 52000000 2c00ba00 ffffffff 00010000 40000000 00080000 01000000 05000000
ffff88011ce4fc00 2394355655 C Bo:1:026:1 0 52 >
ffff88011ce4f540 2394355781 C Bi:1:026:1 0 1 = 69
ffff88011ce4f540 2394358392 S Bi:1:026:1 -115 4096 <
ffff88011ce4fc00 2394358430 S Bo:1:026:1 -115 52 = 3e000000 2c00dc00 ffffffff 00020000 40000000 00080000 00000000 05000000
ffff88011ce4fc00 2394358530 C Bo:1:026:1 0 52 >
ffff88011ce4f540 2394358656 C Bi:1:026:1 0 1 = 69
ffff88011ce4f540 2394361749 S Bi:1:026:1 -115 4096 <
ffff88011ce4fc00 2394361824 S Bo:1:026:1 -115 52 = 6b000000 2c00bc00 905556ff 00020000 40000000 00080000 01000000 05000000
ffff88011ce4fc00 2394361905 C Bo:1:026:1 0 52 >
ffff88011ce4f540 2394362031 C Bi:1:026:1 0 1 = 69
ffff880096616d80 2394365229 S Bi:1:026:1 -115 4096 <
ffff880096616000 2394365239 S Bo:1:026:1 -115 52 = 3f000000 2c00bc00 ffffffff 00020000 40000000 00080000 01000000 05000000
ffff880096616000 2394365283 C Bo:1:026:1 0 52 >
ffff880096616d80 2394365530 C Bi:1:026:1 0 1 = 69
ffff880096616d80 2394368154 S Bi:1:026:1 -115 4096 <
ffff880096616000 2394368163 S Bo:1:026:1 -115 52 = 42000000 c1006600 ffffffff 40000000 20000000 00020000 00000000 04000000
ffff880096616000 2394368282 C Bo:1:026:1 0 52 >
ffff880096616d80 2394368406 C Bi:1:026:1 0 1 = 69
ffff880096616d80 2394371054 S Bi:1:026:1 -115 4096 <
ffff880096616000 2394371063 S Bo:1:026:1 -115 52 = 43000000 c100f100 ffffffff 80000000 40000000 00080000 00000000 04000000
ffff880096616000 2394371156 C Bo:1:026:1 0 52 >
ffff880096616d80 2394371281 C Bi:1:026:1 0 1 = 69
ffff880096616d80 2394374088 S Bi:1:026:1 -115 4096 <
ffff880096616000 2394374096 S Bo:1:026:1 -115 52 = 44000000 c100c100 ffffffff 80000000 40000000 00080000 01000000 04000000
ffff880096616000 2394374156 C Bo:1:026:1 0 52 >
ffff880096616d80 2394374405 C Bi:1:026:1 0 1 = 69
ffff880096616d80 2394377640 S Bi:1:026:1 -115 4096 <
ffff880096616000 2394377649 S Bo:1:026:1 -115 52 = 12000000 98007500 ffffffff 20000000 20000000 00020000 00000000 03000000
ffff880096616000 2394377781 C Bo:1:026:1 0 52 >
ffff880096616d80 2394377906 C Bi:1:026:1 0 1 = 69
ffff880096616d80 2394380673 S Bi:1:026:1 -115 4096 <
ffff880096616000 2394380682 S Bo:1:026:1 -115 52 = 13000000 98007600 ffffffff 40000000 20000000 00020000 00000000 04000000
ffff880096616000 2394380781 C Bo:1:026:1 0 52 >
ffff880096616d80 2394380905 C Bi:1:026:1 0 1 = 69
ffff880096616d80 2394383676 S Bi:1:026:1 -115 4096 <
ffff880096616000 2394383701 S Bo:1:026:1 -115 52 = 14000000 98007900 ffffffff 80000000 20000000 00020000 00000000 04000000
ffff880096616000 2394383781 C Bo:1:026:1 0 52 >
ffff880096616d80 2394383906 C Bi:1:026:1 0 1 = 69
ffff880096616d80 2394386598 S Bi:1:026:1 -115 4096 <
ffff880096616000 2394386622 S Bo:1:026:1 -115 52 = 45000000 9800f000 ffffffff 40000000 40000000 00080000 00000000 04000000
ffff880096616000 2394386656 C Bo:1:026:1 0 52 >
ffff880096616d80 2394386906 C Bi:1:026:1 0 1 = 69
ffff880096616d80 2394389639 S Bi:1:026:1 -115 4096 <
ffff880096616000 2394389662 S Bo:1:026:1 -115 52 = 15000000 9800f100 ffffffff 80000000 40000000 00080000 00000000 04000000
ffff880096616000 2394389780 C Bo:1:026:1 0 52 >
ffff880096616d80 2394389905 C Bi:1:026:1 0 1 = 69
ffff880096616d80 2394392669 S Bi:1:026:1 -115 4096 <
ffff880096616000 2394392708 S Bo:1:026:1 -115 52 = 59000000 9800b100 ffffffff 80000000 40000000 00080000 01000000 04000000
ffff880096616000 2394392780 C Bo:1:026:1 0 52 >
ffff880096616d80 2394392905 C Bi:1:026:1 0 1 = 69
ffff88011ce4f540 2394395592 S Bi:1:026:1 -115 4096 <
ffff88011ce4fc00 2394395601 S Bo:1:026:1 -115 52 = 5a000000 9800ba00 ffffffff 00010000 40000000 00080000 01000000 05000000
ffff88011ce4fc00 2394395655 C Bo:1:026:1 0 52 >
ffff88011ce4f540 2394395906 C Bi:1:026:1 0 1 = 69
ffff88011ce4f540 2394398605 S Bi:1:026:1 -115 4096 <
ffff88011ce4fc00 2394398613 S Bo:1:026:1 -115 52 = 16000000 9800da00 ffffffff 00010000 40000000 00080000 00000000 05000000
ffff88011ce4fc00 2394398655 C Bo:1:026:1 0 52 >
ffff88011ce4f540 2394398906 C Bi:1:026:1 0 1 = 69
ffff88011ce4f540 2394401637 S Bi:1:026:1 -115 4096 <
ffff88011ce4fc00 2394401645 S Bo:1:026:1 -115 52 = 39000000 9800dc00 ffffffff 00020000 40000000 00080000 00000000 05000000
ffff88011ce4fc00 2394401781 C Bo:1:026:1 0 52 >
ffff88011ce4f540 2394401906 C Bi:1:026:1 0 1 = 69
ffff88011ce4f540 2394404675 S Bi:1:026:1 -115 4096 <
ffff88011ce4fc00 2394404683 S Bo:1:026:1 -115 52 = 49000000 9800c000 ffffffff 40000000 40000000 00080000 01000000 04000000
ffff88011ce4fc00 2394404781 C Bo:1:026:1 0 52 >
ffff88011ce4f540 2394404905 C Bi:1:026:1 0 1 = 69
ffff88011ce4f540 2394407568 S Bi:1:026:1 -115 4096 <
ffff88011ce4fc00 2394407576 S Bo:1:026:1 -115 52 = 4a000000 9800c100 ffffffff 80000000 40000000 00080000 01000000 04000000
ffff88011ce4fc00 2394407656 C Bo:1:026:1 0 52 >
ffff88011ce4f540 2394407781 C Bi:1:026:1 0 1 = 69
ffff88011ce4f540 2394410604 S Bi:1:026:1 -115 4096 <
ffff88011ce4fc00 2394410612 S Bo:1:026:1 -115 52 = 3b000000 9800ca00 ffffffff 00010000 40000000 00080000 01000000 05000000
ffff88011ce4fc00 2394410655 C Bo:1:026:1 0 52 >
ffff88011ce4f540 2394410906 C Bi:1:026:1 0 1 = 69
ffff8800966166c0 2394413637 S Bi:1:026:1 -115 4096 <
ffff880096616540 2394413646 S Bo:1:026:1 -115 52 = 4e000000 9800d500 ffffffff 00020000 40000000 00080000 00000000 05000000
ffff880096616540 2394413781 C Bo:1:026:1 0 52 >
ffff8800966166c0 2394413906 C Bi:1:026:1 0 1 = 69
ffff8800966166c0 2394416673 S Bi:1:026:1 -115 4096 <
ffff880096616540 2394416711 S Bo:1:026:1 -115 52 = 4f000000 9800b300 ffffffff 00080000 80000000 00100000 01000000 05000000
ffff880096616540 2394416781 C Bo:1:026:1 0 52 >
ffff8800966166c0 2394416906 C Bi:1:026:1 0 1 = 69
ffff8800966166c0 2394419570 S Bi:1:026:1 -115 4096 <
ffff880096616540 2394419607 S Bo:1:026:1 -115 52 = 17000000 ad007500 ffffffff 20000000 20000000 00020000 00000000 03000000
ffff880096616540 2394419656 C Bo:1:026:1 0 52 >
ffff8800966166c0 2394419906 C Bi:1:026:1 0 1 = 69
ffff8800966166c0 2394422600 S Bi:1:026:1 -115 4096 <
ffff880096616540 2394422638 S Bo:1:026:1 -115 52 = 4b000000 ad005500 ffffffff 20000000 20000000 00020000 01000000 03000000
ffff880096616540 2394422781 C Bo:1:026:1 0 52 >
ffff8800966166c0 2394422905 C Bi:1:026:1 0 1 = 69
ffff8800966166c0 2394425639 S Bi:1:026:1 -115 4096 <
ffff880096616540 2394425648 S Bo:1:026:1 -115 52 = 18000000 ad007600 ffffffff 40000000 20000000 00020000 00000000 04000000
ffff880096616540 2394425781 C Bo:1:026:1 0 52 >
ffff8800966166c0 2394425906 C Bi:1:026:1 0 1 = 69
ffff8800966166c0 2394428670 S Bi:1:026:1 -115 4096 <
ffff880096616540 2394428678 S Bo:1:026:1 -115 52 = 57000000 ad003600 ffffffff 40000000 20000000 00020000 00000000 04000000
ffff880096616540 2394428781 C Bo:1:026:1 0 52 >
ffff8800966166c0 2394428905 C Bi:1:026:1 0 1 = 69
ffff8800966166c0 2394431565 S Bi:1:026:1 -115 4096 <
ffff880096616540 2394431573 S Bo:1:026:1 -115 52 = 53000000 ad004600 ffffffff 40000000 20000000 00020000 01000000 04000000
ffff880096616540 2394431656 C Bo:1:026:1 0 52 >
ffff8800966166c0 2394431781 C Bi:1:026:1 0 1 = 69
ffff8800966166c0 2394434600 S Bi:1:026:1 -115 4096 <
ffff880096616540 2394434608 S Bo:1:026:1 -115 52 = 19000000 ad007900 ffffffff 80000000 20000000 00020000 00000000 04000000
ffff880096616540 2394434656 C Bo:1:026:1 0 52 >
ffff8800966166c0 2394434906 C Bi:1:026:1 0 1 = 69
ffff8800966166c0 2394437637 S Bi:1:026:1 -115 4096 <
ffff880096616540 2394437646 S Bo:1:026:1 -115 52 = 1a000000 ad007400 ffffffff 80000000 20000000 00020000 01000000 04000000
ffff880096616540 2394437781 C Bo:1:026:1 0 52 >
ffff8800966166c0 2394437906 C Bi:1:026:1 0 1 = 69
ffff8800966166c0 2394440672 S Bi:1:026:1 -115 4096 <
ffff880096616540 2394440680 S Bo:1:026:1 -115 52 = 3a000000 ad00f100 ffffffff 80000000 40000000 00080000 00000000 04000000
ffff880096616540 2394440781 C Bo:1:026:1 0 52 >
ffff8800966166c0 2394440906 C Bi:1:026:1 0 1 = 69
ffff8800966166c0 2394443567 S Bi:1:026:1 -115 4096 <
ffff880096616540 2394443575 S Bo:1:026:1 -115 52 = 58000000 ad00a100 ffffffff 80000000 40000000 00080000 00000000 04000000
ffff880096616540 2394443655 C Bo:1:026:1 0 52 >
ffff8800966166c0 2394443781 C Bi:1:026:1 0 1 = 69
ffff88011ce4f540 2394446604 S Bi:1:026:1 -115 4096 <
ffff88011ce4fc00 2394446644 S Bo:1:026:1 -115 52 = 54000000 ad00b100 ffffffff 80000000 40000000 00080000 01000000 04000000
ffff88011ce4fc00 2394446780 C Bo:1:026:1 0 52 >
ffff88011ce4f540 2394446908 C Bi:1:026:1 0 1 = 69
ffff880096616cc0 2394451317 S Bi:1:026:1 -115 4096 <
ffff880096616180 2394451326 S Bo:1:026:1 -115 52 = 46000000 ad00da00 ffffffff 00010000 40000000 00080000 00000000 05000000
ffff880096616180 2394451410 C Bo:1:026:1 0 52 >
ffff880096616cc0 2394451530 C Bi:1:026:1 0 1 = 69
ffff88011ce4fd80 2394454349 S Bi:1:026:1 -115 4096 <
ffff88011ce4f300 2394454373 S Bo:1:026:1 -115 52 = 4c000000 ad00c100 ffffffff 00010000 40000000 00080000 01000000 04000000
ffff88011ce4f300 2394454406 C Bo:1:026:1 0 52 >
ffff88011ce4fd80 2394454657 C Bi:1:026:1 0 1 = 69
ffff880096616cc0 2394457243 S Bi:1:026:1 -115 4096 <
ffff880096616180 2394457319 S Bo:1:026:1 -115 52 = 4d000000 ad00d300 ffffffff 00040000 40000000 00080000 00000000 05000000
ffff880096616180 2394457407 C Bo:1:026:1 0 52 >
ffff880096616cc0 2394457531 C Bi:1:026:1 0 1 = 69
ffff880096616cc0 2394460277 S Bi:1:026:1 -115 4096 <
ffff880096616180 2394460285 S Bo:1:026:1 -115 52 = 67000000 ad00bc00 905554ff 00020000 40000000 00080000 01000000 05000000
ffff880096616180 2394460406 C Bo:1:026:1 0 52 >
ffff880096616cc0 2394460530 C Bi:1:026:1 0 1 = 69
ffff880096616cc0 2394463311 S Bi:1:026:1 -115 4096 <
ffff880096616180 2394463320 S Bo:1:026:1 -115 52 = 64000000 ad00bc00 ffffffff 00020000 40000000 00080000 01000000 05000000
ffff880096616180 2394463406 C Bo:1:026:1 0 52 >
ffff880096616cc0 2394463530 C Bi:1:026:1 0 1 = 69
ffff880096616cc0 2394466208 S Bi:1:026:1 -115 4096 <
ffff880096616180 2394466217 S Bo:1:026:1 -115 52 = 56000000 ad00bc00 ffffffff 00020000 40000000 00080000 01000000 05000000
ffff880096616180 2394466280 C Bo:1:026:1 0 52 >
ffff880096616cc0 2394466531 C Bi:1:026:1 0 1 = 69
ffff880096616cc0 2394469247 S Bi:1:026:1 -115 4096 <
ffff880096616180 2394469255 S Bo:1:026:1 -115 52 = 1b000000 20007300 ffffffff 10000000 20000000 00020000 00000000 03000000
ffff880096616180 2394469280 C Bo:1:026:1 0 52 >
ffff880096616cc0 2394469531 C Bi:1:026:1 0 1 = 69
ffff880096616cc0 2394472281 S Bi:1:026:1 -115 4096 <
ffff880096616180 2394472290 S Bo:1:026:1 -115 52 = 1c000000 20005300 ffffffff 10000000 20000000 00020000 01000000 03000000
ffff880096616180 2394472406 C Bo:1:026:1 0 52 >
ffff880096616cc0 2394472531 C Bi:1:026:1 0 1 = 69
ffff88011ce4fd80 2394475316 S Bi:1:026:1 -115 4096 <
ffff88011ce4f300 2394475327 S Bo:1:026:1 -115 52 = 1d000000 20007500 ffffffff 20000000 20000000 00020000 00000000 03000000
ffff88011ce4f300 2394475405 C Bo:1:026:1 0 52 >
ffff88011ce4fd80 2394475534 C Bi:1:026:1 0 1 = 69
ffff88011ce4fd80 2394478344 S Bi:1:026:1 -115 4096 <
ffff88011ce4f300 2394478383 S Bo:1:026:1 -115 52 = 1e000000 20005500 ffffffff 20000000 20000000 00020000 01000000 03000000
ffff88011ce4f300 2394478531 C Bo:1:026:1 0 52 >
ffff88011ce4fd80 2394478657 C Bi:1:026:1 0 1 = 69
ffff88011ce4fd80 2394481270 S Bi:1:026:1 -115 4096 <
ffff88011ce4f300 2394481306 S Bo:1:026:1 -115 52 = 1f000000 20007600 ffffffff 40000000 20000000 00020000 00000000 04000000
ffff88011ce4f300 2394481406 C Bo:1:026:1 0 52 >
ffff88011ce4fd80 2394481531 C Bi:1:026:1 0 1 = 69
ffff88011ce4fd80 2394484281 S Bi:1:026:1 -115 4096 <
ffff88011ce4f300 2394484366 S Bo:1:026:1 -115 52 = 5b000000 20003600 ffffffff 40000000 20000000 00020000 00000000 04000000
ffff88011ce4f300 2394484405 C Bo:1:026:1 0 52 >
ffff88011ce4fd80 2394484656 C Bi:1:026:1 0 1 = 69
ffff880096616cc0 2394487320 S Bi:1:026:1 -115 4096 <
ffff880096616180 2394487329 S Bo:1:026:1 -115 52 = 20000000 20005600 ffffffff 40000000 20000000 00020000 01000000 04000000
ffff880096616180 2394487405 C Bo:1:026:1 0 52 >
ffff880096616cc0 2394487531 C Bi:1:026:1 0 1 = 69
ffff880096616cc0 2394490346 S Bi:1:026:1 -115 4096 <
ffff880096616180 2394490354 S Bo:1:026:1 -115 52 = 5c000000 20004600 ffffffff 40000000 20000000 00020000 01000000 04000000
ffff880096616180 2394490406 C Bo:1:026:1 0 52 >
ffff880096616cc0 2394490656 C Bi:1:026:1 0 1 = 69
ffff880096616cc0 2394493245 S Bi:1:026:1 -115 4096 <
ffff880096616180 2394493254 S Bo:1:026:1 -115 52 = 21000000 20007900 ffffffff 80000000 20000000 00020000 00000000 04000000
ffff880096616180 2394493280 C Bo:1:026:1 0 52 >
ffff880096616cc0 2394493531 C Bi:1:026:1 0 1 = 69
ffff880096616cc0 2394496278 S Bi:1:026:1 -115 4096 <
ffff880096616180 2394496287 S Bo:1:026:1 -115 52 = 22000000 20005900 ffffffff 80000000 20000000 00020000 01000000 04000000
ffff880096616180 2394496406 C Bo:1:026:1 0 52 >
ffff880096616cc0 2394496530 C Bi:1:026:1 0 1 = 69
ffff880096616cc0 2394499316 S Bi:1:026:1 -115 4096 <
ffff880096616180 2394499324 S Bo:1:026:1 -115 52 = 23000000 2000a200 ffffffff 40000000 40000000 00080000 00000000 04000000
ffff880096616180 2394499406 C Bo:1:026:1 0 52 >
ffff880096616cc0 2394499530 C Bi:1:026:1 0 1 = 69
ffff880096616cc0 2394502339 S Bi:1:026:1 -115 4096 <
ffff880096616180 2394502347 S Bo:1:026:1 -115 52 = 24000000 2000f200 ffffffff 40000000 40000000 00080000 00000000 04000000
ffff880096616180 2394502406 C Bo:1:026:1 0 52 >
ffff880096616cc0 2394502656 C Bi:1:026:1 0 1 = 69
ffff880096616cc0 2394505247 S Bi:1:026:1 -115 4096 <
ffff880096616180 2394505255 S Bo:1:026:1 -115 52 = 25000000 2000b200 ffffffff 40000000 40000000 00080000 01000000 04000000
ffff880096616180 2394505280 C Bo:1:026:1 0 52 >
ffff880096616cc0 2394505530 C Bi:1:026:1 0 1 = 69
ffff880096616cc0 2394508283 S Bi:1:026:1 -115 4096 <
ffff880096616180 2394508320 S Bo:1:026:1 -115 52 = 26000000 2000c200 ffffffff 40000000 40000000 00080000 01000000 04000000
ffff880096616180 2394508405 C Bo:1:026:1 0 52 >
ffff880096616cc0 2394508531 C Bi:1:026:1 0 1 = 69
ffff88011ce4f540 2394511315 S Bi:1:026:1 -115 4096 <
ffff88011ce4fc00 2394511339 S Bo:1:026:1 -115 52 = 27000000 2000a100 ffffffff 80000000 40000000 00080000 00000000 04000000
ffff88011ce4fc00 2394511406 C Bo:1:026:1 0 52 >
ffff88011ce4f540 2394511656 C Bi:1:026:1 0 1 = 69
ffff88011ce4f540 2394514346 S Bi:1:026:1 -115 4096 <
ffff88011ce4fc00 2394514377 S Bo:1:026:1 -115 52 = 28000000 2000f100 ffffffff 80000000 40000000 00080000 00000000 04000000
ffff88011ce4fc00 2394514405 C Bo:1:026:1 0 52 >
ffff88011ce4f540 2394514656 C Bi:1:026:1 0 1 = 69
ffff88011ce4f540 2394517243 S Bi:1:026:1 -115 4096 <
ffff88011ce4fc00 2394517268 S Bo:1:026:1 -115 52 = 29000000 2000b100 ffffffff 80000000 40000000 00080000 01000000 04000000
ffff88011ce4fc00 2394517406 C Bo:1:026:1 0 52 >
ffff88011ce4f540 2394517532 C Bi:1:026:1 0 1 = 69
ffff88011ce4f540 2394520276 S Bi:1:026:1 -115 4096 <
ffff88011ce4fc00 2394520285 S Bo:1:026:1 -115 52 = 2a000000 2000c100 ffffffff 80000000 40000000 00080000 01000000 04000000
ffff88011ce4fc00 2394520406 C Bo:1:026:1 0 52 >
ffff88011ce4f540 2394520532 C Bi:1:026:1 0 1 = 69
ffff88011ce4f540 2394523316 S Bi:1:026:1 -115 4096 <
ffff88011ce4fc00 2394523325 S Bo:1:026:1 -115 52 = 2b000000 2000aa00 ffffffff 00010000 40000000 00080000 00000000 05000000
ffff88011ce4fc00 2394523406 C Bo:1:026:1 0 52 >
ffff88011ce4f540 2394523532 C Bi:1:026:1 0 1 = 69
ffff88011ce4f540 2394526210 S Bi:1:026:1 -115 4096 <
ffff88011ce4fc00 2394526219 S Bo:1:026:1 -115 52 = 2c000000 2000da00 ffffffff 00010000 40000000 00080000 00000000 05000000
ffff88011ce4fc00 2394526280 C Bo:1:026:1 0 52 >
ffff88011ce4f540 2394526532 C Bi:1:026:1 0 1 = 69
ffff88011ce4f540 2394529248 S Bi:1:026:1 -115 4096 <
ffff88011ce4fc00 2394529256 S Bo:1:026:1 -115 52 = 2d000000 2000ba00 ffffffff 00010000 40000000 00080000 01000000 05000000
ffff88011ce4fc00 2394529281 C Bo:1:026:1 0 52 >
ffff88011ce4f540 2394529532 C Bi:1:026:1 0 1 = 69
ffff88011ce4f540 2394532282 S Bi:1:026:1 -115 4096 <
ffff88011ce4fc00 2394532290 S Bo:1:026:1 -115 52 = 2e000000 2000ca00 ffffffff 00010000 40000000 00080000 01000000 05000000
ffff88011ce4fc00 2394532405 C Bo:1:026:1 0 52 >
ffff88011ce4f540 2394532532 C Bi:1:026:1 0 1 = 69
ffff88011ce4f540 2394535318 S Bi:1:026:1 -115 4096 <
ffff88011ce4fc00 2394535327 S Bo:1:026:1 -115 52 = 2f000000 2000ac00 ffffffff 00020000 40000000 00080000 00000000 05000000
ffff88011ce4fc00 2394535405 C Bo:1:026:1 0 52 >
ffff88011ce4f540 2394535532 C Bi:1:026:1 0 1 = 69
ffff88011ce4f540 2394538210 S Bi:1:026:1 -115 4096 <
ffff88011ce4fc00 2394538248 S Bo:1:026:1 -115 52 = 30000000 2000dc00 ffffffff 00020000 40000000 00080000 00000000 05000000
ffff88011ce4fc00 2394538280 C Bo:1:026:1 0 52 >
ffff88011ce4f540 2394538532 C Bi:1:026:1 0 1 = 69
ffff880096616300 2394541251 S Bi:1:026:1 -115 4096 <
ffff8800966160c0 2394541260 S Bo:1:026:1 -115 52 = 31000000 2000bc00 ffffffff 00020000 40000000 00080000 01000000 05000000
ffff8800966160c0 2394541406 C Bo:1:026:1 0 52 >
ffff880096616300 2394541530 C Bi:1:026:1 0 1 = 69
ffff880096616300 2394544285 S Bi:1:026:1 -115 4096 <
ffff8800966160c0 2394544309 S Bo:1:026:1 -115 52 = 32000000 2000cc00 ffffffff 00020000 40000000 00080000 01000000 05000000
ffff8800966160c0 2394544407 C Bo:1:026:1 0 52 >
ffff880096616300 2394544530 C Bi:1:026:1 0 1 = 69
ffff88011ce4f000 2394547321 S Bi:1:026:1 -115 4096 <
ffff88011ce4f900 2394547332 S Bo:1:026:1 -115 52 = 33000000 2000a300 ffffffff 00040000 40000000 00080000 00000000 05000000
ffff88011ce4f900 2394547406 C Bo:1:026:1 0 52 >
ffff88011ce4f000 2394547532 C Bi:1:026:1 0 1 = 69
ffff880096616300 2394550352 S Bi:1:026:1 -115 4096 <
ffff8800966160c0 2394550361 S Bo:1:026:1 -115 52 = 34000000 2000d300 ffffffff 00040000 40000000 00080000 00000000 05000000
ffff8800966160c0 2394550405 C Bo:1:026:1 0 52 >
ffff880096616300 2394550656 C Bi:1:026:1 0 1 = 69
ffff880096616300 2394553240 S Bi:1:026:1 -115 4096 <
ffff8800966160c0 2394553249 S Bo:1:026:1 -115 52 = 35000000 2000b300 ffffffff 00040000 40000000 00080000 01000000 05000000
ffff8800966160c0 2394553280 C Bo:1:026:1 0 52 >
ffff880096616300 2394553531 C Bi:1:026:1 0 1 = 69
ffff880096616300 2394556322 S Bi:1:026:1 -115 4096 <
ffff8800966160c0 2394556332 S Bo:1:026:1 -115 52 = 36000000 2000c300 ffffffff 00040000 40000000 00080000 01000000 05000000
ffff8800966160c0 2394556405 C Bo:1:026:1 0 52 >
ffff880096616300 2394556531 C Bi:1:026:1 0 1 = 69
ffff88011ce4f000 2394559311 S Bi:1:026:1 -115 4096 <
ffff88011ce4f900 2394559336 S Bo:1:026:1 -115 52 = 40000000 07005800 ffffffff 40000000 08000000 00080000 00000000 04000000
ffff88011ce4f900 2394559405 C Bo:1:026:1 0 52 >
ffff88011ce4f000 2394559532 C Bi:1:026:1 0 1 = 69
ffff88011ce4f000 2394562336 S Bi:1:026:1 -115 4096 <
ffff88011ce4f900 2394562345 S Bo:1:026:1 -115 52 = 41000000 07005b00 ffffffff 40000000 08000000 00080000 01000000 04000000
ffff88011ce4f900 2394562406 C Bo:1:026:1 0 52 >
ffff88011ce4f000 2394562657 C Bi:1:026:1 0 1 = 69
ffff88011ce4f000 2394565246 S Bi:1:026:1 -115 4096 <
ffff88011ce4f900 2394565255 S Bo:1:026:1 -115 52 = 47000000 07004900 ffffffff 20000000 10000000 00020000 00000000 04000000
ffff88011ce4f900 2394565281 C Bo:1:026:1 0 52 >
ffff88011ce4f000 2394565532 C Bi:1:026:1 0 1 = 69
ffff88011ce4f000 2394568282 S Bi:1:026:1 -115 4096 <
ffff88011ce4f900 2394568292 S Bo:1:026:1 -115 52 = 48000000 07004a00 ffffffff 20000000 10000000 00020000 01000000 04000000
ffff88011ce4f900 2394568406 C Bo:1:026:1 0 52 >
ffff88011ce4f000 2394568531 C Bi:1:026:1 0 1 = 69
ffff88011ce4f000 2394571313 S Bi:1:026:1 -115 4096 <
ffff88011ce4f900 2394571350 S Bo:1:026:1 -115 52 = 5f000000 9200f100 ffffffff 80000000 40000000 00080000 00000000 05000000
ffff88011ce4f900 2394571406 C Bo:1:026:1 0 52 >
ffff88011ce4f000 2394571657 C Bi:1:026:1 0 1 = 69
ffff88011ce4f000 2394574209 S Bi:1:026:1 -115 4096 <
ffff88011ce4f900 2394574247 S Bo:1:026:1 -115 52 = ffff0000 00000000 00000000 00000000 00000000 00000000 00000000 00000000
ffff88011ce4f900 2394574280 C Bo:1:026:1 0 52 >
ffff88011ce4f000 2394574406 C Bi:1:026:1 0 1 = 69
ffff880096616300 2394577245 S Bi:1:026:1 -115 4096 <
ffff880096616300 2394652658 C Bi:1:026:1 0 4 = 00000bc3
ffff88011ce4fcc0 2394654306 S Bi:1:026:1 -115 4096 <
ffff88011ce4fcc0 2394654407 C Bi:1:026:1 0 1 = 00
ffff88011ce4fcc0 2394657338 S Bi:1:026:1 -115 4096 <
ffff88011ce4fcc0 2394657407 C Bi:1:026:1 0 1 = 08
ffff88011ce4fcc0 2394660235 S Bi:1:026:1 -115 4096 <
ffff88011ce4fcc0 2394660282 C Bi:1:026:1 0 2 = ffff
ffff88011ce4fcc0 2394663271 S Bi:1:026:1 -115 4096 <
ffff88011ce4fcc0 2394663406 C Bi:1:026:1 0 4 = 00000000
ffff88011ce4fcc0 2394668773 S Bi:1:026:1 -115 4096 <
ffff88011ce4fcc0 2394668909 C Bi:1:026:1 0 2 = 0000
ffff88011ce4fcc0 2394671161 S Bi:1:026:1 -115 4096 <
ffff88011ce4fcc0 2394671283 C Bi:1:026:1 0 2 = 0000
ffff88011ce4fcc0 2394674193 S Bi:1:026:1 -115 4096 <
ffff88011ce4fcc0 2394674282 C Bi:1:026:1 0 2 = 0000
ffff88011ce4fcc0 2394677229 S Bi:1:026:1 -115 4096 <
ffff88011ce4fcc0 2394677282 C Bi:1:026:1 0 2 = 0000
ffff88011ce4fcc0 2394680266 S Bi:1:026:1 -115 4096 <
ffff88011ce4fcc0 2394680407 C Bi:1:026:1 0 4 = 00000000
ffff880096616cc0 2394683457 S Bi:1:026:1 -115 4096 <
ffff880096616cc0 2394683531 C Bi:1:026:1 0 4 = 00000000
ffff880096616cc0 2394686469 S Bi:1:026:1 -115 4096 <
ffff880096616cc0 2394686533 C Bi:1:026:1 0 4 = 00000bc4
ffff880096616cc0 2394689587 S Bi:1:026:1 -115 4096 <
ffff880096616cc0 2394689656 C Bi:1:026:1 0 1 = 00
ffff880096616cc0 2394692283 S Bi:1:026:1 -115 4096 <
ffff880096616cc0 2394692408 C Bi:1:026:1 0 2 = ffff
ffff880096616cc0 2394695163 S Bi:1:026:1 -115 4096 <
ffff880096616cc0 2394695281 C Bi:1:026:1 0 4 = 00000000
ffff880096616cc0 2394698273 S Bi:1:026:1 -115 4096 <
ffff880096616cc0 2394698405 C Bi:1:026:1 0 2 = 0000
ffff880096616cc0 2394701325 S Bi:1:026:1 -115 4096 <
ffff880096616cc0 2394701406 C Bi:1:026:1 0 2 = 0000
ffff880096616cc0 2394704383 S Bi:1:026:1 -115 4096 <
ffff880096616cc0 2394704533 C Bi:1:026:1 0 2 = 0000
ffff880096616cc0 2394708093 S Bi:1:026:1 -115 4096 <
ffff880096616cc0 2394708155 C Bi:1:026:1 0 2 = 0000
ffff880096616cc0 2394714646 S Bi:1:026:1 -115 4096 <
ffff880096616cc0 2394714782 C Bi:1:026:1 0 2 = 0000
ffff880096616cc0 2394717672 S Bi:1:026:1 -115 4096 <
ffff880096616cc0 2394717781 C Bi:1:026:1 0 2 = 0000
ffff880096616cc0 2394720580 S Bi:1:026:1 -115 4096 <
ffff880096616cc0 2394720655 C Bi:1:026:1 0 2 = 0000
ffff88011ce4ff00 2394723615 S Bi:1:026:1 -115 4096 <
ffff88011ce4ff00 2394723658 C Bi:1:026:1 0 2 = 0000
ffff880096616cc0 2394726651 S Bi:1:026:1 -115 4096 <
ffff880096616cc0 2394726781 C Bi:1:026:1 0 1 = 00
ffff880096616cc0 2394729684 S Bi:1:026:1 -115 4096 <
ffff880096616cc0 2394729781 C Bi:1:026:1 0 1 = 00
ffff880096616cc0 2394732579 S Bi:1:026:1 -115 4096 <
ffff880096616cc0 2394732656 C Bi:1:026:1 0 1 = 00
ffff880096616cc0 2394735614 S Bi:1:026:1 -115 4096 <
ffff880096616cc0 2394735656 C Bi:1:026:1 0 4 = 00000000
ffff880096616cc0 2394738648 S Bi:1:026:1 -115 4096 <
ffff880096616cc0 2394738781 C Bi:1:026:1 0 4 = 00100000
ffff880096616cc0 2394741675 S Bi:1:026:1 -115 4096 <
ffff880096616cc0 2394741780 C Bi:1:026:1 0 4 = 00100000
ffff880096616cc0 2394744576 S Bi:1:026:1 -115 4096 <
ffff880096616cc0 2394744655 C Bi:1:026:1 0 4 = 00020000
ffff880096616cc0 2394747615 S Bi:1:026:1 -115 4096 <
ffff880096616cc0 2394747655 C Bi:1:026:1 0 4 = 00000000
ffff88011ce4f6c0 2394750898 S Bi:1:026:1 -115 4096 <
ffff88011ce4f6c0 2394751034 C Bi:1:026:1 0 4 = 00000000
ffff88011ce4f6c0 2394753676 S Bi:1:026:1 -115 4096 <
ffff88011ce4f6c0 2394753781 C Bi:1:026:1 0 4 = 00000000
ffff880096616e40 2394756680 S Bi:1:026:1 -115 4096 <
ffff880096616e40 2394756780 C Bi:1:026:1 0 4 = 00000000
ffff880096616e40 2394759614 S Bi:1:026:1 -115 4096 <
ffff880096616e40 2394759655 C Bi:1:026:1 0 4 = 00000000
ffff880096616e40 2394762650 S Bi:1:026:1 -115 4096 <
ffff880096616e40 2394762780 C Bi:1:026:1 0 4 = e9000000
ffff880096616e40 2394765681 S Bi:1:026:1 -115 4096 <
ffff880096616e40 2394765781 C Bi:1:026:1 0 4 = 4e000115
ffff880096616e40 2394768579 S Bi:1:026:1 -115 4096 <
ffff880096616e40 2394768656 C Bi:1:026:1 0 4 = 3030534a
ffff880096616e40 2394771613 S Bi:1:026:1 -115 4096 <
ffff880096616e40 2394771656 C Bi:1:026:1 0 4 = 0000004d
ffff880096616e40 2394774644 S Bi:1:026:1 -115 4096 <
ffff880096616e40 2394774780 C Bi:1:026:1 0 4 = 00000000
ffff88011ce4f600 2394784212 S Bi:1:026:1 -115 4096 <
ffff88011ce4f600 2394784285 C Bi:1:026:1 0 4 = 00000c49
ffff88011ce4f600 2394786741 S Bi:1:026:1 -115 4096 <
ffff88011ce4f600 2394786782 C Bi:1:026:1 0 4 = 00000000
ffff88011ce4f600 2394789771 S Bi:1:026:1 -115 4096 <
ffff88011ce4f600 2394789907 C Bi:1:026:1 0 4 = 00000000
ffff880096616e40 2394792671 S Bi:1:026:1 -115 4096 <
ffff880096616e40 2394792781 C Bi:1:026:1 0 4 = 00000000
ffff88011ce4f600 2394795702 S Bi:1:026:1 -115 4096 <
ffff88011ce4f600 2394795784 C Bi:1:026:1 0 4 = 00000000
ffff88011ce4f600 2394798737 S Bi:1:026:1 -115 4096 <
ffff88011ce4f600 2394798782 C Bi:1:026:1 0 4 = 00000000
ffff88011ce4f600 2394801760 S Bi:1:026:1 -115 4096 <
ffff88011ce4f600 2394801907 C Bi:1:026:1 0 4 = 00000000
ffff88011ce4f600 2394804666 S Bi:1:026:1 -115 4096 <
ffff88011ce4f600 2394804782 C Bi:1:026:1 0 4 = 00000000
ffff88011ce4f600 2394807705 S Bi:1:026:1 -115 4096 <
ffff88011ce4f600 2394807782 C Bi:1:026:1 0 4 = 00020000
ffff880096616e40 2394810737 S Bi:1:026:1 -115 4096 <
ffff880096616e40 2394810781 C Bi:1:026:1 0 4 = 00000000
ffff880096616e40 2394813764 S Bi:1:026:1 -115 4096 <
ffff880096616e40 2394813906 C Bi:1:026:1 0 1 = 02
ffff880096616e40 2394816667 S Bi:1:026:1 -115 4096 <
ffff880096616e40 2394816781 C Bi:1:026:1 0 1 = 00
ffff88011ce4f0c0 2394819712 S Bi:1:026:1 -115 4096 <
ffff88011ce4f0c0 2394819784 C Bi:1:026:1 0 4 = 20000000
ffff88011ce4f0c0 2394822736 S Bi:1:026:1 -115 4096 <
ffff88011ce4f0c0 2394822781 C Bi:1:026:1 0 1 = 1d
ffff88011ce4f0c0 2394825764 S Bi:1:026:1 -115 4096 <
ffff88011ce4f0c0 2394825907 C Bi:1:026:1 0 1 = 50
ffff88011ce4f0c0 2394828668 S Bi:1:026:1 -115 4096 <
ffff88011ce4f0c0 2394828782 C Bi:1:026:1 0 1 = ee
ffff88011ce4f0c0 2394831704 S Bi:1:026:1 -115 4096 <
ffff88011ce4f0c0 2394831782 C Bi:1:026:1 0 1 = 4e
ffff88011ce4f0c0 2394834735 S Bi:1:026:1 -115 4096 <
ffff88011ce4f0c0 2394834782 C Bi:1:026:1 0 1 = 59
ffff88011ce4f0c0 2394837765 S Bi:1:026:1 -115 4096 <
ffff88011ce4f0c0 2394837907 C Bi:1:026:1 0 1 = 2e
ffff88011ce4f0c0 2394840667 S Bi:1:026:1 -115 4096 <
ffff88011ce4f0c0 2394840783 C Bi:1:026:1 0 1 = 78
ffff880096616e40 2394843703 S Bi:1:026:1 -115 4096 <
ffff880096616e40 2394843780 C Bi:1:026:1 0 1 = da
ffff88011ce4f0c0 2394846736 S Bi:1:026:1 -115 4096 <
ffff88011ce4f0c0 2394846781 C Bi:1:026:1 0 1 = 6e
ffff88011ce4f0c0 2394849632 S Bi:1:026:1 -115 4096 <
ffff88011ce4f0c0 2394849782 C Bi:1:026:1 0 1 = 20
ffff88011ce4f0c0 2394852667 S Bi:1:026:1 -115 4096 <
ffff88011ce4f0c0 2394852782 C Bi:1:026:1 0 1 = 6d
ffff88011ce4f0c0 2394855703 S Bi:1:026:1 -115 4096 <
ffff88011ce4f0c0 2394855782 C Bi:1:026:1 0 1 = ea
ffff88011ce4f0c0 2394858792 S Bi:1:026:1 -115 4096 <
ffff88011ce4f0c0 2394858906 C Bi:1:026:1 0 1 = 07
ffff88011ce4f0c0 2394861760 S Bi:1:026:1 -115 4096 <
ffff88011ce4f0c0 2394861907 C Bi:1:026:1 0 1 = 3b
ffff88011ce4f0c0 2394864669 S Bi:1:026:1 -115 4096 <
ffff88011ce4f0c0 2394864781 C Bi:1:026:1 0 1 = dd
ffff880096616180 2394867702 S Bi:1:026:1 -115 4096 <
ffff880096616180 2394867780 C Bi:1:026:1 0 1 = 8a
ffff88011ce4f0c0 2394871612 S Bi:1:026:1 -115 4096 <
ffff88011ce4f0c0 2395614661 C Bi:1:026:1 0 1 = 5a
ffff8800966166c0 2395628629 S Bi:1:026:1 -115 4096 <
ffff8800966166c0 2395628782 C Bi:1:026:1 0 4 = 00000c06
ffff8800966166c0 2395631519 S Bi:1:026:1 -115 4096 <
ffff8800966166c0 2395631655 C Bi:1:026:1 0 4 = 00000409
ffff8800966166c0 2395634554 S Bi:1:026:1 -115 4096 <
ffff8800966166c0 2395634656 C Bi:1:026:1 0 1 = c1
ffff8800966166c0 2395640776 S Bi:1:026:1 -115 4096 <
ffff88011ce4f600 2395641508 S Bo:1:026:1 -115 1 = 70
ffff88011ce4f600 2395641659 C Bo:1:026:1 0 1 >
ffff880096616540 2395647941 S Bo:1:026:1 -115 1 = 01
ffff880096616540 2395648031 C Bo:1:026:1 0 1 >
ffff8800966166c0 2395648281 C Bi:1:026:1 0 1 = 5a
ffff8800966166c0 2395651305 S Bi:1:026:1 -115 4096 <
ffff880096616540 2395651333 S Co:1:026:0 s 21 22 0002 0001 0000 0
ffff880096616540 2395651532 C Co:1:026:0 0 0
ffff880134d1b0c0 2396065795 C Ii:1:001:1 0:2048 2 = 8000
ffff880134d1b0c0 2396065802 S Ii:1:001:1 -115:2048 4 <
ffff88011ce4f6c0 2396065810 S Ci:1:001:0 s a3 00 0000 0007 0004 4 <
ffff88011ce4f6c0 2396065813 C Ci:1:001:0 0 4 = 00010100
ffff88011ce4f6c0 2396065815 S Co:1:001:0 s 23 01 0010 0007 0000 0
ffff88011ce4f6c0 2396065818 C Co:1:001:0 0 0
ffff8800966166c0 2396065906 C Bi:1:026:1 -108 0
ffff880044b31840 2396066084 C Ii:1:026:3 -108:8192 0
ffff88011ce4f900 2396066710 S Ci:1:001:0 s a3 00 0000 0007 0004 4 <
ffff88011ce4f900 2396066713 C Ci:1:001:0 0 4 = 00010000
ffff88010ce89e40 2396097492 S Ci:1:001:0 s a3 00 0000 0007 0004 4 <
ffff88010ce89e40 2396097499 C Ci:1:001:0 0 4 = 00010000
ffff88010ce893c0 2396129489 S Ci:1:001:0 s a3 00 0000 0007 0004 4 <
ffff88010ce893c0 2396129495 C Ci:1:001:0 0 4 = 00010000
ffff88010ce893c0 2396161484 S Ci:1:001:0 s a3 00 0000 0007 0004 4 <
ffff88010ce893c0 2396161489 C Ci:1:001:0 0 4 = 00010000
ffff88010ce893c0 2396193662 S Ci:1:001:0 s a3 00 0000 0007 0004 4 <
ffff88010ce893c0 2396193669 C Ci:1:001:0 0 4 = 00010000
ffff88010ce893c0 2396193672 S Ci:1:001:0 s a3 00 0000 0008 0004 4 <
ffff88010ce893c0 2396193674 C Ci:1:001:0 0 4 = 00010000
ffff880134d1b0c0 2396318462 C Ii:1:001:1 0:2048 2 = 8000
ffff880134d1b0c0 2396318470 S Ii:1:001:1 -115:2048 4 <
ffff88010ce893c0 2396318482 S Ci:1:001:0 s a3 00 0000 0007 0004 4 <
ffff88010ce893c0 2396318485 C Ci:1:001:0 0 4 = 01050100
ffff88010ce893c0 2396318488 S Co:1:001:0 s 23 01 0010 0007 0000 0
ffff88010ce893c0 2396318490 C Co:1:001:0 0 0
ffff88010ce893c0 2396318492 S Ci:1:001:0 s a3 00 0000 0007 0004 4 <
ffff88010ce893c0 2396318493 C Ci:1:001:0 0 4 = 01050000
ffff88010ce89780 2396349492 S Ci:1:001:0 s a3 00 0000 0007 0004 4 <
ffff88010ce89780 2396349501 C Ci:1:001:0 0 4 = 01050000
ffff88010ce89780 2396381485 S Ci:1:001:0 s a3 00 0000 0007 0004 4 <
ffff88010ce89780 2396381492 C Ci:1:001:0 0 4 = 01050000
ffff88010ce89780 2396413489 S Ci:1:001:0 s a3 00 0000 0007 0004 4 <
ffff88010ce89780 2396413495 C Ci:1:001:0 0 4 = 01050000
ffff88005d4a6900 2396445487 S Ci:1:001:0 s a3 00 0000 0007 0004 4 <
ffff88005d4a6900 2396445493 C Ci:1:001:0 0 4 = 01050000
ffff88005d4a6900 2396445503 S Co:1:001:0 s 23 03 0004 0007 0000 0
ffff88005d4a6900 2396445506 C Co:1:001:0 0 0
ffff88005d4a6900 2396501488 S Ci:1:001:0 s a3 00 0000 0007 0004 4 <
ffff88005d4a6900 2396501779 C Ci:1:001:0 0 4 = 03051000
ffff88005d4a6d80 2396557486 S Co:1:001:0 s 23 01 0014 0007 0000 0
ffff88005d4a6d80 2396557493 C Co:1:001:0 0 0
ffff88005d4a6d80 2396557505 S Ci:1:000:0 s 80 06 0100 0000 0040 64 <
ffff88005d4a6d80 2396557659 C Ci:1:000:0 0 18 = 12011001 02000040 8d0e0120 00010000 0001
ffff88005d4a6d80 2396557665 S Co:1:001:0 s 23 03 0004 0007 0000 0
ffff88005d4a6d80 2396557668 C Co:1:001:0 0 0
ffff88010ce89780 2396613488 S Ci:1:001:0 s a3 00 0000 0007 0004 4 <
ffff88010ce89780 2396613779 C Ci:1:001:0 0 4 = 03051000
ffff88005d4a6e40 2396669492 S Co:1:001:0 s 23 01 0014 0007 0000 0
ffff88005d4a6e40 2396669499 C Co:1:001:0 0 0
ffff88005d4a6e40 2396669502 S Co:1:000:0 s 00 05 001b 0000 0000 0
ffff88005d4a6e40 2396669660 C Co:1:000:0 0 0
ffff88005d4a6e40 2396689483 S Ci:1:027:0 s 80 06 0100 0000 0012 18 <
ffff88005d4a6e40 2396689658 C Ci:1:027:0 0 18 = 12011001 02000040 8d0e0120 00010000 0001
ffff88005d4a6e40 2396689686 S Ci:1:027:0 s 80 06 0200 0000 0009 9 <
ffff88005d4a6e40 2396689782 C Ci:1:027:0 0 9 = 09024300 02010080 00
ffff88010ce899c0 2396689789 S Ci:1:027:0 s 80 06 0200 0000 0043 67 <
ffff88010ce899c0 2396689907 C Ci:1:027:0 0 67 = 09024300 02010080 00090400 00020a00 00010705 81020002 00070501 02000200
ffff88010ce89180 2396690046 S Co:1:027:0 s 00 09 0001 0000 0000 0
ffff88010ce89180 2396690156 C Co:1:027:0 0 0
ffff88005d4a6d80 2396690233 S Ci:1:027:0 s 80 06 0300 0000 00ff 255 <
ffff88005d4a6d80 2396690281 C Ci:1:027:0 0 4 = 04030904
ffff88005d4a6d80 2396690310 S Ci:1:027:0 s 80 06 0301 0409 00ff 255 <
ffff88005d4a6d80 2396690532 C Ci:1:027:0 0 144 = 90240306 d02c0306 80200306 90200106 90340316 8024830e b0240306 90260306
ffff88005d4a6d80 2396690539 S Ci:1:027:0 s 80 06 0301 0409 00ff 255 <
ffff88005d4a6d80 2396690656 C Ci:1:027:0 0 144 = 90240306 d02c0306 80200306 90200106 90340316 8024830e b0240306 90260306
ffff88005d4a6d80 2396690662 S Ci:1:027:0 s 80 06 0301 0409 00ff 255 <
ffff88005d4a6d80 2396690781 C Ci:1:027:0 0 144 = 90240306 d02c0306 80200306 90200106 90340316 8024830e b0240306 90260306
ffff88005d4a6d80 2396690789 S Ci:1:027:0 s 80 06 0301 0409 0002 2 <
ffff88005d4a6d80 2396690906 C Ci:1:027:0 0 2 = 9024
ffff88005d4a6d80 2396690910 S Ci:1:027:0 s 80 06 0301 0409 0002 2 <
ffff88005d4a6d80 2396691030 C Ci:1:027:0 0 2 = 9024
ffff88005d4a6d80 2396691035 S Ci:1:027:0 s 80 06 0301 0409 0002 2 <
ffff88005d4a6d80 2396691155 C Ci:1:027:0 0 2 = 9024
ffff88005d4a6240 2396691248 S Ci:1:027:0 s 80 06 0302 0409 00ff 255 <
ffff88005d4a6240 2396691406 C Ci:1:027:0 0 0
ffff88005d4a6240 2396691411 S Ci:1:027:0 s 80 06 0302 0409 00ff 255 <
ffff88005d4a6240 2396691531 C Ci:1:027:0 0 0
ffff88005d4a6240 2396691535 S Ci:1:027:0 s 80 06 0302 0409 00ff 255 <
ffff88005d4a6240 2396691655 C Ci:1:027:0 0 0
ffff88005d4a6240 2396691660 S Ci:1:027:0 s 80 06 0302 0409 0002 2 <
ffff88005d4a6240 2396691781 C Ci:1:027:0 0 0
ffff88005d4a6240 2396693560 S Ci:1:027:0 s 80 06 0302 0409 0002 2 <
ffff88005d4a6240 2396693657 C Ci:1:027:0 0 0
ffff8800acd42780 2396693664 S Ci:1:027:0 s 80 06 0302 0409 0002 2 <
ffff8800acd42780 2396693782 C Ci:1:027:0 0 0
ffff88011ce4fb40 2396693897 S Co:1:027:0 s 21 22 0000 0001 0000 0
ffff88011ce4fb40 2396694031 C Co:1:027:0 0 0
ffff8800acd42480 2396694039 S Co:1:027:0 s 21 20 0000 0001 0007 7 = 80250000 000008
ffff8800acd42480 2396694157 C Co:1:027:0 0 7 >
ffff88011ce4fa80 2396694453 S Ci:1:001:0 s a3 00 0000 0008 0004 4 <
ffff88011ce4fa80 2396694457 C Ci:1:001:0 0 4 = 00010000
ffff88000307cf00 2396715678 S Ci:1:027:0 s 80 06 0100 0000 0012 18 <
ffff88000307cf00 2396715909 C Ci:1:027:0 0 18 = 12011001 02000040 8d0e0120 00010000 0001
ffff88000307cf00 2396715951 S Ci:1:027:0 s 80 06 0200 0000 0009 9 <
ffff88000307cf00 2396716158 C Ci:1:027:0 0 9 = 09024300 02010080 00
ffff88000307cf00 2396716189 S Ci:1:027:0 s 80 06 0200 0000 0043 67 <
ffff88000307cf00 2396716406 C Ci:1:027:0 0 67 = 09024300 02010080 00090400 00020a00 00010705 81020002 00070501 02000200
ffff8800acd42e40 2396985295 S Ci:1:027:0 s 80 06 0100 0000 0040 64 <
ffff8800acd42e40 2396985409 C Ci:1:027:0 0 18 = 12011001 02000040 8d0e0120 00010000 0001
ffff88006c351000 2397160758 S Ci:1:027:0 s 80 06 0100 0000 0012 18 <
ffff88006c351000 2397160911 C Ci:1:027:0 0 18 = 12011001 02000040 8d0e0120 00010000 0001
ffff88006c351000 2397163756 S Ci:1:027:0 s 80 06 0200 0000 0009 9 <
ffff88006c351000 2397163908 C Ci:1:027:0 0 9 = 09024300 02010080 00
ffff88006c351000 2397166629 S Ci:1:027:0 s 80 06 0200 0000 00ff 255 <
ffff88006c351000 2397166782 C Ci:1:027:0 0 67 = 09024300 02010080 00090400 00020a00 00010705 81020002 00070501 02000200
ffff88006c351000 2397178357 S Ci:1:027:0 s 80 06 0100 0000 0012 18 <
ffff88006c351000 2397178536 C Ci:1:027:0 0 18 = 12011001 02000040 8d0e0120 00010000 0001
ffff88006c351000 2397189949 S Ci:1:027:0 s 80 06 0200 0000 0109 265 <
ffff88006c351000 2397190158 C Ci:1:027:0 0 67 = 09024300 02010080 00090400 00020a00 00010705 81020002 00070501 02000200
ffff88006c3513c0 2397263753 S Ci:1:027:0 s a1 21 0000 0001 0007 7 <
ffff88006c3513c0 2397263909 C Ci:1:027:0 0 7 = 80250000 000008
ffff8800acd42e40 2397266628 S Co:1:027:0 s 21 22 0000 0001 0000 0
ffff8800acd42e40 2397266781 C Co:1:027:0 0 0
ffff8800acd42e40 2397270740 S Bi:1:027:1 -115 4096 <
ffff8800acd42780 2397273768 S Ii:1:027:4 -115:1 10 <
ffff88006c351000 2397471659 S Ci:1:027:0 s a1 21 0000 0001 0007 7 <
ffff88006c351000 2397471785 C Ci:1:027:0 0 7 = 80250000 000008
ffff88006c351000 2397474569 S Ci:1:027:0 s a1 21 0000 0001 0007 7 <
ffff88006c351000 2397474658 C Ci:1:027:0 0 7 = 80250000 000008
ffff88006c351000 2397477602 S Ci:1:027:0 s a1 21 0000 0001 0007 7 <
ffff88006c351000 2397477658 C Ci:1:027:0 0 7 = 80250000 000008
ffff88006c351000 2397480498 S Ci:1:027:0 s a1 21 0000 0001 0007 7 <
ffff88006c351000 2397480657 C Ci:1:027:0 0 7 = 80250000 000008
ffff8800acd42c00 2397487211 S Co:1:027:0 s 21 20 0000 0001 0007 7 = 00c20100 000008
ffff8800acd42c00 2397487284 C Co:1:027:0 0 7 >
ffff8800acd42c00 2397489293 S Ci:1:027:0 s a1 21 0000 0001 0007 7 <
ffff8800acd42c00 2397489407 C Ci:1:027:0 0 7 = 00c20100 000008
ffff88004fd0c600 2397492127 S Co:1:027:0 s 21 22 0003 0001 0000 0
ffff88004fd0c600 2397492282 C Co:1:027:0 0 0
ffff88004fd0c600 2397495161 S Co:1:027:0 s 21 20 0000 0001 0007 7 = 00c20100 000008
ffff88004fd0c600 2397495282 C Co:1:027:0 0 7 >
ffff88004fd0c600 2397497185 S Ci:1:027:0 s a1 21 0000 0001 0007 7 <
ffff88004fd0c600 2397497282 C Ci:1:027:0 0 7 = 00c20100 000008
ffff8800acd42c00 2397500899 S Co:1:027:0 s 21 23 0000 0001 0000 0
ffff8800acd42c00 2397501031 C Co:1:027:0 0 0
ffff8800acd42c00 2397502111 S Co:1:027:0 s 21 22 0003 0001 0000 0
ffff8800acd42c00 2397502282 C Co:1:027:0 0 0
ffff8800acd42c00 2397507529 S Bo:1:027:1 -115 1 = f0
ffff8800acd42c00 2397507656 C Bo:1:027:1 0 1 >
ffff8800acd42e40 2397508031 C Bi:1:027:1 0 4 = 00000bfa
ffff8800acd42e40 2397510380 S Bo:1:027:1 -115 1 = 60
ffff8800acd42e40 2397510406 C Bo:1:027:1 0 1 >
ffff8800acd42c00 2397510516 S Bi:1:027:1 -115 4096 <
ffff8800acd42c00 2397510905 C Bi:1:027:1 0 1 = 5a
ffff8800acd42c00 2397513414 S Bo:1:027:1 -115 1 = 00
ffff8800acd42e40 2397513423 S Bi:1:027:1 -115 4096 <
ffff8800acd42c00 2397513531 C Bo:1:027:1 0 1 >
ffff8800acd42e40 2397513536 C Bi:1:027:1 0 1 = 5a
ffff88004fd0c600 2397516679 S Bi:1:027:1 -115 4096 <
ffff88013815a6c0 2397552364 S Bo:1:027:1 -115 1 = d6
ffff88013815a6c0 2397552410 C Bo:1:027:1 0 1 >
ffff88013815a6c0 2397555338 S Bo:1:027:1 -115 1 = 02
ffff88013815a6c0 2397555407 C Bo:1:027:1 0 1 >
ffff88013815a6c0 2397558372 S Bo:1:027:1 -115 8 = 00000000 00000000
ffff88013815a6c0 2397558407 C Bo:1:027:1 0 8 >
ffff8800acd42480 2397561408 S Bo:1:027:1 -115 8 = 00000000 00000400
ffff8800acd42480 2397561531 C Bo:1:027:1 0 8 >
ffff88004fd0c600 2397561537 C Bi:1:027:1 0 1 = 5a
ffff8800acd42480 2397564414 S Bi:1:027:1 -115 4096 <
ffff8800acd42000 2397571794 S Bo:1:027:1 -115 4 = 00000400
ffff8800acd42000 2397571908 C Bo:1:027:1 0 4 >
ffff8800acd42480 2397573531 C Bi:1:027:1 0 1025 = 454d4d43 5f424f4f 54000000 01000000 00020000 ffffffff ffffffff ffffffff
ffff8800acd42480 2397574641 S Bi:1:027:1 -115 4096 <
ffff8800acd42480 2397574780 C Bi:1:027:1 0 1 = 95
ffff8800acd42480 2397578080 S Bi:1:027:1 -115 4096 <
ffff8800acd42000 2397580291 S Bo:1:027:1 -115 1 = 5a
ffff8800acd42000 2397580408 C Bo:1:027:1 0 1 >
ffff8800acd42000 2397583525 S Bo:1:027:1 -115 1 = d9
ffff8800acd42000 2397583657 C Bo:1:027:1 0 1 >
ffff8800acd42480 2397584031 C Bi:1:027:1 0 1 = 5a
ffff880134d1b0c0 2397584293 C Ii:1:001:1 0:2048 2 = 8000
ffff880134d1b0c0 2397584298 S Ii:1:001:1 -115:2048 4 <
ffff8800acd42d80 2397584304 S Ci:1:001:0 s a3 00 0000 0007 0004 4 <
ffff8800acd42d80 2397584307 C Ci:1:001:0 0 4 = 00010100
ffff8800acd42d80 2397584309 S Co:1:001:0 s 23 01 0010 0007 0000 0
ffff8800acd42d80 2397584311 C Co:1:001:0 0 0
ffff8800acd42780 2397584511 C Ii:1:027:4 -108:1 0
ffff8800a576a600 2397593075 S Ci:1:001:0 s a3 00 0000 0007 0004 4 <
ffff8800a576a600 2397593080 C Ci:1:001:0 0 4 = 00010000
ffff8800a576a6c0 2397621496 S Ci:1:001:0 s a3 00 0000 0007 0004 4 <
ffff8800a576a6c0 2397621505 C Ci:1:001:0 0 4 = 00010000
ffff8800a576a300 2397653490 S Ci:1:001:0 s a3 00 0000 0007 0004 4 <
ffff8800a576a300 2397653498 C Ci:1:001:0 0 4 = 00010000
ffff88012bff1240 2397685492 S Ci:1:001:0 s a3 00 0000 0007 0004 4 <
ffff88012bff1240 2397685499 C Ci:1:001:0 0 4 = 00010000
ffff88012bff1240 2397717498 S Ci:1:001:0 s a3 00 0000 0007 0004 4 <
ffff88012bff1240 2397717503 C Ci:1:001:0 0 4 = 00010000
ffff88012bff1240 2397717506 S Ci:1:001:0 s a3 00 0000 0008 0004 4 <
ffff88012bff1240 2397717508 C Ci:1:001:0 0 4 = 00010000
