ffff880134d1b0c0 2041741861 C Ii:1:001:1 0:2048 2 = 8000
ffff880134d1b0c0 2041741872 S Ii:1:001:1 -115:2048 4 <
ffff880134eb5240 2041741879 S Ci:1:001:0 s a3 00 0000 0007 0004 4 <
ffff880134eb5240 2041741885 C Ci:1:001:0 0 4 = 01050100
ffff880134eb5240 2041741887 S Co:1:001:0 s 23 01 0010 0007 0000 0
ffff880134eb5240 2041741890 C Co:1:001:0 0 0
ffff880134eb5240 2041741891 S Ci:1:001:0 s a3 00 0000 0007 0004 4 <
ffff880134eb5240 2041741893 C Ci:1:001:0 0 4 = 01050000
ffff8800966fc840 2041773488 S Ci:1:001:0 s a3 00 0000 0007 0004 4 <
ffff8800966fc840 2041773495 C Ci:1:001:0 0 4 = 01050000
ffff8800966fc180 2041805494 S Ci:1:001:0 s a3 00 0000 0007 0004 4 <
ffff8800966fc180 2041805500 C Ci:1:001:0 0 4 = 01050000
ffff880134eb5240 2041837489 S Ci:1:001:0 s a3 00 0000 0007 0004 4 <
ffff880134eb5240 2041837494 C Ci:1:001:0 0 4 = 01050000
ffff8800966fc180 2041869491 S Ci:1:001:0 s a3 00 0000 0007 0004 4 <
ffff8800966fc180 2041869497 C Ci:1:001:0 0 4 = 01050000
ffff8800966fc180 2041869507 S Co:1:001:0 s 23 03 0004 0007 0000 0
ffff8800966fc180 2041869509 C Co:1:001:0 0 0
ffff8800966fc180 2041925487 S Ci:1:001:0 s a3 00 0000 0007 0004 4 <
ffff8800966fc180 2041925745 C Ci:1:001:0 0 4 = 03051000
ffff8800966fc180 2041981483 S Co:1:001:0 s 23 01 0014 0007 0000 0
ffff8800966fc180 2041981488 C Co:1:001:0 0 0
ffff8800966fc180 2041981499 S Ci:1:000:0 s 80 06 0100 0000 0040 64 <
ffff8800966fc180 2041981622 C Ci:1:000:0 0 18 = 12010002 02000040 8d0e0020 00010102 0001
ffff8800966fc180 2041981704 S Co:1:001:0 s 23 03 0004 0007 0000 0
ffff8800966fc180 2041981708 C Co:1:001:0 0 0
ffff88012eaf30c0 2042037486 S Ci:1:001:0 s a3 00 0000 0007 0004 4 <
ffff88012eaf30c0 2042037743 C Ci:1:001:0 0 4 = 03051000
ffff88012eaf3240 2042093482 S Co:1:001:0 s 23 01 0014 0007 0000 0
ffff88012eaf3240 2042093487 C Co:1:001:0 0 0
ffff88012eaf3240 2042093490 S Co:1:000:0 s 00 05 0019 0000 0000 0
ffff88012eaf3240 2042093620 C Co:1:000:0 0 0
ffff8800966fccc0 2042113486 S Ci:1:025:0 s 80 06 0100 0000 0012 18 <
ffff8800966fccc0 2042113621 C Ci:1:025:0 0 18 = 12010002 02000040 8d0e0020 00010102 0001
ffff8800966fccc0 2042113632 S Ci:1:025:0 s 80 06 0200 0000 0009 9 <
ffff8800966fccc0 2042113745 C Ci:1:025:0 0 9 = 09024300 020103c0 fa
ffff88012eaf36c0 2042113753 S Ci:1:025:0 s 80 06 0200 0000 0043 67 <
ffff88012eaf36c0 2042113869 C Ci:1:025:0 0 67 = 09024300 020103c0 fa090400 00020a00 00040705 01020002 00070581 02000200
ffff8800966fc840 2042113880 S Ci:1:025:0 s 80 06 0300 0000 00ff 255 <
ffff8800966fc840 2042113995 C Ci:1:025:0 0 4 = 04030904
ffff88012eaf33c0 2042114001 S Ci:1:025:0 s 80 06 0302 0409 00ff 255 <
ffff88012eaf33c0 2042114120 C Ci:1:025:0 0 34 = 22034d00 54003600 35007800 78002000 50007200 65006c00 6f006100 64006500
ffff8800966fc900 2042114127 S Ci:1:025:0 s 80 06 0301 0409 00ff 255 <
ffff8800966fc900 2042114244 C Ci:1:025:0 0 18 = 12034d00 65006400 69006100 54006500 6b00
ffff88012eaf3f00 2042114373 S Co:1:025:0 s 00 09 0001 0000 0000 0
ffff88012eaf3f00 2042114494 C Co:1:025:0 0 0
ffff88012eaf3f00 2042114516 S Ci:1:025:0 s 80 06 0303 0409 00ff 255 <
ffff88012eaf3f00 2042127621 C Ci:1:025:0 0 52 = 34035500 53004200 20004300 44004300 20004100 43004d00 20006600 6f007200
ffff88012eaf3000 2042127668 S Ci:1:025:0 s 80 06 0304 0409 00ff 255 <
ffff88012eaf3000 2042147620 C Ci:1:025:0 0 46 = 2e034300 44004300 20004100 43004d00 20004400 61007400 61002000 49006e00
ffff88010255e600 2042147739 S Ci:1:025:0 s 80 06 0305 0409 00ff 255 <
ffff88010255e600 2042187622 C Ci:1:025:0 0 64 = 40034300 44004300 20004100 43004d00 20004300 6f006d00 6d007500 6e006900
ffff8800afde2480 2042187778 S Co:1:025:0 s 21 22 0000 0001 0000 0
ffff8800afde2480 2042207620 C Co:1:025:0 0 0
ffff88010255e9c0 2042207630 S Co:1:025:0 s 21 20 0000 0001 0007 7 = 80250000 000008
ffff88010255e9c0 2042247622 C Co:1:025:0 0 7 >
ffff8800966fccc0 2042247782 S Ci:1:001:0 s a3 00 0000 0008 0004 4 <
ffff8800966fccc0 2042247786 C Ci:1:001:0 0 4 = 00010000
ffff8801387f6c00 2042289608 S Ci:1:025:0 s 80 06 0100 0000 0012 18 <
ffff8801387f6c00 2042289873 C Ci:1:025:0 0 18 = 12010002 02000040 8d0e0020 00010102 0001
ffff8801387f6c00 2042289954 S Ci:1:025:0 s 80 06 0200 0000 0009 9 <
ffff8801387f6c00 2042290120 C Ci:1:025:0 0 9 = 09024300 020103c0 fa
ffff8801387f6c00 2042290191 S Ci:1:025:0 s 80 06 0200 0000 0043 67 <
ffff8801387f6c00 2042290370 C Ci:1:025:0 0 67 = 09024300 020103c0 fa090400 00020a00 00040705 01020002 00070581 02000200
ffff880010e84780 2042687983 S Ci:1:025:0 s 80 06 0100 0000 0040 64 <
ffff880010e84780 2042688124 C Ci:1:025:0 0 18 = 12010002 02000040 8d0e0020 00010102 0001
ffff880135b81b40 2042870615 S Ci:1:025:0 s 80 06 0100 0000 0012 18 <
ffff880135b81b40 2042870746 C Ci:1:025:0 0 18 = 12010002 02000040 8d0e0020 00010102 0001
ffff880135b81b40 2042873619 S Ci:1:025:0 s 80 06 0200 0000 0009 9 <
ffff880135b81b40 2042873745 C Ci:1:025:0 0 9 = 09024300 020103c0 fa
ffff880135b81b40 2042876644 S Ci:1:025:0 s 80 06 0200 0000 00ff 255 <
ffff880135b81b40 2042876745 C Ci:1:025:0 0 67 = 09024300 020103c0 fa090400 00020a00 00040705 01020002 00070581 02000200
ffff880135b81b40 2042878735 S Ci:1:025:0 s 80 06 0300 0000 00ff 255 <
ffff880135b81b40 2042878870 C Ci:1:025:0 0 4 = 04030904
ffff880135b81b40 2042880547 S Ci:1:025:0 s 80 06 0302 0409 00ff 255 <
ffff880135b81b40 2042880619 C Ci:1:025:0 0 34 = 22034d00 54003600 35007800 78002000 50007200 65006c00 6f006100 64006500
ffff880135b81b40 2042882573 S Ci:1:025:0 s 80 06 0300 0000 00ff 255 <
ffff880135b81b40 2042882745 C Ci:1:025:0 0 4 = 04030904
ffff880135b81b40 2042884596 S Ci:1:025:0 s 80 06 0302 0409 00ff 255 <
ffff880135b81b40 2042884746 C Ci:1:025:0 0 34 = 22034d00 54003600 35007800 78002000 50007200 65006c00 6f006100 64006500
ffff880135b81b40 2042893639 S Ci:1:025:0 s 80 06 0100 0000 0012 18 <
ffff880135b81b40 2042893746 C Ci:1:025:0 0 18 = 12010002 02000040 8d0e0020 00010102 0001
ffff880135b81b40 2042897431 S Ci:1:025:0 s 80 06 0200 0000 0109 265 <
ffff880135b81b40 2042897621 C Ci:1:025:0 0 67 = 09024300 020103c0 fa090400 00020a00 00040705 01020002 00070581 02000200
ffff880010e84780 2042968457 S Ci:1:025:0 s a1 21 0000 0001 0007 7 <
ffff880010e84780 2042968622 C Ci:1:025:0 0 7 = 00100e00 000008
ffff880010e84780 2042971448 S Co:1:025:0 s 21 22 0000 0001 0000 0
ffff880010e84780 2042971495 C Co:1:025:0 0 0
ffff880010e84780 2042974372 S Bi:1:025:1 -115 4096 <
ffff880010e84780 2042974494 C Bi:1:025:1 0 5 = 52454144 59
ffff880010e84780 2042974954 S Ii:1:025:3 -115:8192 10 <
ffff880010e84840 2042977027 S Bi:1:025:1 -115 4096 <
ffff880010e84840 2042993620 C Bi:1:025:1 0 5 = 52454144 59
ffff880010e84840 2043005966 S Bi:1:025:1 -115 4096 <
ffff880010e84840 2043013622 C Bi:1:025:1 0 5 = 52454144 59
ffff880135b810c0 2043014928 S Bi:1:025:1 -115 4096 <
ffff880135b810c0 2043033620 C Bi:1:025:1 0 5 = 52454144 59
ffff880135b810c0 2043043989 S Bi:1:025:1 -115 4096 <
ffff880135b810c0 2043053619 C Bi:1:025:1 0 5 = 52454144 59
ffff880135b810c0 2043055982 S Bi:1:025:1 -115 4096 <
ffff880135b810c0 2043073621 C Bi:1:025:1 0 5 = 52454144 59
ffff880010e84a80 2043084907 S Bi:1:025:1 -115 4096 <
ffff880010e84a80 2043093622 C Bi:1:025:1 0 5 = 52454144 59
ffff880135b810c0 2043096902 S Bi:1:025:1 -115 4096 <
ffff880135b810c0 2043113620 C Bi:1:025:1 0 5 = 52454144 59
ffff880010e84c00 2043125962 S Bi:1:025:1 -115 4096 <
ffff880010e84c00 2043133621 C Bi:1:025:1 0 5 = 52454144 59
ffff880010e849c0 2043134932 S Bi:1:025:1 -115 4096 <
ffff880010e849c0 2043153621 C Bi:1:025:1 0 5 = 52454144 59
ffff880135b810c0 2043164022 S Bi:1:025:1 -115 4096 <
ffff880135b810c0 2043173621 C Bi:1:025:1 0 5 = 52454144 59
ffff880010e843c0 2043175966 S Bi:1:025:1 -115 4096 <
ffff880010e843c0 2043193623 C Bi:1:025:1 0 5 = 52454144 59
ffff880135b810c0 2043204906 S Bi:1:025:1 -115 4096 <
ffff880135b810c0 2043213619 C Bi:1:025:1 0 5 = 52454144 59
ffff880010e843c0 2043216901 S Bi:1:025:1 -115 4096 <
ffff880010e843c0 2043233622 C Bi:1:025:1 0 5 = 52454144 59
ffff880135b810c0 2043245965 S Bi:1:025:1 -115 4096 <
ffff880135b810c0 2043253619 C Bi:1:025:1 0 5 = 52454144 59
ffff880010e843c0 2043255579 S Bi:1:025:1 -115 4096 <
ffff880010e843c0 2043273622 C Bi:1:025:1 0 5 = 52454144 59
ffff8800afde2480 2043284544 S Bi:1:025:1 -115 4096 <
ffff8800afde2480 2043293620 C Bi:1:025:1 0 5 = 52454144 59
ffff880010e849c0 2043296548 S Bi:1:025:1 -115 4096 <
ffff880010e849c0 2043313622 C Bi:1:025:1 0 5 = 52454144 59
ffff880010e849c0 2043325462 S Bi:1:025:1 -115 4096 <
ffff880010e849c0 2043333621 C Bi:1:025:1 0 5 = 52454144 59
ffff8800afde2180 2043337461 S Bi:1:025:1 -115 4096 <
ffff8800afde2180 2043353621 C Bi:1:025:1 0 5 = 52454144 59
ffff8800afde2180 2043368270 S Bi:1:025:1 -115 4096 <
ffff8800afde2180 2043373621 C Bi:1:025:1 0 5 = 52454144 59
ffff8800afde2180 2043377239 S Bi:1:025:1 -115 4096 <
ffff8800afde2180 2043393620 C Bi:1:025:1 0 5 = 52454144 59
ffff8800afde2180 2043406157 S Bi:1:025:1 -115 4096 <
ffff8800afde2180 2043413620 C Bi:1:025:1 0 5 = 52454144 59
ffff880010e849c0 2043415258 S Bi:1:025:1 -115 4096 <
ffff880010e849c0 2043433621 C Bi:1:025:1 0 5 = 52454144 59
ffff880010e849c0 2043444177 S Bi:1:025:1 -115 4096 <
ffff880010e849c0 2043453621 C Bi:1:025:1 0 5 = 52454144 59
ffff880010e849c0 2043456175 S Bi:1:025:1 -115 4096 <
ffff880010e849c0 2043473623 C Bi:1:025:1 0 5 = 52454144 59
ffff880010e849c0 2043485237 S Bi:1:025:1 -115 4096 <
ffff880010e849c0 2043493619 C Bi:1:025:1 0 5 = 52454144 59
ffff8800afde20c0 2043497235 S Bi:1:025:1 -115 4096 <
ffff8800afde20c0 2043513619 C Bi:1:025:1 0 5 = 52454144 59
ffff880010e84c00 2043526157 S Bi:1:025:1 -115 4096 <
ffff880010e84c00 2043533620 C Bi:1:025:1 0 5 = 52454144 59
ffff880010e84c00 2043535259 S Bi:1:025:1 -115 4096 <
ffff880010e84c00 2043553619 C Bi:1:025:1 0 5 = 52454144 59
ffff8800afde2c00 2043564182 S Bi:1:025:1 -115 4096 <
ffff8800afde2c00 2043573622 C Bi:1:025:1 0 5 = 52454144 59
ffff8800afde2c00 2043576175 S Bi:1:025:1 -115 4096 <
ffff8800afde2c00 2043593620 C Bi:1:025:1 0 5 = 52454144 59
ffff880010e84a80 2043605237 S Bi:1:025:1 -115 4096 <
ffff880010e84a80 2043613620 C Bi:1:025:1 0 5 = 52454144 59
ffff880010e84a80 2043617235 S Bi:1:025:1 -115 4096 <
ffff880010e84a80 2043633621 C Bi:1:025:1 0 5 = 52454144 59
ffff880010e84a80 2043646159 S Bi:1:025:1 -115 4096 <
ffff880010e84a80 2043653620 C Bi:1:025:1 0 5 = 52454144 59
ffff8800afde29c0 2043655258 S Bi:1:025:1 -115 4096 <
ffff8800afde29c0 2043673620 C Bi:1:025:1 0 5 = 52454144 59
ffff880010e84840 2043684180 S Bi:1:025:1 -115 4096 <
ffff880010e84840 2043693619 C Bi:1:025:1 0 5 = 52454144 59
ffff8800afde2b40 2043696179 S Bi:1:025:1 -115 4096 <
ffff8800afde2b40 2043713621 C Bi:1:025:1 0 5 = 52454144 59
ffff880010e84d80 2043725245 S Bi:1:025:1 -115 4096 <
ffff880010e84d80 2043733621 C Bi:1:025:1 0 5 = 52454144 59
ffff8800afde2240 2043737240 S Bi:1:025:1 -115 4096 <
ffff8800afde2240 2043753620 C Bi:1:025:1 0 5 = 52454144 59
ffff8800afde2600 2043762709 S Bi:1:025:1 -115 4096 <
ffff8800afde2600 2043773620 C Bi:1:025:1 0 5 = 52454144 59
ffff880010e84d80 2043775717 S Bi:1:025:1 -115 4096 <
ffff880010e84d80 2043793620 C Bi:1:025:1 0 5 = 52454144 59
ffff8800afde2a80 2043804639 S Bi:1:025:1 -115 4096 <
ffff8800afde2a80 2043813620 C Bi:1:025:1 0 5 = 52454144 59
ffff880010e84f00 2043816636 S Bi:1:025:1 -115 4096 <
ffff880010e84f00 2043833619 C Bi:1:025:1 0 5 = 52454144 59
ffff880010e84f00 2043845694 S Bi:1:025:1 -115 4096 <
ffff880010e84f00 2043853619 C Bi:1:025:1 0 5 = 52454144 59
ffff880010e84f00 2043854666 S Bi:1:025:1 -115 4096 <
ffff880010e84f00 2043873624 C Bi:1:025:1 0 5 = 52454144 59
ffff880010e84f00 2043883723 S Bi:1:025:1 -115 4096 <
ffff880010e84f00 2043893619 C Bi:1:025:1 0 5 = 52454144 59
ffff8800afde2840 2043895713 S Bi:1:025:1 -115 4096 <
ffff8800afde2840 2043913622 C Bi:1:025:1 0 5 = 52454144 59
ffff880010e84f00 2043924641 S Bi:1:025:1 -115 4096 <
ffff880010e84f00 2043933621 C Bi:1:025:1 0 5 = 52454144 59
ffff880010e84f00 2043936634 S Bi:1:025:1 -115 4096 <
ffff880010e84f00 2043953619 C Bi:1:025:1 0 5 = 52454144 59
ffff880010e84f00 2043965694 S Bi:1:025:1 -115 4096 <
ffff880010e84f00 2043973620 C Bi:1:025:1 0 5 = 52454144 59
ffff880010e84f00 2043974657 S Bi:1:025:1 -115 4096 <
ffff880010e84f00 2043993620 C Bi:1:025:1 0 5 = 52454144 59
ffff8800afde2300 2044003717 S Bi:1:025:1 -115 4096 <
ffff8800afde2300 2044013620 C Bi:1:025:1 0 5 = 52454144 59
ffff880010e84d80 2044015717 S Bi:1:025:1 -115 4096 <
ffff880010e84d80 2044033620 C Bi:1:025:1 0 5 = 52454144 59
ffff8800afde2300 2044044636 S Bi:1:025:1 -115 4096 <
ffff8800afde2300 2044053620 C Bi:1:025:1 0 5 = 52454144 59
ffff8800afde2540 2044056637 S Bi:1:025:1 -115 4096 <
ffff8800afde2540 2044073620 C Bi:1:025:1 0 5 = 52454144 59
ffff8800afde2540 2044085695 S Bi:1:025:1 -115 4096 <
ffff8800afde2540 2044093620 C Bi:1:025:1 0 5 = 52454144 59
ffff8800afde2540 2044094656 S Bi:1:025:1 -115 4096 <
ffff8800afde2540 2044113619 C Bi:1:025:1 0 5 = 52454144 59
ffff8800afde2540 2044123716 S Bi:1:025:1 -115 4096 <
ffff8800afde2540 2044133620 C Bi:1:025:1 0 5 = 52454144 59
ffff8800afde2540 2044135718 S Bi:1:025:1 -115 4096 <
ffff8800afde2540 2044153620 C Bi:1:025:1 0 5 = 52454144 59
ffff880010e84840 2044164636 S Bi:1:025:1 -115 4096 <
ffff880010e84840 2044173620 C Bi:1:025:1 0 5 = 52454144 59
ffff8800afde2000 2044176641 S Bi:1:025:1 -115 4096 <
ffff8800afde2000 2044193622 C Bi:1:025:1 0 5 = 52454144 59
ffff880010e84a80 2044205695 S Bi:1:025:1 -115 4096 <
ffff880010e84a80 2044213619 C Bi:1:025:1 0 5 = 52454144 59
ffff880010e84a80 2044214656 S Bi:1:025:1 -115 4096 <
ffff880010e84a80 2044233620 C Bi:1:025:1 0 5 = 52454144 59
ffff880010e84a80 2044243715 S Bi:1:025:1 -115 4096 <
ffff880010e84a80 2044253620 C Bi:1:025:1 0 5 = 52454144 59
ffff880010e84a80 2044255716 S Bi:1:025:1 -115 4096 <
ffff880010e84a80 2044273620 C Bi:1:025:1 0 5 = 52454144 59
ffff880010e84a80 2044284637 S Bi:1:025:1 -115 4096 <
ffff880010e84a80 2044293619 C Bi:1:025:1 0 5 = 52454144 59
ffff880010e84c00 2044301210 S Bi:1:025:1 -115 4096 <
ffff880010e84c00 2044313621 C Bi:1:025:1 0 5 = 52454144 59
ffff8800afde26c0 2044322686 S Bi:1:025:1 -115 4096 <
ffff8800afde26c0 2044333622 C Bi:1:025:1 0 5 = 52454144 59
ffff8800afde26c0 2044335695 S Bi:1:025:1 -115 4096 <
ffff8800afde26c0 2044353621 C Bi:1:025:1 0 5 = 52454144 59
ffff880010e849c0 2044364762 S Bi:1:025:1 -115 4096 <
ffff880010e849c0 2044373745 C Bi:1:025:1 0 5 = 52454144 59
ffff880010e849c0 2044376759 S Bi:1:025:1 -115 4096 <
ffff880010e849c0 2044393744 C Bi:1:025:1 0 5 = 52454144 59
ffff8800afde26c0 2044405676 S Bi:1:025:1 -115 4096 <
ffff8800afde26c0 2044413746 C Bi:1:025:1 0 5 = 52454144 59
ffff8800afde26c0 2044414639 S Bi:1:025:1 -115 4096 <
ffff8800afde26c0 2044433746 C Bi:1:025:1 0 5 = 52454144 59
ffff8800afde26c0 2044443698 S Bi:1:025:1 -115 4096 <
ffff8800afde26c0 2044453747 C Bi:1:025:1 0 5 = 52454144 59
ffff880010e843c0 2044456710 S Bi:1:025:1 -115 4096 <
ffff880010e843c0 2044473746 C Bi:1:025:1 0 5 = 52454144 59
ffff880010e843c0 2044485775 S Bi:1:025:1 -115 4096 <
ffff880010e843c0 2044493745 C Bi:1:025:1 0 5 = 52454144 59
ffff880010e843c0 2044497756 S Bi:1:025:1 -115 4096 <
ffff880010e843c0 2044513745 C Bi:1:025:1 0 5 = 52454144 59
ffff880010e843c0 2044526685 S Bi:1:025:1 -115 4096 <
ffff880010e843c0 2044533744 C Bi:1:025:1 0 5 = 52454144 59
ffff880010e843c0 2044535650 S Bi:1:025:1 -115 4096 <
ffff880010e843c0 2044553745 C Bi:1:025:1 0 5 = 52454144 59
ffff880010e843c0 2044564711 S Bi:1:025:1 -115 4096 <
ffff880010e843c0 2044573745 C Bi:1:025:1 0 5 = 52454144 59
ffff8800afde2f00 2044576714 S Bi:1:025:1 -115 4096 <
ffff8800afde2f00 2044593747 C Bi:1:025:1 0 5 = 52454144 59
ffff8800afde2f00 2044605770 S Bi:1:025:1 -115 4096 <
ffff8800afde2f00 2044613747 C Bi:1:025:1 0 5 = 52454144 59
ffff880010e849c0 2044617761 S Bi:1:025:1 -115 4096 <
ffff880010e849c0 2044633745 C Bi:1:025:1 0 5 = 52454144 59
ffff880134d1b0c0 2044634131 C Ii:1:001:1 0:2048 2 = 8000
ffff880134d1b0c0 2044634136 S Ii:1:001:1 -115:2048 4 <
ffff880010e84c00 2044634143 S Ci:1:001:0 s a3 00 0000 0007 0004 4 <
ffff880010e84c00 2044634146 C Ci:1:001:0 0 4 = 00010100
ffff880010e84c00 2044634148 S Co:1:001:0 s 23 01 0010 0007 0000 0
ffff880010e84c00 2044634151 C Co:1:001:0 0 0
ffff880010e84780 2044634334 C Ii:1:025:3 -108:8192 0
ffff88000960f180 2044637687 S Ci:1:001:0 s a3 00 0000 0007 0004 4 <
ffff88000960f180 2044637692 C Ci:1:001:0 0 4 = 00010000
ffff88012bfdda80 2044669523 S Ci:1:001:0 s a3 00 0000 0007 0004 4 <
ffff88012bfdda80 2044669529 C Ci:1:001:0 0 4 = 00010000
ffff88012bfdde40 2044701493 S Ci:1:001:0 s a3 00 0000 0007 0004 4 <
ffff88012bfdde40 2044701499 C Ci:1:001:0 0 4 = 00010000
ffff88012bfdde40 2044733483 S Ci:1:001:0 s a3 00 0000 0007 0004 4 <
ffff88012bfdde40 2044733489 C Ci:1:001:0 0 4 = 00010000
ffff88012bfdde40 2044765488 S Ci:1:001:0 s a3 00 0000 0007 0004 4 <
ffff88012bfdde40 2044765494 C Ci:1:001:0 0 4 = 00010000
ffff88012bfdde40 2044765497 S Ci:1:001:0 s a3 00 0000 0008 0004 4 <
ffff88012bfdde40 2044765499 C Ci:1:001:0 0 4 = 00010000
